title: Ukraine NABC Sanctions Tracker
entry_point: crawler.py
prefix: ua-nazk
coverage:
  frequency: daily
deploy:
  schedule: "0 */3 * * *"
  memory: 1500Mi
load_db_uri: ${OPENSANCTIONS_DATABASE_URI}
summary: >
  A list of suggested Russia-related sanctions targets composed by the
  Ukrainian anti-corruption agency.
description: |
  > The War and Sanctions website engages citizens in the sanctioning process, and
  > gives people power to hold accountable the people fueling Russia's war against
  > Ukraine. It follows in the epistolary tradition of the classic novel that shares
  > a similar name.

  (That'sa pretty amazing mission statement for a government project!)

  The dataset contains information on individuals and entities subject to sanctions
  as well information on individuals and entities that are likely to be subjected to
  sanctions. In the future, the agency plans to include information on assets of
  sanctioned individuals.
publisher:
  name: National Agency on Corruption Prevention
  description: >
    The National Agency on Corruption Prevention is a central executive body with a
    special status. It is responsible for the development of anti-corruption
    policy and prevention of corruption. The National Agency was established
    in accordance with the Law of Ukraine on Prevention of Corruption.
  url: https://nazk.gov.ua/en/
  country: ua
  official: true
url: https://sanctions.nazk.gov.ua/
data:
  url: https://sanctions.nazk.gov.ua/api/
  format: JSON

lookups:
  relations:
    options:
      - match:
          - null
          - "NULL"
          - "-"
          - друг
          - кандидат в президенти
          - засновник
          - довіритель
          - колега по партії, керівник
          - Отримує від Козака Тараса фінансові кошти через компанію Регіон (Роснефть) Козаком Тарасом у розділі фін потоків від діяльності Заводу ТОВ Солікамський Магнієвий Завод
          - Отримував кошти з компанії Медведчука як партнер по угодам
          - Покровитель Силантьева та ідеолог організації схем фінансування тероризму
        contains:
          - Kopy Goldfields
        schema: UnknownLink
        local: subject
        remote: object
      - match:
          - місце роботи
        schema: Employment
        local: employee
        remote: employer
      - match:
          - працівник
        schema: Employment
        local: employer
        remote: employee
      - match:
          - підконтрольна компанія
        schema: Directorship
        local: director
        remote: organization
      - match:
          - співвласник
        schema: Ownership
        local: owner
        remote: asset
      - match:
          - перший заступник голови
          - в.о. директора департаменту
          - член ради директорів
          - начальник департаменту
          - перший заступник начальника департаменту
          - заступник голови
          - член національної фінансової ради
          - голова
          - "статс-секретар"
          - "статс-секретар - заступник голови"
          - т.в.о.керівника
          - директор департаменту
          - головний аудитор
          - заступник начальника управління
          - Керівник
          - Член Ради директорів ФосАгро
          - Співвласник ФосАгро
          - Член Ради директорів ФосАгро
          - керуюча компанія
          - заступник керівника
          - в.о.керівника
        schema: Directorship
        local: organization
        remote: director
      - match:
          - бізнес партнер
          - колега
          - ділові відносини
          - керівник
          - підлеглий
          - підлегла
          - помічник
          - колишній підлеглий
          - знайомий
          - сват
          - соратник
          - колишній керівник
          - довірена особа
          - соратниця
          - наступник
          - сваха
          - попередник
          - колеги
          - знайома
          - радник
          - сораник
          - помічниця
          - дружинапідлеглого
          - пдлеглий
          - вчитель
          - бізнес патнер
          - Бізнес партнер
          - нступник
          - ділові відносни
          - партнер
          - Соратник
          - Підлеглий
          - Демченко близький друг сім'ї Рогозіна Д.О.
          - Безпосередній керівник
          - Близький товариш та тримач активів
          - Друг
          - Діловий партнер
          - колега, друг
          - колега, бізнес партнер
          - Колега
          - Протеже
          - сетра
          - бізнеспартнер
          - Товариш і колега
          - Близький товариш
          - Партнер та тримач активів
        contains:
          - Разом організовували схему
          - псевдонімом SHAMAN
        schema: Associate
        local: person
        remote: associate
      - match:
          - батько
          - сестра
          - брат
          - син
          - дружина
          - дядько
          - мати
          - чоловік
          - дочка
          - племінник
          - шурин
          - онук
          - онучка
          - невістка
          - теща
          - тітка
          - коханка
          - зять
          - тесть
          - родич
          - свекор
          - падчерка
          - племінниця
          - двоюрідний дядько
          - колишній чоловік
          - дід
          - цивільна дружина
          - хрещений батько
          - коханець
          - родичка
          - родич
          - кум
          - Син
          - Батько
          - кума
          - вітчим
          - своячка
          - свояк
          - донька
          - пасинок
          - двоюрідний брат
          - колишня дружина
          - колишній тесть
          - колишній зять
          - двоюрідна племінниця
          - брат невістки
          - мачуха
          - дівер
          - хрещениця
          - двоюрідний племінник
          - відчим
          - двоюрідна сестра
          - цивільний чоловік
          - зовиця
          - падчериця
          - Двоюрідна сестра
          - Партнер
          - Зять
          - Чоловік
          - Дружина
          - Тесть
          - Теща
          - учень
          - баба
          - бабуся
          - свекруха
          - онука
          - колишня теща
          - зведена сестра
          - зведений брат
          - сеста
          - дідусь
          - внучка
          - золовка
          - тіткв
          - Двоюрідний брат
        contains:
          - чоловік у цивільному шлюбі
          - Є братом
        schema: Family
        local: person
        remote: relative

  type.address:
    lowercase: true
    options:
      - match:
          - Russia
          - n/a
        value: null
      - match:
          - Moscow
          - МОСКВА
        value: Moscow
  type.identifier:
    options:
      - match:
          - "N/A"
        value: null
  type.date:
    options:
      - match:
          - 15.01.196
          - 19.10.yyyy
          - 29.07.yyyy
          - 19.11.уууу
          - 27.07.уууу
          - 13.01.уууу
          - 25.11.yy.
          - "--"
          - "21"
          - "09"
          - невідомо
          - "dd.mm"
          - "dd.mm.pppp"
          - "N/А"
          - "Невідомо"
          - "неизвестно"
          - "790104168734"
        contains:
          - ".yyyy"
          - ".19yy"
        value: null
      - match: 21.03.1965to20.03.1966
        values:
          - 1965-03-21
          - 1966-03-20
      - match: 29.02.1963
        value: 1963-02
      - match: "dd.mm.19449"
        value: 1949
      - match: "03011978"
        value: 1978-01-03
      - match: "18.10.979"
        value: "1979-10-18"
      - match: "21.03.961"
        value: "1961-03-21"
      - match: 03.1968-03.1969
        values:
          - 1968
          - 1969
      - match: 122.04.1958
        value: "1958-04-12"
      - match: 25.04.1960(1959)
        values:
          - "1960-04-25"
          - "1959-04-25"
      - match: 8серпня1948
        value: "1948-08-08"
      - match: 01.01.1971to31.01.1971
        value: 1971-01
      - match: 10.022.1952
        value: "1952-02-10"
      - match: 07.05.1981/07.05.1979
        values:
          - 1981-05-07
          - 1979-05-07
      - match: 23.11.1961р.н
        value: "1961-11-23"
      - match: "02.071973"
        value: 1973-07-02
      - match: 24.11.1988р
        value: "1988-11-24"
      - match: 23.02.1969/
        value: "1969-02-23"
      - match: 01.02.1958-28.02.1958
        value: 1958-02
      - match: 07.01.1967or01.07.1967
        values:
          - "1967-01-07"
          - "1967-07-01"
      - match: 05/04.08.1980
        value: "1980-08-04"
      - match: 3серпня1950
        value: "1950-08-03"
      - match: 23.10.1951/1953
        values:
          - 1951-10-23
          - 1953-10-23
      - match: 05.09.1962(1952)
        value: "1962-09-05"
      - match: 01.02.1979/01.02.1980
        values:
          - 1979-02-01
          - 1980-02-01
      - match: 06.01.1996/07.01.1996
        values:
          - 1996-01-07
          - 1996-01-06
      - match: 27.11.1961/1965
        values:
          - "1965-11-27"
          - "1961-11-27"
      - match: 23.08.1968(24.05.1972)
        values:
          - "1968-08-23"
          - "1972-05-24"
      - match: "21.02.1975/21.04.1975"
        values:
          - 1975-02-21
          - 1975-04-21
      - match: "01.03.1984/09.04.1984"
        values:
          - 1984-03-01
          - 1984-04-01
      - match: "01.01.1966/25.12.1965"
        values:
          - 1966-01-01
          - 1965-12-25
      - match: "9.6.1981or1982"
        values:
          - "1982"
          - "1981-06-09"
      - match: 04/08/1977
        value: "1977-08-04"
      - match: "08.081959"
        value: "1989-08-08"
