title: French National Asset Freezing System
entry_point: crawler.py
prefix: fr-ga
coverage:
  schedule: "0 */3 * * *"
  frequency: daily
  start: 2021-02-12
load_statements: true
summary: >
  The register lists all persons, entities and vessels subject to asset
  freezing measures in force on French territory, pursuant to national,
  European and international (UN) provisions.
description: |
  By virtue of the provisions of Article L 562-4 of the Monetary and Financial
  Code, whether decided by the United Nations, by the European Union or on a
  national basis, the asset freezing measures are applicable without deadline
  by natural and legal persons.

  In order to know the list of persons and entities sanctioned, DG Trésor
  publishes and updates the national register of asset freezing measures. This
  lists all the people, entities and vessels affected by the asset freezing
  measures in force throughout France.
tags:
  - list.sanction
  - juris.eu
  - issuer.west
  - sector.maritime
publisher:
  name: Direction Générale du Trésor
  acronym: DGT
  country: fr
  url: https://www.tresor.economie.gouv.fr/
  official: true
url: https://gels-avoirs.dgtresor.gouv.fr/
data:
  url: https://gels-avoirs.dgtresor.gouv.fr/ApiPublic/api/v1/publication/derniere-publication-fichier-json
  format: JSON
  lang: fra
dates:
  formats: ["%d.%m.%Y", "%Y"]

assertions:
  min:
    schema_entities:
      Person: 3430
      Organization: 950
      LegalEntity: 35
      Vessel: 35
      Company: 100
  max:
    schema_entities:
      Person: 8070
      Organization: 2240
      LegalEntity: 120
      Vessel: 80
      Company: 150

lookups:
  sanction.program:
    options:
      - contains:
          - art L. 562-3 du code monétaire et financier
          - art L. 562-2 du code monétaire et financier
        value: "FR-CMF-562"
      - contains: "ONU République démocratique du Congo - RCSNU 1533 (2004) et R (CE) 1183/2005"
        value: UN-SC1533
      - contains: "ONU Afghanistan/Taliban - Résolution 1988 (2011) du CSNU et R (UE) 753/2011"
        value: UN-SC1988
      - contains: "ONU Al Qaeda Etat - Islamique - RCSNU 1267 (1999) et R (UE) 881/2002"
        value: UN-SCISIL
      - contains: "ONU Corée du Nord - RCSNU 1718 (2006) et R (UE) 2017/1509"
        value: UN-SC1718
      - contains: "ONU Haïti - RCSNU 2653 (2022)  - R (UE) 2022/2309"
        value: UN-SC2653
      - contains: "ONU Yemen - RCSNU 2140 (2014) et R (UE) 1352/2014"
        value: UN-SC2140
      - contains: "ONU Libye - RCSNU 1970/2011 et R (UE) 2016/44"
        value: UN-SC1970
      - contains: "ONU Irak - RCSNU 1518 (2003) et R (CE) 1210/2003"
        value: UN-SC1518
      - contains: "ONU Iran prolifération - RCSNU 1737 (2006) et suivantes"
        value: UN-SC1737
      - contains: "ONU République centrafricaine - RCSNU 2127 (2013) et R (UE) 224/2014"
        value: UN-SC2127
      - contains: "ONU Soudan du sud - RCSNU 2206 (2015)  et R (UE) 2015/735"
        value: UN-SC2206
      - contains: "ONU Soudan - RCSNU  1591 (2005) et R (UE) 747/2014"
        value: UN-SC1591
      - contains:
          - "UE Ukraine intégrité territoriale - R (UE) 269/2014"
          - "UE Ukraine biens mal acquis - R (UE) 208/2014"
        value: EU-UKR
      - contains: "UE Libye - R (UE) 2016/44"
        value: EU-LBY
      - contains:
          - "UE Iran prolifération - R (UE) 267/2012"
          - "UE Iran répression - R (UE) 359/2011"
          - "UE Iran - Soutien militaire dans le conflit Russie/Ukraine  - R(UE) 2023/1529"
          - "ONU Iran prolifération - RCSNU 1737 (2006) et R (UE) 267/2012"
        value: EU-IRN
      - contains:
          - "UE Etat islamique - Al Qaida - R (UE) 2016/1686"
          - "UE Al Qaeda - Etat Islamique - règlement (UE) 881/2002"
        value: EU-TAQA-EUAQ
      - contains: "UE Biélorussie - R (CE) 765/2006"
        value: EU-BLR
      - contains: "UE République démocratique du Congo - R (UE) 1183/2005"
        value: EU-COD
      - contains: "UE Syrie - R (UE) 36/2012"
        value: EU-SYR
      - contains: "UE Nicaragua - R (UE) 2019/1716"
        value: EU-NIC
      - contains: "UE Myanmar (ex Birmanie) - R (UE) 401/2013"
        value: EU-MMR
      - contains: "UE Venezuela - R (UE) 2017/2063"
        value: EU-VEN
      - contains: "UE Corée du Nord - Règlement (UE) 2017/1509"
        value: EU-PRK
      - contains: "UE Cyberattaques - R (UE) 2019/796"
        value: EU-CYB
      - contains: "UE personnes impliquées dans des actes de terrorisme - R (UE) 2580/2001"
        value: EU-TERR
      - contains: "UE Violation des droits de l'homme - R (UE) 2020/1998"
        value: EU-HR
      - contains: "UE Burundi - R (UE) 2015/1755)"
        value: EU-BDI
      - contains: UE Guinée-Bissau - R (UE) 377/2012
        value: EU-GNB
      - contains: "UE Guatemala - R (UE) 2024/287"
        value: EU-GTM
      - contains: "UE Hamas - Jihad islamique palestinien - R (UE) 2024/386"
        value: EU-HAM
      - contains: "UE Lutte contre la prolifération des armes chimiques - R (UE) 2018/1542"
        value: EU-CHEM
      - contains: "UE Mali - R (UE) 2017/1770"
        value: EU-MLI
      - contains: UE Moldavie  - R (UE) 2023/888
        value: EU-MDA
      - contains: "UE République de Guinée - R (UE) 1284/2009"
        value: EU-GIN
      - contains: "UE Russie - Activités déstabilisatrices - R (UE) 2024/2642"
        value: EU-RUSDA
      - contains: "UE Russie répression R (UE) 2024/1485"
        value: EU-RUS
      - contains: "UE Soudan du sud - R (UE) 2015/735"
        value: EU-SSD
      - contains: "UE Tunisie - R (UE) 101/2011"
        value: EU-TUN
      - contains: "UE Turquie - R (UE) 2019/1890)"
        value: EU-TUR
      - contains: "ONU Somalie - RCSNU 751 (1992) et R (UE) 356/2010"
        value: EU-SOM
      - contains: "UE Soudan - Activités compromettant la stabilité et la transition politique - R (UE) 2023/2147"
        value: EU-SDNZ
  schema_override:
    options:
      - match:
          - fr-ga-5143
          - fr-ga-5142
        value: Vessel
      - match:
          - fr-ga-8393
        value: Organization
  type.address:
    lowercase: true
    options:
      - match:
          - Qatar
        value: null
      - match:
          - "3rd Km of Khalaj Road, Seyyedi Street, Mashad 91638, Iran, Km 4 of Khalaj Road, End of Seyedi Street, Mashad, Iran, P.O. Box 91735-549, Mashad, Iran, Khalaj Rd., End of Seyyedi Alley, Mashad, Iran, Moqan St., Pasdaran St., Pasdaran Cross Rd., Téhéran, Iran."
          - "3rd Km of Khalaj Road, Seyyedi Street, Mashad 91638, Iran; Km 4 of Khalaj Road, End of Seyedi Street, Mashad, Iran; P.O. Box 91735-549, Mashad, Iran; Khalaj Rd., End of Seyyedi Alley, Mashad, Iran; Moqan St., Pasdaran St., Pasdaran Cross Rd., Téhéran, Iran."
        values:
          - 3rd Km of Khalaj Road, Seyyedi Street, Mashad 91638, Iran
          - Km 4 of Khalaj Road, End of Seyedi Street, Mashad, Iran
          - P.O. Box 91735-549, Mashad, Iran
          - Khalaj Rd., End of Seyyedi Alley, Mashad, Iran
          - Moqan St., Pasdaran St., Pasdaran Cross Rd., Téhéran, Iran.
      - match:
  type.email:
    options:
      - contains: hotelminsk@udp.gov.by
        values:
          - hotelminsk@udp.gov.by
          - marketing@hotelminsk.by
  type.gender:
    lowercase: true
    normalize: true
    options:
      - match: Masculin
        value: male
      - match: Féminin
        value: female
  type.country:
    options:
      - match: KURDISTAN IRAKIEN
        value: IQ
      - match:
          - "Fédération de Russie"
          - "Fédération de Russi e"
        value: RU
  type.identifier:
    options:
      - match: "BMJIIRT"
        value: BMJIIRTH # BANK MARKAZI JOMHOURI ISLAMI IRAN
      - match:
          - 5878431
          - 644101001
        prop: registrationNumber
  identification_segment:
    lowercase: true
    normalize: true
    options:
      # Sometimes for "Numero OGRN" and "Numero OMI", a "Numero" is left over
      - match:
          - "Numero"
          - "n°"
          - "No"
          - "numéro d'identification fiscale)"
        value: null
      # Sometimes leftover from "NIF/INN"
      - match: "NIF"
      - match: "Numéro d'enregistrement"
      - match: "Code"
      - match:
          - "Principal établissement: Moscou, Fédération de Russie"
          - "Lieu d'enregistrement: Moscou, Fédération de Russie"
        props:
          jurisdiction: ru
          address: "Moscou, Fédération de Russie"
      - match:
          - "Principal établissement: Moscou, Russie"
          - "Lieu d'enregistrement: Moscou, Russie"
        props:
          jurisdiction: ru
          address: "Moscou, Russie"
      - match: "Lieu d'enregistrement: Fédération de Russie"
        props:
          jurisdiction: ru
      - match: "Lieu d'enregistrement: Israël"
        props:
          jurisdiction: il
      - match: "Lieu d'enregistrement: Turquie"
        props:
          jurisdiction: tr
      - match: "Lieu d'enregistrement: Hong Kong"
        props:
          jurisdiction: hk
      - match: "Lieu d'enregistrement: Fédération de Russie, région de Sverdlovsk, Yekaterinburg"
        props:
          address: "Lieu d'enregistrement: Fédération de Russie, région de Sverdlovsk, Yekaterinburg"
      - match: "Lieu d'enregistrement: Fédération de Russie - Lieu d'enregistrement: Fédération de Russie"
        props:
          jurisdiction: ru
      - match: "Lieu d'enregistrement: République populaire de Chine"
        props:
          jurisdiction: cn
      - match: "Principal établissement: Crimée, Ukraine"
        props:
          address: "Crimée, Ukraine"
      - match: "Siège principal d'exploitation: République populaire de Chine"
        props:
          jurisdiction: cn
      - match: "Lieu d'enregistrement: Prague"
        props:
          jurisdiction: cz
          address: "Prague"
      - match: "Principal établissement: République populaire de Chine; Fédération de Russie"
        props:
          jurisdiction:
            - cn
            - ru
      - match: "Entités associées : GTLK Europe, GTLK Asia, GTLK Middle East: Société de transport"
        associates:
          - GTLK Europe
          - GTLK Asia
          - GTLK Middle East
      - match: "Personnes associées: Andrei Leonidowitsch KOSTIN (président du conseil de direction); Anton SILUANOV (président du conseil de surveillance)"
        associates:
          - Andrei Leonidowitsch KOSTIN
          - Anton SILUANOV
      - match: "Personnes associées: Georgieva Elena ALEKSANDROVNA (présidente
          du conseil de direction) - Andrey Valeryevich KONDRATYEV (président du conseil
          d'administration)"
        associates:
          - Georgieva Elena ALEKSANDROVNA
          - Andrey Valeryevich KONDRATYEV
      - match: "Entité associée: Rostec (société d'État russe du domaine
          des technologies): Banque commerciale anonyme"
        associates:
          - Rostec
      - match: "Entités associées:  Tatneft-Neftekhim;  Nizhnekamskshina;  Nizhnekamsk All-Steel Tyre Plant"
        associates:
          - Tatneft-Neftekhim
          - Nizhnekamskshina
          - Nizhnekamsk All-Steel Tyre Plant
      - match: "Entités associées:  Trading House KAMA  Management Company Tatneft-Neftekhim  Nizhnekamsk All-Steel Tyre Plant"
        associates:
          - Trading House KAMA
          - Management Company Tatneft-Neftekhim
          - Nizhnekamsk All-Steel Tyre Plant
      - match: "Entités associées: Trading House KAMA  Management Company Tatneft-Neftekhim  Nizhnekamskshina"
        associates:
          - Trading House KAMA
          - Management Company Tatneft-Neftekhim
          - Nizhnekamskshina
      - match: "Date d’enregistrement: 13.11.2018: 1189112039291"
        props:
          registrationNumber: 1189112039291
          incorporationDate: 2018-11-13
      - match: "Date d’enregistrement:10.12.1992: 1027802749061"
        props:
          registrationNumber: 1027802749061
          incorporationDate: 1992-12-10
      - match: "Date d'enregistrement : 04/01/1996: 600390798"
        props:
          registrationNumber: 600390798
          incorporationDate: 1996-01-04
      - match: "Date d’enregistrement: 15.5.2009: 1096659005200"
        props:
          registrationNumber: 1096659005200
          incorporationDate: 2009-05-15
      - match: 'Entités associées: le soi-disant "gouvernement" de la soi-disant "République populaire de Donetsk"'
        associates:
          - le soi-disant gouvernement de la soi-disant République populaire de Donetsk
      - match: "Type d'entité: entreprise contrôlée par l'État"
        props:
          legalForm: entreprise contrôlée par l'État
      - match: "Type d'entité: société anonyme par actions"
        props:
          legalForm: société anonyme par actions
      - match: "Type d'entité: Société par actions ouverte"
        props:
          legalForm: Société par actions ouverte
      - match: "Type d'entité: société à responsabilité limitée"
        props:
          legalForm: société à responsabilité limitée
      - match: "Type d'entité: société par actions non publique"
        props:
          legalForm: société par actions non publique
      - match: "Type d'entité: organisation à but non lucratif"
        props:
          legalForm: organisation à but non lucratif
      - match: "Type d'entité: entreprise unitaire d'État"
        props:
          legalForm: entreprise unitaire d'État
      - match: "Type d'entité: société par actions"
        props:
          legalForm: société par actions
      - match: "Type d'entité: société par actions"
        props:
          legalForm: société par actions
      - match: "Type d'entité: société publique par actions"
        props:
          legalForm: société publique par actions
      - match: "Type d'entité: Banque commerciale anonyme"
        props:
          legalForm: Banque commerciale anonyme
      - match: "Type d'entité: société d'État"
        props:
          legalForm: société d'État
      - match: "Type d'entité: société anonyme"
        props:
          legalForm: société anonyme
      - match: "Type d'entité: Société d'assurance par actions"
        props:
          legalForm: Société d'assurance par actions
      - match: "Type d'entité: société de zone franche"
        props:
          legalForm: société de zone franche
      - match: "Type d'entité: société à responsabilité limitée (s.r.o.)"
        props:
          legalForm: société à responsabilité limitée (s.r.o.)
      - match: "Type d'entité: agence fédérale"
        props:
          legalForm: agence fédérale
      - match: "Type d'entité: entreprise d'État fédérale"
        props:
          legalForm: entreprise d'État fédérale
      - match: "Type d'entité: entreprise publique de droit privé"
        props:
          legalForm: entreprise publique de droit privé
      - match: "Type d'entité: société à responsabilité limitée (LLC)"
        props:
          legalForm: société à responsabilité limitée (LLC)
      - match: "Type d'entité: société privée par actions"
        props:
          legalForm: société privée par actions
      - match: "Type d'entité: société par actions fermée"
        props:
          legalForm: société par actions fermée
      - match: "Type d'entité: Bloc politique"
        props:
          legalForm: Bloc politique
      - match: "Type d'entité: Organisation autonome à but non lucratif"
        props:
          legalForm: Organisation autonome à but non lucratif
      - match: "Lieu d'enregistrement: Fédération de Russie (197046, Saint-Pétersbourg, ul. Malaia Posadskaia, 30)"
        props:
          jurisdiction: ru
          address: "Fédération de Russie (197046, Saint-Pétersbourg, ul. Malaia Posadskaia, 30)"
      - match: "Lieu d'enregistrement: Fédération de Russie (141983, région de Moscou, Dubna, Zhukovsky Str. 2, building 1)"
        props:
          jurisdiction: ru
          address: "Fédération de Russie (141983, région de Moscou, Dubna, Zhukovsky Str. 2, building 1)"
      - match: "Lieu d'enregistrement: Fédération de Russie (Moscou, Proezd-12 Maryina Roshcha, d. 9, str. 1)"
        props:
          jurisdiction: ru
          address: "Fédération de Russie (Moscou, Proezd-12 Maryina Roshcha, d. 9, str. 1)"
      - match: "Principaux établissements: Ukraine, Fédération de Russie"
        props:
          address: "Ukraine, Fédération de Russie"
      - match: "Lieu d'enregistrement: Degtyarnyy - Pereulok, 11a, Saint Pétersbourg, 191144, - Fédération de Russie"
        props:
          jurisdiction: ru
          address: "Degtyarnyy - Pereulok, 11a, Saint Pétersbourg, 191144, - Fédération de Russie"
      - match: "Lieu d'enregistrement: Zelenodolsk, République du Tatarstan, Fédération de Russie (422540, République du Tatarstan, r-n Zelenodolskii, Zelenodolsk, ul. Lenina, 41A)"
        props:
          jurisdiction: ru
          address: "Zelenodolsk, République du Tatarstan, Fédération de Russie (422540, République du Tatarstan, r-n Zelenodolskii, Zelenodolsk, ul. Lenina, 41A)"
      - match: "Fondée le 27.6.1990"
        props:
          incorporationDate: 1990-06-27
      - match: "Entreprise individuelle enregistrée le 01/04/2018, immatriculée au RCS sous le n° SIRET 83866842400016: SIRET 83866842400016"
        props:
          incorporationDate: 2018-04-01
          registrationNumber: 83866842400016
      - match: "Lieu d'enregistrement: Ukraine (283001, Donetsk, Komsomolsky prospect, 6a)"
        props:
          jurisdiction: ua
          address: "Ukraine (283001, Donetsk, Komsomolsky prospect, 6a)"
      - match: "Lieu d'enregistrement: région de Nijni Novgorod, Fédération de Russie"
        props:
          jurisdiction: ru
          address: "région de Nijni Novgorod, Fédération de Russie"
      - match: "Lieu d'enregistrement: Fédération de Russie (248600, Kalouga, Voskresenskiy per, 28)"
        props:
          jurisdiction: ru
          address: "Fédération de Russie (248600, Kalouga, Voskresenskiy per, 28)"
      - match: "Lieu d'enregistrement: Fédération de Russie (194021, Saint-Pétersbourg, ul. Karbysheva, 15)"
        props:
          jurisdiction: ru
          address: "Fédération de Russie (194021, Saint-Pétersbourg, ul. Karbysheva, 15)"
      - match: "Lieu d'enregistrement: Professora Popova St., 38, 197376 Saint-Pétersbourg, Fédération de Russie"
        props:
          jurisdiction: ru
          address: "Professora Popova St., 38, 197376 Saint-Pétersbourg, Fédération de Russie"
      - match: "Lieu d'établissement: Kigali, Rwanda"
        props:
          jurisdiction: rw
          address: "Kigali, Rwanda"
      - match: "Lieu d'enregistrement: Fédération de Russie (105275, Moscou, sh. Entuziastov, 29)"
        props:
          jurisdiction: ru
          address: "Fédération de Russie (105275, Moscou, sh. Entuziastov, 29)"
      - match: "Filiale: Société par actions AKIN"
        associates:
          - Société par actions AKIN
      - match: "Filiale: Société par actions AKIN"
        associates:
          - Société par actions AKIN
      - match: "Filiale: OJSC Zavod Elektropribor"
        associates:
          - OJSC Zavod Elektropribor
      - match: "Filiale: Société par actions KB Amethyst"
        associates:
          - Société par actions KB Amethyst
      - match: "Filiale: Société par actions Comet"
        associates:
          - Société par actions Comet
      - match: "Filiale: Société par actions NPP Salyut"
        associates:
          - Société par actions NPP Salyut
      - match: "Filiale: Société par actions PO Binom"
        associates:
          - Société par actions PO Binom
      - match: "Filiale: Société par actions “Institut central de recherche Kurs”"
        associates:
          - Société par actions “Institut central de recherche Kurs”
      - match: "Filiale: Société par actions Plant Topaz"
        associates:
          - Société par actions Plant Topaz
      - match: "Filiale: Société par actions Izumrud"
        associates:
          - Société par actions Izumrud
      - match: "Filiale: Société par actions KGFI"
        associates:
          - Société par actions KGFI
      - match: "Filiale: Société par actions Morinsis-Agat-KIP"
        associates:
          - Société par actions Morinsis-Agat-KIP
      - match: "Filiale: FSPC JSC NPO Mars"
        associates:
          - FSPC JSC NPO Mars
      - match: "Filiale: Société par actions NPF Meridian"
        associates:
          - Société par actions NPF Meridian
      - match: "Filiale: AO Typhoon"
        associates:
          - AO Typhoon
      - match: "Société mère: Rostec"
        associates:
          - Rostec
      - match: "Principaux établissements: Émirats arabes unis, Fédération de Russie, Union européenne"
        props:
          jurisdiction:
            - ae
            - ru
            - eu
      - match: "Lieu d'enregistrement: Moscou, Fédération de Russie (125080, Moscou, sh. Volokolamskoe, 1 str. 1, et 5; pom VI; kom 30B"
        props:
          jurisdiction: ru
          address: "Moscou, Fédération de Russie (125080, Moscou, sh. Volokolamskoe, 1 str. 1, et 5; pom VI; kom 30B"
      - match: "Lieu des activités: Ukraine, Fédération de Russie"
        props:
          jurisdiction:
            - ua
            - ru
      - match: "Principal établissement: Fédération de Russie, Pays-Bas"
        props:
          jurisdiction:
            - ru
            - nl
      - match: "Lieu d'enregistrement: Russie"
        props:
          jurisdiction: ru
      - match: "Type d'entité: société à responsabilité limitée (SARL) (LLC)"
        props:
          legalForm: société à responsabilité limitée (SARL) (LLC)
      - match: "Principal établissement: Arsenyev, Fédération de Russie"
        props:
          jurisdiction: ru
          address: "Arsenyev, Fédération de Russie"
      - match: "Lieu d'enregistrement: Dubaï, Émirats arabes unis (Unit OT 17-32, Level 17, Central Park Offices, Dubai International Financial Centre, Dubaï, 507065, Émirats arabes unis)"
        props:
          jurisdiction: ae
          address: "Dubaï, Émirats arabes unis (Unit OT 17-32, Level 17, Central Park Offices, Dubai International Financial Centre, Dubaï, 507065, Émirats arabes unis)"
      - match: "Lieu d'enregistrement: Fédération de Russie (606083, région de Nijni Novgorod, district de Volodarsky, Mulino)"
        props:
          jurisdiction: ru
          address: "Fédération de Russie (606083, région de Nijni Novgorod, district de Volodarsky, Mulino)"
      - match: "OKATO  - Ryazanskaya area, citya oblastnogo znacheniya Ryazanskoj area, Ryazan, Oktyabrskij: 61401375"
        note: true
        props:
          address: "Ryazanskaya area, citya oblastnogo znacheniya Ryazanskoj area, Ryazan, Oktyabrskij"
      - match: "OKFS  - Propriété des sociétés d'État: 61"
        note: true
        props:
          legalForm: Propriété des sociétés d'État
      - match: "OKOGU - “Technologies russes”, société d'État chargée de promouvoir le développement, la production et l'exportation de produits de haute technologie: 4100304"
        note: true
        props:
          legalForm: société d'État
      - match: "OKOPF - Sociétés par actions ouvertes OKTMO: 61701000001: 12247"
        note: true
        props: []
      - match: "Lieu d'enregistrement: Minsk, Biélorussie"
        props:
          jurisdiction: by
          address: "Minsk, Biélorussie"
      - match: "Lieu d'enregistrement: Biélorussie"
        props:
          jurisdiction: by
      - match: "Lieu d'enregistrement: Crimée"
        props:
          jurisdiction: ua-cri
      - match: "Date de création: 1989"
        props:
          incorporationDate: 1989
      - match: "Lieu d'enregistrement: Shiraz, province de Fars, Iran"
        props:
          jurisdiction: ir
          address: "Shiraz, province de Fars, Iran"
      - match: "Entités associées: LLC “Intervesp Company”"
        associates:
          - LLC “Intervesp Company”
      - match: "Entités associées: JSC “Research and Production Corporation ‘Uralvagonzavod’”"
        associates:
          - JSC “Research and Production Corporation ‘Uralvagonzavod’”
      - match: "Lieu d'enregistrement: Crimée, Ukraine"
        props:
          jurisdiction: ua-cri
          address: "Crimée, Ukraine"
      - match: "Entités associées: JSC MPO-Gidropribor; JSC Tactical Missiles Corporation"
        associates:
          - JSC MPO-Gidropribor
          - JSC Tactical Missiles Corporation
      - match: "Date d'enregistrement: 1.11.2001, 20.9.2002"
        props:
          incorporationDate: [2001-11-01, 2002-09-20]
      - match: "Type d'entité: société à responsabilité limitée: Lieu d'enregistrement: Mourmansk"
        props:
          jurisdiction: ru
          legalForm: société à responsabilité limitée
          address: "Mourmansk"
      - match: "Site internet://nvgushkuynik.ru"
        props:
          website: "nvgushkuynik.ru"
      - match: "Lieu d'enregistrement: Mourmansk"
        props:
          jurisdiction: ru
          address: "Mourmansk"
      - match: "Lieu d'enregistrement: Istanbul"
        props:
          jurisdiction: tr
          address: "Istanbul"
      - match: ["Lieu d'enregistrement: Dubaï, Émirats arabes unis", "Lieu d'enregistrement: Émirats arabes unis"]
        props:
          jurisdiction: ae
      - match: "Numéro de licence locale: 2420576.01"
        props:
          registrationNumber: 2420576.01
      - match: "Date d'enregistrement: 2.11.2007: 1201000007889"
        props:
          incorporationDate: 2007-11-02
          registrationNumber: 1201000007889
      - match: "Courriel: kbis111olga@mail.ru; cannon49@mail.ru"
        props:
          email: ["kbis111olga@mail.ru", "cannon49@mail.ru"]
      - match: "Principal établissement: République tchèque: CZ05185327"
        props:
          jurisdiction: cz
          registrationNumber: CZ05185327
      - match: "Date d'enregistrement: 24.3.1993, 31.12.2002"
        props:
          incorporationDate: [1993-03-24, 2002-12-31]
      - match: "Numéro d'enregistrement de l'entreprise: 7452016"
        props:
          registrationNumber: 7452016
      - match: "Numéro d'enregistrement de l'entreprise: 74520161"
        props:
          registrationNumber: 74520161
      - match: "Numéro d'enregistrement: 9705215107/770501001"
        props:
          registrationNumber:
            - "9705215107"
            - "770501001"
      - match: "Type d'entité: entreprise de médias"
        # That's not a legal form
      - match: "Numéro d'enregistrement: 423277-5"
        props:
          registrationNumber: 423277-5
      - match: "Personnes associées: Alexey Alekseevich Shashkov"
        associates:
          - Alexey Alekseevich Shashkov
      - match: "Date d'enregistrement: 20.1.2022 6"
        props:
          incorporationDate: 2022-01-20
      - match: "Fondateur: Hüseyin Dogru"
        associates:
          - Hüseyin Dogru
      - match: "100000000001523 - Numéro d'enregistrement"
        props:
          registrationNumber: 100000000001523
      - match: "Lieu d'enregistrement: Lattaquié, Syrie"
        props:
          jurisdiction: sy
          address: "Lattaquié, Syrie"
      - match:
          - "Lieu d'enregistrement: Damas, Syrie"
          - "Principal établissement: Damas, Syrie"
        props:
          jurisdiction: sy
          address: "Damas, Syrie"
      - match: "Principal établissement: Damas-Campagne, Syrie"
        props:
          jurisdiction: sy
          address: "Damas-Campagne, Syrie"
      - match: "Lieu d'enregistrement: Damas-Campagne"
        props:
          jurisdiction: sy
          address: "Damas-Campagne"
      - match: "Lieu d'enregistrement: Ul. Dinamovskaya D.1a, Bureau 409, Moscou, RUS, 109044"
        props:
          jurisdiction: ru
          address: "Ul. Dinamovskaya D.1a, Bureau 409, Moscou, RUS, 109044"
      - match: "Lieu d'enregistrement: 295000, République de Crimée, Simferopol, Oktyabirskaya Street, 3, Office 408"
        props:
          jurisdiction: ua-cri
          address: "295000, République de Crimée, Simferopol, Oktyabirskaya Street, 3, Office 408"
      - match: "Lieu d'enregistrement: 13, Korolyov street, Moscou, Russie"
        props:
          jurisdiction: ru
          address: "13, Korolyov street, Moscou, Russie"
      - match: "Principal établissement: territoire du régime syrien en Syrie"
        props:
          jurisdiction: sy
      - match: "Sous le numéro: 394678"
        props:
          registrationNumber: 394678
      - match: "Date de création: 29.6. 2015"
        props:
          incorporationDate: 2015-06-29
      - match: "Date de création: 23.3.2021"
        props:
          incorporationDate: 2021-03-23
      - match: "ОГРН: 1027739456084"
        props:
          ogrnCode: 1027739456084
      - match:
          - "Lieu d'enregistrement: Téhéran, Iran"
          - "Principal établissement: Téhéran, Iran"
        props:
          jurisdiction: ir
          address: "Téhéran, Iran"
      - match: "Lieu d'enregistrement: Izmir, Turquie"
        props:
          jurisdiction: tr
          address: "Izmir, Turquie"
      - match: "Numéro de pièce nationale d'identité: 10103191030"
        props:
          idNumber: 10103191030
      - match: "Lieu d'enregistrement: Bojnord — North Khorasan Province, Iran"
        props:
          jurisdiction: ir
          address: "Bojnord — North Khorasan Province, Iran"
      - match: "Numéro d'identification national: 14006189580"
        props:
          idNumber: 14006189580
      - match: "Lieu d'enregistrement: Oblast de Tcheliabinsk, Fédération de Russie"
        props:
          jurisdiction: ru
          address: "Oblast de Tcheliabinsk, Fédération de Russie"
      - match: "NIF 1644024517"
        props:
          taxNumber: 1644024517
      - match: "CEI 165101001"
        props:
          idNumber: 165101001
      - match: "Principal établissement: Russie: Numéro d'enregistrement: 1027400870826"
        props:
          jurisdiction: ru
          registrationNumber: 1027400870826
      - match: "Lieu d'enregistrement: Saint-Pétersbourg, Fédération de Russie"
        props:
          jurisdiction: ru
          address: "Saint-Pétersbourg, Fédération de Russie"
      - match: "Entités associées: PAO Sovcomflot (société mère)"
        associates:
          - PAO Sovcomflot (société mère)
      - match: "Lieu d'enregistrement: Fédération de Russie, région de Tula, Tula"
        props:
          jurisdiction: ru
          address: "Fédération de Russie, région de Tula, Tula"
      - match: "Type d'entité: société par actions cotée"
        props:
          legalForm: société par actions cotée
      - match: "Lieu d'enregistrement: Tula, Russie"
        props:
          jurisdiction: ru
          address: "Tula, Russie"
      - match: "Principal établissement: Russie: Numéro d'enregistrement: 1027100592210"
        props:
          jurisdiction: ru
          registrationNumber: 1027100592210
      - match: "Lieu d'enregistrement: 428903, Fédération de Russie, république de Tchouvachie, Cheboksary, pr. I.Yakovleva, 4"
        props:
          jurisdiction: ru
          address: "428903, Fédération de Russie, république de Tchouvachie, Cheboksary, pr. I.Yakovleva, 4"
      - match: "Numéro d'enregistrement: 1112130013270: Numéro d'enregistrement: 1112130013270"
        props:
          registrationNumber: 1112130013270
      - match: "Principal établissement: régions de Zaporijjia et de Kherson occupées par la Russie"
        props:
          jurisdiction: ru
      - match: "NIF: 504501388297)"
        props:
          innCode: 504501388297
      - match: "Type d'entité: entreprise fédérale d'État"
        props:
          legalForm: entreprise fédérale d'État
      - match: "Lieu d'enregistrement: Perm, région de Perm, Fédération de Russie"
        props:
          jurisdiction: ru
          address: "Perm, région de Perm, Fédération de Russie"
      - match: "KPP: 590801001 - Télécopieur: +7 (342) 255-77-43 - Site internet: www.bloki-perm.ru: 1025901604156"
        schema: Company
        props:
          ogrnCode: 1025901604156
          kppCode: 590801001
      - match: "Principal établissement: Fédération de Russie - Télécopieur: +7 (492) 243-25-36"
        props:
          jurisdiction: ru
      - match: "Lieu d'enregistrement: Caracas, Venezuela"
        props:
          jurisdiction: ve
          address: "Caracas, Venezuela"
      - match: "Type d'entité: société d'État chargée de la promotion du développement, de la production et de l'exportation de produits industriels de haute technologie “Rostec”"
        props:
          legalForm: société d'État
          notes: société d'État chargée de la promotion du développement, de la production et de l'exportation de produits industriels de haute technologie “Rostec”
      - match: "Numéro d'enregistrement: SRN: 1127746541427"
        props:
          registrationNumber: 1127746541427
      - match: "KPP: 772601001 - Télécopieur: +7 (495) 311-01-91: 7726700943"
        schema: Company
        props:
          kppCode: 772601001
          innCode: 7726700943
      - match: "Lieu d'enregistrement: Fédération de Russie, 620091, région de Sverdlovsk, Yekaterinburg, Kosmonavtov Ave., building 18"
        props:
          jurisdiction: ru
          address: "Fédération de Russie, 620091, région de Sverdlovsk, Yekaterinburg, Kosmonavtov Ave., building 18"
      - match: "Lieu d'enregistrement: Iran"
        props:
          jurisdiction: ir
      - match: "Lieu d'enregistrement: Fédération de Russie, 125284, Moscou, Leningradskiy Prospekt, d. 31a, str. 1"
        props:
          jurisdiction: ru
          address: "Fédération de Russie, 125284, Moscou, Leningradskiy Prospekt, d. 31a, str. 1"
      - match: "Type d'entité: entreprise fédérale d'État"
        props:
          legalForm: entreprise fédérale d'État
      - match: "Lieu d'enregistrement: Kuibyshev, région de Novosibirsk, Fédération de Russie"
        props:
          jurisdiction: ru
          address: "Kuibyshev, région de Novosibirsk, Fédération de Russie"
      - match: "Principal établissement: Kuibyshev, Fédération de Russie"
        props:
          jurisdiction: ru
          address: "Kuibyshev, Fédération de Russie"
      - match: "KPP: 545201001 - Télécopieur: +7 (383) 622-12-08"
        schema: Company
        props:
          kppCode: 545201001
      - match: "Industrial Zone, Ahwaz, Khouzistan, Iran"
        props:
          jurisdiction: ir
          address: "Industrial Zone, Ahwaz, Khouzistan, Iran"
      - match: "Lieu d'enregistrement: Saint-Pétersbourg et Moscou, Fédération de Russie"
        props:
          jurisdiction: ru
          address: "Saint-Pétersbourg et Moscou, Fédération de Russie"
      - match: "Date d'enregistrement: 31/07/2002: 1027739028712"
        props:
          incorporationDate: 2002-07-31
          registrationNumber: 1027739028712
      - match: "Lieu d'enregistrement: 630004, Ulitsa Lenina d. 52, Novossibirsk, Fédération de Russie"
        props:
          jurisdiction: ru
          address: "630004, Ulitsa Lenina d. 52, Novossibirsk, Fédération de Russie"
      - match: "Numéro d'enregistrement: IR30068GN / 10101920830"
        props:
          registrationNumber:
            - IR30068GN
            - 10101920830
      - match: "Date d'enregistrement: 1999 (privatisée en 2009)"
        props:
          incorporationDate: 1999
          notes: privatisée en 2009
      - match: "Lieu d'enregistrement: Fédération de Russie, 105120, Moscou, Syromyatnichesky pr-d, 6 k.1"
        props:
          jurisdiction: ru
          address: "Fédération de Russie, 105120, Moscou, Syromyatnichesky pr-d, 6 k.1"
      - match: "CH-550.1.031.089-Numéro d’enregistrement"
        props:
          registrationNumber: CH-550.1.031.089
      - match: "Lieu d'enregistrement: Fédération de Russie, 432030, région d'Ulyanovsk, ville d'Ulyanovsk, Narimanov Ave., 75"
        props:
          jurisdiction: ru
          address: "Fédération de Russie, 432030, région d'Ulyanovsk, ville d'Ulyanovsk, Narimanov Ave., 75"
      - match: "Lieu d'enregistrement: Fédération de Russie, région de Nizhny Novgorod, Nizhny Novgorod, st. Nartova, d. 6 k. 6, room 25 cab. 96"
        props:
          jurisdiction: ru
          address: "Fédération de Russie, région de Nizhny Novgorod, Nizhny Novgorod, st. Nartova, d. 6 k. 6, room 25 cab. 96"
      - match: "Principal établissement: Fédération de Russie, région de Nizhny Novgorod, Nizhny Novgorod"
        props:
          jurisdiction: ru
          address: "Fédération de Russie, région de Nizhny Novgorod, Nizhny Novgorod"
      - match: "Lieu d'enregistrement: Fédération de Russie, 129226, Moscou, Mira Avenue, 125"
        props:
          jurisdiction: ru
          address: "Fédération de Russie, 129226, Moscou, Mira Avenue, 125"
      - match: "Principal établissement: Fédération de Russie, Yekaterinburg"
        props:
          jurisdiction: ru
          address: "Fédération de Russie, Yekaterinburg"
      - match: "Lieu d'enregistrement: 300002, Fédération de Russie, Tula, Mosina str., 2"
        props:
          jurisdiction: ru
          address: "300002, Fédération de Russie, Tula, Mosina str., 2"
      - match: "Type d'entité: société par actions: 5087746137023"
        props:
          legalForm: société par actions
          registrationNumber: 5087746137023
      - match: "Lieu d'enregistrement: Fédération de Russie, région d'Omsk, Omsk, Karl Marx Avenue, 41"
        props:
          jurisdiction: ru
          address: "Fédération de Russie, région d'Omsk, Omsk, Karl Marx Avenue, 41"
      - match: "Lieu d'enregistrement: Fédération de Russie (Kraï de Krasnoyarsk., Zheleznogorsk, ul. Lenina, d. ZD. 52)"
        props:
          jurisdiction: ru
          address: "Fédération de Russie (Kraï de Krasnoyarsk., Zheleznogorsk, ul. Lenina, d. ZD. 52)"
      - match: "Lieu d'enregistrement: Fédération de Russie (115068, Moscou, Velozavodskaya st.,5)"
        props:
          jurisdiction: ru
          address: "Fédération de Russie (115068, Moscou, Velozavodskaya st.,5)"
      - match: "Lieu d'enregistrement: Moscou, Fédération de Russie (107450, Moscou, Myasnitskaya ul., 39/1)"
        props:
          jurisdiction: ru
          address: "Moscou, Fédération de Russie (107450, Moscou, Myasnitskaya ul., 39/1)"
      - match: "Lieu d'enregistrement: Moscou, Fédération de Russie (117525, Moscou, ul. Dnepropetrovskaya, D. 3, K. 5)"
        props:
          jurisdiction: ru
          address: "Moscou, Fédération de Russie (117525, Moscou, ul. Dnepropetrovskaya, D. 3, K. 5)"
      - match: "Numéro d'enregistrement: 7701005930 ("
        props:
          innCode: 7701005930
      - match: "KPP: 773501001: 1157746406971"
        props:
          kppCode: 773501001
          registrationNumber: 1157746406971
      - match: "Entités associées: PSB Bank"
        associates:
          - PSB Bank
      - match: "Type de société: Société à responsabilité limitée"
        props:
          legalForm: Société à responsabilité limitée
      - match: "Gang haïtien basé dans le quartier de Village-de-Dieu, à Port-au-Prince"
        props:
          jurisdiction: ht
          address: "Village-de-Dieu, Port-au-Prince, Haïti"
      - match: "Lieu d’enregistrement: Viêt Nam"
        props:
          jurisdiction: vn
      - match: "déclarée le 6 avril 2010 à la préfecture de l'Isère (38): numéro W381009783"
        props:
          registrationNumber: W381009783
          incorporationDate: 2010-04-06


  ####################################################################################################
  ####################################################################################################
  #
  #
  #
  #
  #
  #
  #
  #                        Scroll visual aid for next section when scrolling fast
  #
  #
  #
  #
  #
  #
  #
  ####################################################################################################
  ####################################################################################################
  identification_full:
    lowercase: true
    normalize: true
    options:
      - match: "Type d’entité: unités militaires - Lieu d’enregistrement: région de Kaliningrad, Fédération de Russie"
        props:
          legalForm: unités militaires
          jurisdiction: ru
          address: "région de Kaliningrad, Fédération de Russie"
      - match: "Numéro d’enregistrement: ИНН: 7717127211"
        props:
          innCode: 7717127211
      - match:
          "Type d’entité: Unité militaire du Corps des gardiens de la révolution islamique
          (IRGC)  - Lieu d’enregistrement: Kermanshah, Iran  - Principal lieu d’activité:
          Iran: /"
        props:
          jurisdiction: IR
          legalForm: Unité militaire du Corps des gardiens de la révolution islamique (IRGC)
      - match:
          "Type d'entité: Unité militaire du Corps des gardiens de la révolution islamique
          (IRGC) - Principal lieu d'activité: Iran: /"
        props:
          jurisdiction: IR
          legalForm: Unité militaire du Corps des gardiens de la révolution islamique (IRGC)
      - match:
          "Type d'entité: Unité militaire du Corps des gardiens de la révolution islamique
          (IRGC) - Lieu d'enregistrement: Mazandaran, Iran - Principal lieu d'activité:
          Iran: /"
        props:
          jurisdiction: IR
          legalForm: Unité militaire du Corps des gardiens de la révolution islamique (IRGC)
      - match:
          "numéro d'enregistrement - société à responsabilité limitée par actions
          enregistrée à Yangon, Myanmar/Birmanie, fondée en 1997 sous la forme d'un entreprise
          d'État, enregistrée en tant qu'entreprise privée le 9 janvier 2019: 105444192"
        props:
          jurisdiction: Myanmar
          legalForm: société à responsabilité limitée par actions
          incorporationDate: 2019-01-09
          registrationNumber: 105444192
      - match:
          "Lieu d'enregistrement: str. Fadeeva, 7 bâtiment 1, bureau 2, 125047, Moscou,
          Fédération de Russie. Date d'enregistrement: 27.8.2015. Numéro d'identification
          fiscale: 9710001943. Numéro d'immatriculation national: 1157700015065: 1157700015065"
        props:
          jurisdiction: ru
          innCode: 9710001943
          address: str. Fadeeva, 7 bâtiment 1, bureau 2, 125047, Moscou, Fédération de Russie
          incorporationDate: 2015-08-27
          ogrnCode: 1157700015065
      - match:
          "Numéro d’enregistrement  - Date d’enregistrement: 2019  - Lieu d’enregistrement:
          Téhéran, Iran  - Principal établissement: Deuxième étage, n° 36 rue Naqdi, rue
          Sohrevardi nord, quartier de Shahid Ghandi-Niloufar, Téhéran, Iran: 49135"
        props:
          jurisdiction: ir
          registrationNumber: 49135
          address: sDeuxième étage, n° 36 rue Naqdi, rue Sohrevardi nord, quartier de Shahid Ghandi-Niloufar, Téhéran, Iran
          incorporationDate: 2019
      - match: "Numéro d’enregistrement - Date d’enregistrement : 14.9.1994: 100717729"
        props:
          registrationNumber: 100717729
          incorporationDate: 1994-09-14
      - match:
          "Type d’entité: Unité militaire du Corps des gardiens de la révolution islamique
          (IRGC)  - Principal lieu d’activité: Iran: /"
        props:
          jurisdiction: IR
          legalForm: Unité militaire du Corps des gardiens de la révolution islamique (IRGC)
      - match: "n° d'enregistrement national, Date d'enregistrement : 08/05/2014: 1147746527279"
        props:
          registrationNumber: 1147746527279
          incorporationDate: 2014-05-08
      - match: "n° d'identification fiscale: 7704863782"
        props:
          taxNumber: 7704863782
      - match:
          "Lieu d’enregistrement: Saint-Pétersbourg, Fédération de Russie (boîte postale
          128, Saint-Pétersbourg 197022). Date d’enregistrement: 2002: Date d’enregistrement:
          2002"
        props:
          incorporationDate: 2002
          address: Saint-Pétersbourg, Fédération de Russie (boîte postale 128, Saint-Pétersbourg 197022)
          jurisdiction: ru
      - match: "Numéro d’enregistrement - Date d’enregistrement : 9.6.1999: 101561144"
        props:
          registrationNumber: 101561144
          incorporationDate: 1999-06-09
      - match: "numéro d'enregistrement: 1159102130857"
        props:
          ogrnCode: 1159102130857
      - match: "Numéro d'identification - Date d'enregistrement : 10/01/1994: 700016217"
        props:
          registrationNumber: 700016217
          incorporationDate: 1994-01-10
      - match:
          "Type d’entité: Unité militaire du Corps des gardiens de la révolution islamique
          (IRGC) - Lieu d’enregistrement: Lorestan, Iran - Principal lieu d’activité: Iran:
          /"
        props:
          jurisdiction: IR
          legalForm: Unité militaire du Corps des gardiens de la révolution islamique (IRGC)
      - match:
          "Type d’entité: Unité militaire du Corps des gardiens de la révolution islamique
          (IRGC) - Lieu d’enregistrement: Kurdistan, Iran - Principal lieu d’activité: Iran:
          /"
        props:
          jurisdiction: IR
          legalForm: Unité militaire du Corps des gardiens de la révolution islamique (IRGC)
      - match:
          "Type d’entité: Unité militaire du Corps des gardiens de la révolution islamique
          (IRGC)  - Lieu d’enregistrement: Sistan et Baloutchistan, Iran - Principal lieu
          d’activité: Iran: /"
        props:
          jurisdiction: IR
          legalForm: Unité militaire du Corps des gardiens de la révolution islamique (IRGC)
      # Numéro d’enregistrement is in there twice
      - match:
          "Type d’entité: société à responsabilité limitée. Lieu d’enregistrement:
          Région de Volgograd, Volgograd, Fédération de Russie. Date d’enregistrement: 28.11.2002.
          Numéro d’enregistrement: 1023402461752. Principal établissement: Russie: Numéro
          d’enregistrement: 1023402461752"
        props:
          jurisdiction: ru
          address: Région de Volgograd, Volgograd, Fédération de Russie
          incorporationDate: 2002-11-28
          ogrnCode: 1023402461752
      - match:
          "Lieu d'enregistrement : Moscou - Date d'enregistrement : 2001 - Principal
          établissement : Fédération de Russie - Entités associées : GTLK Europe, GTLK Asia,
          GTLK Middle East: Société de transport"
        associates:
          - GTLK Europe
          - GTLK Asia
          - GTLK Middle East
        props:
          jurisdiction: ru
          incorporationDate: 2001
      - match: "N° d'enregistrement: 1157746088170"
        props:
          ogrnCode: 1157746088170
      - match: "SWIFT: ILSIKPPY"
        props:
          swiftBic: ILSIKPPY
      - match: "(IOM): 59058C"
        props:
          imoNumber: 59058C
          registrationNumber: 59058C
      - match:
          "Numéro d'enregistrement  - lieu d'enregistrement : Fédération de Russie  -
          société par actions - Principal établissement: Moscou, Fédération de Russie: 621628"
        props:
          jurisdiction: ru
          registrationNumber: 621628
      - match: "SWIFT/BIC (Libye): AGRULYLT "
        props:
          swiftBic: AGRULYLT
      - match:
          "Type d’entité: société par actions. Lieu d’enregistrement: Région de Bryansk,
          Bryansk, Fédération de Russie. Date d’enregistrement: 4.4.2008. Numéro d’enregistrement:
          1083254005141. Principal établissement: Russie: Numéro d’enregistrement: 1083254005141"
        props:
          jurisdiction: ru
          address: Région de Bryansk, Bryansk, Fédération de Russie
          incorporationDate: 2008-04-04
          ogrnCode: 1083254005141
      - match: "Immatriculation (numéro OGRN): 1149102007933"
        props:
          ogrnCode: 1149102007933
      - match:
          "Type d’entité: Forces de police  - Lieu d’enregistrement: Iran  - Principal
          lieu d’activité: Iran: /"
        props:
          jurisdiction: IR
          legalForm: Forces de police
      - match: "Numéro d'enregistement: 1159102026742"
        props:
          ogrnCode: 1159102026742
      - match:
          "Numéro d'enregistrement - Date d'enregistrement: 13.9.2013 - Société par
          actions: 192050251"
        props:
          incorporationDate: 2013-09-13
          registrationNumber: 192050251
          legalForm: Société par actions
      - match: "Numéro d'enregistrement - Date d'enregistrement : 10.10.2002: 808000714"
        props:
          registrationNumber: 808000714
          incorporationDate: 2002-10-10
      - match: "n° d'identification “US Federal Employer Identification Number”: 36-3804626"
        props:
          jurisdiction: US
          registrationNumber: 36-3804626
      - match:
          "Type d'entité: société anonyme publique - Lieu d'enregistrement: 19 rue
          Vavilova, 117997 Moscou, Fédération de Russie. Date d'enregistrement: 22.3.1991:
          Numéro d'enregistrement: 1027700132195"
        props:
          jurisdiction: ru
          ogrnCode: 1027700132195
          incorporationDate: 1991-03-22
          address: 19 rue Vavilova, 117997 Moscou, Fédération de Russie
      - match: "numéro d'enregistrement: 1149204004707"
        props:
          ogrnCode: 1149204004707
      - match:
          "Date d'enregistrement: 31.8.2007: Type d'entité: agence du gouvernement
          fédéral russe"
        props:
          jurisdiction: ru
          incorporationDate: 2007-08-31
          legalForm: agence du gouvernement fédéral russe
      - match:
          "Type d’entité: Unité militaire du Corps des gardiens de la révolution islamique
          (IRGC)  - Lieu d’enregistrement: Azerbaïdjan occidental, Iran - Principal lieu
          d’activité: Iran: /"
        props:
          jurisdiction: IR
          legalForm: Unité militaire du Corps des gardiens de la révolution islamique (IRGC)
      - match: "Numéro d'enregistrement  - Date d'enregistrement : 1965: 500036524"
        props:
          incorporationDate: 1965
          registrationNumber: 500036524
      - match: "Numéro d'enregistrement - Date d'enregistrement : 12.05.2000: 590046884"
        props:
          incorporationDate: 2000-05-12
          registrationNumber: 590046884
      - match:
          "Lieu d'enregistrement: Degtyarnyy - Pereulok, 11a, Saint Pétersbourg, 191144,
          - Fédération de Russie - Date d'enregistrement: 17.10.1990 - Numéro d'enregistrement:
          1027739609391 - Personnes associées: Andrei Leonidowitsch KOSTIN (président du
          conseil de direction); Anton SILUANOV (président du conseil de surveillance) -
          Entité associée: Agence fédérale pour la gestion des biens publics (la subdivision
          du ministère russe du développement économique est l'un des principaux actionnaires):
          Société anonyme publique"
        associates:
          - Andrei Leonidowitsch KOSTIN
          - Anton SILUANOV
          # - Agence fédérale pour la gestion des biens publics
        props:
          jurisdiction: ru
          address: Degtyarnyy - Pereulok, 11a, Saint Pétersbourg, 191144, Fédération de Russie
          incorporationDate: 1990-10-17
          ogrnCode: 1027739609391
      - match: "Numéro de taxe nationale pakistanaise: 1774308"
        props:
          taxNumber: 1774308
          jurisdiction: PK
      - match: "numéro de taxe nationale pakistanaise: 0980338"
        props:
          taxNumber: 0980338
          jurisdiction: PK
      - match: "numéro de taxe nationale pakistanaise: 3187777"
        props:
          taxNumber: 3187777
          jurisdiction: PK
      - match: "numéro de licence afghan de fournisseur de services monétaires: 044"
        props:
          registrationNumber: 044
      - match: "date de constitution : le 04/07/2000: 394678"
        props:
          registrationNumber: 394678
          incorporationDate: 2000-07-04
      - match:
          "Type d’entité: Unité militaire du Corps des gardiens de la révolution islamique
          (IRGC) - Lieu d’enregistrement: Khuzestan, Iran - Principal lieu d’activité: Iran:
          /"
        props:
          jurisdiction: IR
          legalForm: Unité militaire du Corps des gardiens de la révolution islamique (IRGC)
      - match: "SWIFT/BIC: KUDBKPPY"
        props:
          swiftBic: KUDBKPPY
      - match: "déclarée le 9 janvier 2010 à la préfecture du Val-d'Oise: W952001402"
        props:
          registrationNumber: W952001402
          incorporationDate: 2010-01-09
      - match: "Créée le 27 juillet 2018 et déclarée le 1er août 2018 à la préfecture des Hauts-de-Seine (92): W9220127754"
        props:
          registrationNumber: W9220127754
          incorporationDate: 2018-07-27
      - match: "déclarée à la sous-préfecture de Château-Chinon (58) le 18 juin 1990 sous le numéro W581000677: W581000677"
        props:
          registrationNumber: W581000677
          incorporationDate: 1990-06-18
      - match: "Numéro d'enregistrement - Date d'enregistrement : 25/02/1966: 400051902"
        props:
          registrationNumber:
      - match:
          "n° d'enregistrement national - Date d'enregistrement : 31.01.1994 - En
          cours de liquidation - Liquidateur: Alexey Anatolievich Ananyev: 1037739044111"
        props:
          ogrnCode: 1037739044111
          incorporationDate: 1994-01-31
          status: "En cours de liquidation - Liquidateur: Alexey Anatolievich Ananyev"
      - match: "n° d'identification fiscale: 7725056162"
        props:
          taxNumber: 7725056162
      - match: "n° d'enregistrement national  à la date du  27/07/1992: 1067746244026"
        props:
          ogrnCode: 1067746244026
          incorporationDate: 1992-07-27
      - match:
          "Type d’entité: Constructeur aérospatial - Établissement public - Lieu d’enregistrement:
          Ispahan, Iran - Date d’enregistrement: 1977: /"
        props:
          jurisdiction: ir
          incorporationDate: 1977
      - match: "Numéro d'enregistrement  - Date d'enregistrement: 12/08/2003: 100726604"
        props:
          registrationNumber: 100726604
          incorporationDate: 2003-08-12
      - match:
          "Date d'enregistrement: 15.12.1999 - Numéro d'enregistrement: 1027739019208
          - Numéro d'identification fiscale: 7706092528 - SWIFT/BIC: JSNMRUMM - Personne
          associée: Igor Finogenov, cofondateur (aujourd'hui PDG de la Banque eurasienne
          de développement) - Associés: Banque centrale de Russie; gouvernement de la Fédération
          de Russie: société anonyme  publique"
        note: true
        props:
          incorporationDate: 1999-12-15
          ogrnCode: 1027739019208
          innCode: 7706092528
          swiftBic: JSNMRUMM
      - match:
          "Secteur d'activité : import/export ; transport routier ; fourniture de
          pétrole et de marchandises .Nom du directeur/direction : Hussam AL-QATIRJI, directeur
          général -  Parents/associés/entités ou partenaires d'affaires/liens : Arvada/Arfada
          Petroleum Company JSC: entreprise privée"
        note: true
      - match:
          "Type d’entité: fournisseur de sécurité physique, entreprise privée  - Principal
          établissement: Iran: /"
        props:
          jurisdiction: ir
          sector: fournisseur de sécurité physique
          legalForm: entreprise privée
      - match:
          "Lieu d'enregistrement: Moscou, Fédération de Russie - Numéro d'enregistrement:
          1027739075891 - Personnes associées: Georgieva Elena ALEKSANDROVNA (présidente
          du conseil de direction) - Andrey Valeryevich KONDRATYEV (président du conseil
          d'administration) - Entité associée: Rostec (société d'État russe du domaine
          des technologies): Banque commerciale anonyme"
        associates:
          - Georgieva Elena ALEKSANDROVNA
          - Andrey Valeryevich KONDRATYEV
          - Rostec
        props:
          ogrnCode: 1027739075891
      - match: "n° d'inscription au registre de commerce (Royaume-Uni): 02150590"
        props:
          registrationNumber: 02150590
          jurisdiction: GB
      - match: "Numéro d'enregistrement - Date d'enregistrement : 18/10/2016: 192721937"
        props:
          registrationNumber: 192721937
          incorporationDate: 2016-10-18
      - match: "SWIFT/BIC: KDBKKPPY"
        props:
          swiftBic: KDBKKPPY
      - match: "SWIFT/BIC: CMSYSYDA"
        props:
          swiftBic: CMSYSYDA
      - match:
          "numéro d'enregistrement - société anonyme enregistrée à Yangon, Myanmar/
          Birmanie, le 27/04/1990: 156387282"
        props:
          registrationNumber: 156387282
          jurisdiction: Myanmar
          incorporationDate: 1990-04-27
      - match:
          "Numéro d'enregistrement - Date d'enregistrement: 26.12.2016/03.04.2017:
          192750964"
        props:
          registrationNumber: 192750964
          incorporationDate: 2016-12-26
      - match:
          "Lieu d'enregistrement: Fédération de Russie, 119019, Moscou, rue Vozdvizhenka
          18/9. Date d'enregistrement: 6.9.2008: Type d'entité: agence du gouvernement
          fédéral russe"
        props:
          address: Fédération de Russie, 119019, Moscou, rue Vozdvizhenka 18/9
          incorporationDate: 2008-09-06
          legalForm: agence du gouvernement fédéral russe
      - match: "SWIFT: DCBK KPPY"
        props:
          swiftBic: DCBKKPPY
      - match:
          "Type d’entité: société par actions. Principal établissement: Russie: Société
          par actions"
        props:
          legalForm: société par actions
          jurisdiction: ru
      - match:
          "Numéro d'enregistrement - Date d'enregistrement : 01/02/1994 - 06/03/2000:
          100135173"
        props:
          registrationNumber: 100135173
          incorporationDate: 1994-02-01
      - match: "n° OMI de la société: 5434358"
        props:
          imoNumber: 9036387
          registrationNumber: 9036387
      - match: "Immatriculation (numéro OGRN): 1027809210054"
        props:
          ogrnCode: 1027809210054
      - match:
          "Numéro de pièce nationale d’identité (Iran)  - Numéro d’inscription au registre
          du commerce: 369541 (Iran) - Principal établissement: Iran  - Type d’entité: société
          privée  - Lieu d’enregistrement: Iran  - Date d’enregistrement: 2010: 103201991293"
        props:
          registrationNumber:
            - 103201991293
            - 369541
          legalForm: société privée
          incorporationDate: 2010
          jurisdiction: ir
      - match:
          "Type d’entité: société par actions cotée. Lieu d’enregistrement: str. M.
          Gorky 6, 300002, city of Tula, Tula region, Fédération de Russie. Date d’enregistrement:
          23.9.2002. Numéro d’enregistrement national: 1027100517256. Numéro d’identification
          fiscale: 7103028233: Numéro d’enregistrement national: 1027100517256"
        props:
          legalForm: société par actions cotée
          address: str. M. Gorky 6, 300002, city of Tula, Tula region, Fédération de Russie
          jurisdiction: ru
          innCode: 7103028233
          ogrnCode: 1027100517256
      - match:
          "Numéro d'enregistrement - Date d'enregistrement : 30.12.1996 - Société
          par actions ouverte: 500047627"
        props:
          legalForm: Société par actions ouverte
          incorporationDate: 1996-12-30
          registrationNumber: 500047627
      - match:
          "Type d’entité: société anonyme. Lieu d’enregistrement: Votkinsk, République
          d’Oudmurtie, Russie. Date d’enregistrement: 1.10.2010. Numéro d’enregistrement:
          ИНН/Numéro d’identification fiscale: 1828020110. ОГРН/Numéro d’enregistrement
          national principal: 1101828001000. Principal établissement: Russie: Numéro d’enregistrement:
          ИНН"
        props:
          legalForm: société anonyme
          address: Votkinsk, République d’Oudmurtie, Russie
          incorporationDate: 2010-10-01
          innCode: 1828020110
          ogrnCode: 1101828001000
          jurisdiction: ru
      - match:
          "Type d’entité: société par actions cotée. Date d’enregistrement: 16.8.2002.  Lieu
          d’enregistrement: Tula, Russie. Numéro d’enregistrement: 1027100592210. Principal
          établissement: Russie: Numéro d’enregistrement: 1027100592210"
        props:
          legalForm: société par actions cotée
          incorporationDate: 2002-08-16
          jurisdiction: ru
          ogrnCode: 1027100592210
      - match: "Immatriculation (numéro OGRN): 1159102022738"
        props:
          ogrnCode: 1159102022738
      - match: "Lieu d’enregistrement: Téhéran, Iran: /"
        props:
          jurisdiction: ir
      - match:
          "Secteur d'activité: promotion immobilière: entreprise publique de droit
          privé"
        note: true
      - match:
          "Type d’entité: société par actions. Lieu d’enregistrement: Nijni Novgorod,
          Russie. Date d’enregistrement: 26.8.2014. Numéro d’enregistrement: ИНН/Numéro
          d’identification fiscale: 5259113339 ОГРН/Numéro d’enregistrement national principal:
          1145259004296 Principal établissement: Russie: Numéro d’enregistrement: ИНН"
        props:
          legalForm: société par actions
          address: Nijni Novgorod, Russie
          incorporationDate: 2014-08-26
          innCode: 5259113339
          ogrnCode: 1145259004296
          jurisdiction: ru
      - match:
          "Type d'entité: société par actions. Date d'enregistrement: 23.4.2002.
          Principal établissement: Russie: société par actions"
        props:
          incorporationDate: 2002-04-23
          legalForm: société par actions
      - match: "Suisse: CH-2 17-0-431-423-3"
        props:
          registrationNumber: CH-2 17-0-431-423-3
          jurisdiction: ch
      - match:
          "Numéro d'enregistrement - date d'enregistrement 23.12.1996 - Société par
          actions ouverte: 600122610"
        props:
          registrationNumber: 600122610
          incorporationDate: 1996-12-23
          legalForm: Société par actions ouverte
      - match: "Immatriculation Russie: 1037804006811"
        props:
          ogrnCode: 1037804006811
      - match:
          "Type d’entité: Unité militaire du Corps des gardiens de la révolution islamique
          (IRGC)  - Lieu d’enregistrement: Gilan, Iran  - Principal lieu d’activité: Iran:
          /"
        props:
          jurisdiction: IR
          legalForm: Unité militaire du Corps des gardiens de la révolution islamique (IRGC)
      - match: "PSRN: 1207700324941"
        props:
          ogrnCode: 1207700324941
      - match:
          "Type d’entité: Unité militaire du Corps des gardiens de la révolution islamique
          (IRGC) - Lieu d’enregistrement: Téhéran, Iran  - Principal lieu d’activité: Iran:
          /"
        props:
          jurisdiction: IR
          legalForm: Unité militaire du Corps des gardiens de la révolution islamique (IRGC)
      - match:
          "Type d’entité: société par actions. Date d’enregistrement: 6.8.1994. Numéro
          d’enregistrement: 1022501797064. Principal établissement: Russie: Numéro d’enregistrement:
          1022501797064"
        props:
          legalForm: société par actions
          incorporationDate: 1994-08-06
          ogrnCode: 1022501797064
          jurisdiction: ru
      - match:
          "Type d’entité: institution gouvernementale  - Lieu d’enregistrement: Iran
          - Principal établissement: Iran: /"
        props:
          jurisdiction: ir
          legalForm: institution gouvernementale
      - match: "numéro d'identification d'entreprise (États-Unis d'Amérique): 36-3823186"
        props:
          jurisdiction: us
          registrationNumber: 36-3823186
      - match:
          "Numéro d’enregistrement - Date d’enregistrement: 13.8.1991 - Société par
          actions ouverte: 100205408"
        props:
          legalForm: Société par actions ouverte
          registrationNumber: 100205408
      - match:
          "Type d’entité: société à responsabilité limitée. Lieu d’enregistrement:
          str. Butlerova, 13, letter A, room. 20Н, 195256, St. Petersburg, Fédération de
          Russie. Date d’enregistrement: 10.10.1997. Numéro d’enregistrement national: 1027802486580.Numéro
          d’identification fiscale: 7804070635: Numéro d’enregistrement national: 1027802486580"
        props:
          legalForm: société à responsabilité limitée
          address: str. Butlerova, 13, letter A, room. 20Н, 195256, St. Petersburg, Fédération de Russie
          incorporationDate: 1997-10-10
          ogrnCode: 1027802486580
          innCode: 7804070635
      - match:
          "Type d’entité: Unité militaire du Corps des gardiens de la révolution islamique
          (IRGC) - Principal lieu d’activité: Iran: /"
        props:
          legalForm: Unité militaire du Corps des gardiens de la révolution islamique (IRGC)
          jurisdiction: IR
      - match: "(BVI): 1510484"
        props:
          registrationNumber: 1510484
          jurisdiction: BVI
      - match:
          "Type d'entité: organisation non gouvernementale. Lieu d'enregistrement:
          Moscou. Date d'enregistrement: février 2010: Numéro d'enregistrement: 1107799026752"
        props:
          ogrnCode: 1107799026752
          legalForm: organisation non gouvernementale
          jurisdiction: ru
      - match: "n° d'inscription au registre de commerce: 02142819"
        props:
          registrationNumber: 02142819
      - match: "Numéro d'enregistrement - Biélorussie: 190950894"
        props:
          registrationNumber: 190950894
          jurisdiction: by
      - match: "Numéro d'enregistrement - Russie: 7704734000"
        props:
          registrationNumber: 7704734000
          jurisdiction: ru
      - match: "Numéro d'enregistrement- Russie: 770301001"
        props:
          registrationNumber: 770301001
          jurisdiction: ru
      - match: "Immatriculation (numéro OGRN): 1121402000213"
        props:
          ogrnCode: 1121402000213
          jurisdiction: ru
      - match:
          "Type d’entité: société par actions. Lieu d’enregistrement: Fédération de
          Russie. Date d’enregistrement: 20.11.1990. Numéro d’enregistrement: 1022500000786.
          Principal établissement: Fédération de Russie: Numéro d’enregistrement: 1022500000786"
        props:
          ogrnCode: 1022500000786
          jurisdiction: ru
          incorporationDate: 1990-11-20
          legalForm: société par actions
      - match:
          "Numéro d'enregistrement - Lieu d'enregistrement: Fédération de Russie
          - Date d'enregistrement:22.9.2008 - Principal établissement: Fédération de Russie:
          5087746137023"
        props:
          ogrnCode: 5087746137023
          jurisdiction: ru
          incorporationDate: 2008-09-22
      - match:
          "Lieu d’enregistrement: Téhéran, Iran - Principal établissement: Téhéran,
          n° 22 rue Khorramshahr Téhéran, rue Shohvardi nord, rue Korramshahr, numéro 24,
          1er étage: /"
        props:
          jurisdiction: IR
          address: Téhéran, n° 22 rue Khorramshahr Téhéran, rue Shohvardi nord, rue Korramshahr, numéro 24, 1er étage
      - match: "Lieu d’enregistrement: Téhéran, Iran"
        props:
          address: Téhéran, Iran
          jurisdiction: IR
      - match: Société par actions  ouverte
        props:
          legalForm: Société par actions ouverte
      - match: "SWIFT/BIC: FTBDKPPY."
        props:
          swiftBic: FTBDKPPY
      - match: Société par actions ouverte
        props:
          legalForm: Société par actions ouverte
      - match: 01794877 (UK)
        props:
          registrationNumber: 01794877
          jurisdiction: GB
      - match: Filiale de Cham Holding - Sehanya Daraa Highway, P.O. Box 9525
        note: true
        props:
          address: Sehanya Daraa Highway, P.O. Box 9525
      - match:
          "Bénéficiaire effectif ultime: Hussam al-Qatirji, directeur général (désigné
          par le Conseil)"
        note: true
      - match: "Numéro OMI : 5571322"
        props:
          imoNumber: 5571322
          # registrationNumber: 5571322
      - match:
          "Nom du directeur/direction: Adel Anwar al-Olabi, président du conseil d'administration
          et gouverneur de Damas (désigné par le Conseil)"
        note: true
      - match: "Bénéficiaire effectif ultime: gouvernorat de Damas"
        note: true
      - match: Dirigé par le général de  division Abraha Kassa
        note: true
      - match: "Numéro de journal officiel: 06513574"
        props:
          # registrationNumber: 06513574
      - match: "Lieu d’enregistrement: Moscou (64 Zemlyanoy Val, bâtiment 2, bureau 201, Moscou, Fédération de Russie): /"
        props:
          address: "64 Zemlyanoy Val, bâtiment 2, bureau 201, Moscou, Fédération de Russie"
          jurisdiction: RU
      - match: "Lieu d’enregistrement: Myanmar: /"
        props:
          jurisdiction: Myanmar
      - match: "Type d’entité: publique  - Lieu d’enregistrement: Myanmar: /"
        props:
          jurisdiction: Myanmar
          legalForm: publique
      - match: "Type d’entité: service administratif  - Lieu d’enregistrement: Myanmar: /"
        props:
          jurisdiction: Myanmar
          legalForm: service administratif
      - match: "Type d’entité: fondation de coopération associée aux forces de l’ordre de la République islamique: /"
        props:
          legalForm: fondation de coopération associée aux forces de l’ordre de la République islamique
      - match: "Lieu d'enregistrement: Myanmar: /"
        props:
          jurisdiction: Myanmar
      - match: "Lieu d’enregistrement: Al-jref Gharb Plot 134 Blok 1 h, Khartoum, Sudan: /"
        props:
          jurisdiction: Sudan
          address: "Al-jref Gharb Plot 134 Blok 1 h, Khartoum, Sudan"
      - match: "Type d’entité: entreprise d’État - Lieu d’enregistrement: Myanmar: /"
        props:
          jurisdiction: Myanmar
          legalForm: entreprise d’État
      - match: "Lieu d’enregistrement: Bangui, République centrafricaine - Date d’enregistrement: Novembre 2018 - Principal établissement: Galabadja  Bangui, Commune de Bangui - Galabadja, 8e Arr. - [GPS]-> 4.4070, 18.5465: /"
        props:
          jurisdiction: Central African Republic
          incorporationDate: 2018-11
          address: Galabadja  Bangui, Commune de Bangui - Galabadja, 8e Arr. - [GPS]-> 4.4070, 18.5465
      - match: "Lieu d’enregistrement: Téhéran, Iran - Type d’entité: institut associé aux forces de l’ordre de la République islamique d’Iran: /"
        props:
          jurisdiction: Iran
          legalForm: institut associé aux forces de l’ordre de la République islamique d’Iran
      - match: "Lieu d’enregistrement: Bangui (République centrafricaine)  - Principal établissement: République centrafricaine: /"
        props:
          jurisdiction: Central African Republic
          address: Bangui
      - match: "Type d’entité: société à responsabilité limitée. Lieu d’enregistrement: Moscou, Fédération de Russie. Date d’enregistrement: 15.11.2018. Principal établissement: Fédération de Russie: Numéro d’enregistrement: 1187746941106"
        props:
          legalForm: société à responsabilité limitée
          jurisdiction: Russia
          incorporationDate: 2018-11-15
          ogrnCode: 1187746941106
      - match: "Type d’entité: société privée. Lieu d’enregistrement: district fédéral central de la Fédération de Russie. Date d’enregistrement: 29.12.1999 Principal établissement: Fédération de Russie: Numéro d’enregistrement: 1025002882850"
        props:
          legalForm: société privée
          jurisdiction: Russia
          incorporationDate: 1999-12-29
          ogrnCode: 1025002882850
      - match: "Type d'entité: organisme public de la Fédération de Russie - Date d'enregistrement: 6.9.2013 - Lieu d'enregistrement: Moscou, Fédération de Russie - Principal établissement: Russie: Numéro d'enregistrement: 1137799016695"
        props:
          legalForm: organisme public de la Fédération de Russie
          jurisdiction: Russia
          incorporationDate: 2013-09-06
          ogrnCode: 1137799016695
      - match: "Lieu d’enregistrement: Fédération de Russie (Proezd-12 Maryina Roshcha, d. 9, str. 1, Moscou) . Date d’enregistrement: 21.6.2012. Principaux établissements: Ukraine, Fédération de Russie: No d’identification fiscale: 7717727466"
        props:
          address: Proezd-12 Maryina Roshcha, d. 9, str. 1, Moscou
          jurisdiction: Russia
          incorporationDate: 2012-06-21
          innCode: 7717727466
      - match: "Type d’entité: société publique par actions. Lieu d’enregistrement: 107078, Moscou, Masha Poryvaeva str., 34, Fédération de Russie. Date d’enregistrement: 2.3.1993. Principal établissement: Fédération de Russie: Numéro d’enregistrement: OGRN: 1027739460737"
        props:
          legalForm: société publique par actions
          address: 107078, Moscou, Masha Poryvaeva str., 34, Fédération de Russie
          jurisdiction: Russia
          incorporationDate: 1993-03-02
          ogrnCode: 1027739460737
      - match: "INN 7730239877,"
        props:
          innCode: 7730239877
      - match: KPP 773001001,
        schema: Company
        props:
          kppCode: 773001001
      - match:
          "Type d’entité: société à responsabilité limitée. Lieu d’enregistrement:
          Nizhny Novgorod, Fédération de Russie. Date d’enregistrement: 18.11.2004. Principal
          établissement: Fédération de Russie: Numéro d’enregistrement: 1045207058687"
        props:
          legalForm: société à responsabilité limitée
          jurisdiction: RU
          incorporationDate: 2004-11-18
          ogrnCode: 1045207058687
      - match:
          "Lieu d'enregistrement: Mourmansk, Fédération de Russie (région de Mourmansk,
          ville de Mourmansk, ter. Mourmansk-17, 1). Date d'enregistrement: 6.12.2002.
          Principal établissement: Fédération de Russie: No d'identification fiscale: 5192110268"
        props:
          jurisdiction: RU
          address: région de Mourmansk, ville de Mourmansk, ter. Mourmansk-17, 1
          incorporationDate: 2002-12-06
          innCode: 5192110268
      - match:
          "Lieu d’enregistrement: Fédération de Russie (194021, Saint-Pétersbourg,
          ul. Karbysheva, 15). Date d’enregistrement: 27.2.2009. Principal établissement:
          Fédération de Russie.: No d’identification fiscale: 7802463197"
        props:
          jurisdiction: RU
          address: 194021, Saint-Pétersbourg, ul. Karbysheva, 15
          incorporationDate: 2009-02-27
          innCode: 7802463197
      - match:
          "Type d’entité: société anonyme publique. Lieu d’enregistrement: Ekaterinburg,
          Fédération de Russie. Date d’enregistrement: 5.4.2010 Principal établissement:Fédération
          de Russie: Numéro d’enregistrement: 1107746256727"
        props:
          legalForm: société anonyme publique
          jurisdiction: RU
          incorporationDate: 2010-04-05
          ogrnCode: 1107746256727
      - match:
          "Type d’entité: fonds de la Fédération de Russie. Date d’enregistrement:
          1.10.2010. Lieu d’enregistrement: Moscou, Fédération de Russie - Principal établissement:
          Russie: Numéro d’enregistrement: 1037739085636"
        props:
          legalForm: fonds de la Fédération de Russie
          jurisdiction: RU
          incorporationDate: 2010-10-01
          ogrnCode: 1037739085636
      - match:
          "Type d’entité: société anonyme publique. Lieu d’enregistrement: Fédération
          de Russie. Date d’enregistrement: 12.8.2002. Principal établissement: Fédération
          de Russie: Numéro d’enregistrement: 1027700118984"
        props:
          legalForm: société anonyme publique
          jurisdiction: RU
          incorporationDate: 2002-08-12
          ogrnCode: 1027700118984
      - match:
          "Type d’entité: société par actions. Lieu d’enregistrement: Fédération de
          Russie. Date d’enregistrement: 9.2.2012. Principal établissement: Fédération de
          Russie: Numéro d’enregistrement: 1127847076202"
        props:
          legalForm: société par actions
          jurisdiction: RU
          incorporationDate: 2012-02-09
          ogrnCode: 1127847076202
      - match: OKPO 20239393
        props:
          okpoCode: 20239393
      - match:
          "Lieu d’enregistrement: Ukraine (60 st. Shchorsa, 283048 Donetsk). Date d’enregistrement:
          9.10.2014. Principaux établissements: Ukraine, Fédération de Russie: No d’identification
          fiscale: 9303011960"
        props:
          address: 60 st. Shchorsa, 283048 Donetsk
          jurisdiction: UA
          incorporationDate: 2014-10-09
          taxNumber: 9303011960
      - match:
          "Lieu d'enregistrement: Fédération de Russie (141983, région de Moscou,
          Dubna, Zhukovsky Str. 2, building 1). Date d'enregistrement:26.2.2004. Principal
          établissement: Fédération de Russie.: No d'identification fiscale: 5010030050"
        props:
          address: 141983, région de Moscou, Dubna, Zhukovsky Str. 2, building 1
          jurisdiction: RU
          incorporationDate: 2004-02-26
          innCode: 5010030050
      - match: "OKOPF: 12247 – Sociétés par actions ouvertes OKTMO: 61701000001"
        note: true
        props:
          legalForm: Sociétés par actions ouvertes
          registrationNumber: 61701000001
      - match:
          "Type d’entité: société par actions. Lieu d’enregistrement: 27 Kalanchevskaya
          str. Moscou, 107078, Fédération de Russie. Date d’enregistrement: 26.7.2022.  Principal
          établissement: Fédération de Russie: Numéro d’enregistrement: 1027700067328"
        props:
          legalForm: société par actions
          address: 27 Kalanchevskaya str. Moscou, 107078, Fédération de Russie
          jurisdiction: RU
          incorporationDate: 2022-07-26
          ogrnCode: 1027700067328
      - match: "FSFR: 04700-A"
        props:
          registrationNumber: "FSFR: 04700-A"
      - match:
          "Lieu d’enregistrement: Professora Popova st., 38, 197376 Saint-Pétersbourg,
          Fédération de Russie. Date d’enregistrement: 28.10.2002 Principal établissement:
          Fédération de Russie: No d’identification fiscale: 9728042468"
        props:
          legalForm: société par actions
          address: Professora Popova st., 38, 197376 Saint-Pétersbourg, Fédération de Russie
          jurisdiction: RU
          incorporationDate: 2002-10-28
          innCode: 9728042468
      - match:
          "Lieu d’enregistrement: Fédération de Russie (105275, Moscou, sh. Entuziastov,
          29).  Date d’enregistrement: 6.2.2006. Principal établissement: Fédération de
          Russie: No d’identification fiscale: 7720544208"
        props:
          address: 105275, Moscou, sh. Entuziastov, 29
          jurisdiction: RU
          incorporationDate: 2006-02-06
          innCode: 7720544208
      - match:
          "Lieu d’enregistrement: Moscou, Fédération de Russie. Date d’enregistrement:.
          3.8.2016. Principal établissement: Fédération de Russie: No d’identification fiscale:
          7706440687"
        props:
          jurisdiction: RU
          incorporationDate: 2016-08-03
          innCode: 7706440687
      - match: INN 7712040285
        props:
          innCode: 7712040285
      - match:
          "Lieu d’enregistrement: Zelenodolsk, République du Tatarstan, Fédération
          de Russie (422540, République du Tatarstan, r-n Zelenodolskii, Zelenodolsk, ul.
          Lenina, 41A). Date d’enregistrement: 27.5.2008. Principal établissement:Fédération
          de Russie: No d’identification fiscale: 1648024290"
        props:
          address: 422540, République du Tatarstan, r-n Zelenodolskii, Zelenodolsk, ul. Lenina, 41A
          jurisdiction: RU
          incorporationDate: 2008-05-27
          innCode: 1648024290
      - match:
          "Lieu d’enregistrement: Fédération de Russie (248600, Kaluga, Voskresenskiy
          per, 28). Date d’enregistrement: 10.7.2002. Principal établissement: Fédération
          de Russie: No d’identification fiscale: 4026005699"
        props:
          address: 248600, Kaluga, Voskresenskiy per, 28
          jurisdiction: RU
          incorporationDate: 2002-07-10
          innCode: 4026005699
      - match:
          "Lieu d’enregistrement: Moscou, Fédération de Russie (125373, Moscou, Pokhodniy
          Proezd, Domovladenie 3, str. 2). Date d’enregistrement: 17.12.2008.  Principal
          établissement: Fédération de Russie: No d’identification fiscale: 7723691017"
        props:
          address: 125373, Moscou, Pokhodniy Proezd, Domovladenie 3, str. 2
          jurisdiction: RU
          incorporationDate: 2008-12-17
          innCode: 7723691017
      - match:
          "Type d’entité: société par actions. Lieu d’enregistrement: Moscou, Fédération
          de Russie. Date d’enregistrement: 17.11.2017. Principal établissement: Fédération
          de Russie: Numéro d’enregistrement: 5177746220361"
        props:
          legalForm: société par actions
          jurisdiction: RU
          incorporationDate: 2017-11-17
          ogrnCode: 5177746220361
      - match:
          "Ryazanskaya area, citya oblastnogo znacheniya Ryazanskoj area, Riazan, Oktyabrski:
          OKATO: 61401375"
        note: true
      - match:
          "Lieu d’enregistrement: Fédération de Russie (183032, oblast de Mourmansk,
          Mourmansk, Zavodskaya Ulitsa, dom 7). Date d’enregistrement: 24.7.2009. Principal
          établissement: Fédération de Russie: No d’identification fiscale: 5110002377"
        props:
          address: 183032, oblast de Mourmansk, Mourmansk, Zavodskaya Ulitsa, dom 7
          jurisdiction: RU
          incorporationDate: 2009-07-14
          innCode: 5110002377
      - match: "Lieu d’enregistrement: Naypyitaw, Myanmar/Birmanie: /"
        props:
          jurisdiction: Myanmar
      - match: NIF/INN 1651049488
        props:
          innCode: 1651049488
      - match: "Numéro fiscal: 9108124167"
        props:
          taxNumber: 9108124167
      - match: NIF/INN 1651000027
        props:
          innCode: 1651000027
      - match: NIF/INN 1651024807
        props:
          innCode: 1651024807
      - match:
          "Lieu d'enregistrement: Fédération de Russie (197046, Saint-Pétersbourg,
          ul. Malaia Posadskaia, 30). Date d'enregistrement: 26.2.2009. Principal établissement:
          Fédération de Russie: No d'identification fiscale: 7813438763"
        props:
          jurisdiction: Russia
          address: 197046, Saint-Pétersbourg, ul. Malaia Posadskaia, 30
          incorporationDate: 2009-02-26
          innCode: 7813438763
      - match:
          "Lieu d’enregistrement: 423580, Nizhnekamsk, zone industrielle, République
          du Tatarstan, Russie - Date d’enregistrement: 15.1.2007: Numéro d’enregistrement:
          SRN/OGRN 1071651000035"
        props:
          jurisdiction: RU
          address: 423580, Nizhnekamsk, zone industrielle, République du Tatarstan, Russie
          incorporationDate: 2007-01-15
          ogrnCode: 1071651000035
      - match: KPP 165101001
        schema: Company
        props:
          kppCode: 165101001
      - match:
          "Entités associées:  Tatneft-Neftekhim;  Nizhnekamskshina;  Nizhnekamsk All-Steel
          Tyre Plant"
        associates:
          - Tatneft-Neftekhim
          - Nizhnekamskshina
          - Nizhnekamsk All-Steel Tyre Plant
      - match:
          "Entités associées:  Trading House KAMA  Management Company Tatneft-Neftekhim  Nizhnekamsk
          All-Steel Tyre Plant"
        associates:
          - Trading House KAMA
          - Management Company Tatneft-Neftekhim
          - Nizhnekamsk All-Steel Tyre Plant
      - match: "Entités associées: Trading House KAMA  Management Company Tatneft-Neftekhim  Nizhnekamskshina"
        associates:
          - Trading House KAMA
          - Management Company Tatneft-Neftekhim
          - Nizhnekamskshina
      - match: "Date d’enregistrement: 18.12.2022: Numéro d’enregistrement: SRN/OGRN 1021602510533"
        props:
          incorporationDate: 2022-12-18
          ogrnCode: 1021602510533
      - match:
          "Date d'enregistrement:  01.09.2014 - Numéro d'enregistrement: 1144400000425
          - Numéro d'identification fiscale: 4401116480 - Entité associée: gouvernement
          de la Fédération de Russie: Société anonyme publique “Sovcombank”"
        props:
          incorporationDate: 2014-09-01
          ogrnCode: 1144400000425
          taxNumber: 4401116480
          notes: "Entité associée: gouvernement de la Fédération de Russie: Société anonyme publique “Sovcombank”'"
      - match: OGRN:1027739019142
        props:
          ogrnCode: 1027739019142
      - match: "Numéro de licence : 328"
        note: true
      - match:
          "Lieu d’enregistrement: Comté de Varamin, province de Téhéran, Iran - Date
          d’enregistrement: 2010: /"
        props:
          jurisdiction: Iran
          address: Comté de Varamin, province de Téhéran, Iran
          incorporationDate: 2010
      - match: "Numéro d'enregistrement - Date d'enregistrement: 1992 - Société par actions ouverte: 300042199"
        props:
          legalForm: Société par actions ouverte
          incorporationDate: 1992
          registrationNumber: 300042199
      - match: "Lieu d’enregistrement : Saint-Pétersbourg, Fédération de Russie - Date d’enregistrement: 11.5.2014: /"
        props:
          jurisdiction: ru
          incorporationDate: 2014-05-11
      - match: "Numéro d’enregistrement  - Type d’entité: société à responsabilité limitée  - Lieu d’enregistrement: Damas-Campagne  - Date d’enregistrement: 10.10.2018  - Principal établissement: Damas-Campagne, Syrie.: 2906"
        props:
          legalForm: société à responsabilité limitée
          jurisdiction: sy
          incorporationDate: 2018-10-10
          address: Damas-Campagne, Syrie
          registrationNumber: 2906
      - match: "Type d'entité: branche de l'organisation Basij du Corps des gardiens de la révolution islamique (IRGC) - Lieu d'enregistrement: Iran - Date d'enregistrement: novembre 1989: /"
        props:
          jurisdiction: ir
          incorporationDate: 1989
          notes: "branche de l'organisation Basij du Corps des gardiens de la révolution islamique (IRGC)"
      - match: "Type d'entité: fondation - Lieu d'enregistrement: Iran - Date d'enregistrement: 1989: /"
        props:
          jurisdiction: ir
          incorporationDate: 1989
          notes: fondation
      - match:
          "Type d’entité: Filiale de l’entreprise unitaire de l’État fédéral - Lieu
          d’enregistrement: Fédération de Russie - Date d’enregistrement: 15.11.2002 - Principal
          établissement: Fédération de Russie: Numéro d’enregistrement: 1027739552642"
        props:
          jurisdiction: ru
          legalForm: Filiale de l’entreprise unitaire de l’État fédéral
          incorporationDate: 2002-11-15
          ogrnCode: 1027739552642
      - match: INN 7751002460 KPP 775101001
        schema: Company
        props:
          innCode: 7751002460
          kppCode: 775101001
      - match:
          "Type d’entité: société par actions (S.A.) - Lieu d’enregistrement: Russie
          - Date d’enregistrement: 29.6.1994: Numéro d’enregistrement: 7724032017 (ou numéro
          d’enregistrement national: 1027700450975)"
        props:
          jurisdiction: ru
          legalForm: société par actions (S.A.)
          incorporationDate: 1994-06-29
          innCode: 7724032017
          ogrnCode: 1027700450975
      - match:
          "Type d’entité: organisation non gouvernementale - Lieu d’enregistrement:
          Moscou, Russie - Date d’enregistrement: 21.11.2011 - Principal établissement:
          Russie, Moscou - Entités associées: Agence fédérale Rossotrudnichestvo: Numéro
          d’enregistrement: 1117799023330"
        associates:
          - Agence fédérale Rossotrudnichestvo
        props:
          jurisdiction: ru
          legalForm: organisation non gouvernementale
          incorporationDate: 2011-11-21
          address: Moscou, Russie
          ogrnCode: 1117799023330
      - match:
          "Type d’entité: bien fédéral - Lieu d’enregistrement: 412310, région de Saratov,
          Balashov, Ul. Titova, D.40 - Date d’enregistrement: 19.5.2009 - Principal établissement:
          Fédération de Russie: TIN ‒ 5027030107"
        props:
          jurisdiction: ru
          legalForm: bien fédéral
          incorporationDate: 2009-05-19
          address: "412310, région de Saratov, Balashov, Ul. Titova, D.40"
          innCode: 5027030107
      - match:
          "Lieu d’enregistrement: Fédération de Russie (425350, Republic of Mari El,
          ville de Kozmodemyansk, str. Gagarina, 10) - Date d’enregistrement: 12.7.1996
          - Principal établissement: Fédération de Russie: 1217000287 (numéro d’identification
          fiscale)"
        props:
          jurisdiction: ru
          address: "425350, Republic of Mari El, ville de Kozmodemyansk, str. Gagarina, 10"
          incorporationDate: 1996-07-12
          innCode: 1217000287
      - match: "INN (NIF): 3334017070 KPP: 333401001"
        schema: Company
        props:
          innCode: 3334017070
          kppCode: 333401001
      - match:
          "Type d'entité: société à responsabilité limitée (LLC) - Lieu d'enregistrement:
          Moscou, Fédération de Russie - Date d'enregistrement: 28.4.2015 - Principal établissement:
          Russie, Ukraine: Numéro d'enregistrement: 1157700005759"
        props:
          jurisdiction:
            - ru
            - ua
          legalForm: société à responsabilité limitée (LLC)
          incorporationDate: 2015-04-28
          ogrnCode: 1157700005759
      - match:
          "Lieu d’enregistrement: Fédération de Russie (197022, Saint-Pétersbourg,
          ul. Akademika Pavlova, 14) - Date d’enregistrement: 26.1.2011 - Principal établissement:
          Fédération de Russie: 7813491943 (numéro d’identification fiscale)"
        props:
          jurisdiction: ru
          address: "197022, Saint-Pétersbourg, ul. Akademika Pavlova, 14"
          incorporationDate: 2011-01-26
          innCode: 7813491943
      - match: "Autres informations: Directeur général: Kirill Igorevich Ilyin"
        note: true
      - match:
          "Type d'entité: société anonyme publique - Lieu d'enregistrement: Fédération
          de Russie - Date d'enregistrement: 25.7.1996 - Principal établissement: Fédération
          de Russie: Numéro d'enregistrement: 1025901509798"
        props:
          jurisdiction: ru
          legalForm: société anonyme publique
          incorporationDate: 1996-07-25
          ogrnCode: 1025901509798
      - match:
          "Lieu d’enregistrement: Saint-Pétersbourg, Fédération de Russie - Date d’enregistrement:
          3.7.2013: INN 7802830545 BIN 1137847251740 PPC 780101001 OKPO 27492853"
        props:
          jurisdiction: ru
          address: Saint-Pétersbourg, Fédération de Russie
          incorporationDate: 2013-07-03
          innCode: 7802830545
          ogrnCode: 1137847251740
          # ppcCode: 780101001
          okpoCode: 27492853
      - match:
          "Lieu d’enregistrement: Fédération de Russie (305502, région de Koursk, pos.
          Marshal Zhukov, military unit 32406) - Date d’enregistrement: 26.11.2009 - Principal
          établissement: Fédération de Russie: 4611010810 (numéro d’identification fiscale)"
        props:
          jurisdiction: ru
          address: "305502, région de Koursk, pos. Marshal Zhukov, military unit 32406"
          incorporationDate: 2009-11-26
          innCode: 4611010810
      - match: "Unité militaire: 09643"
        props:
          legalForm: unités militaires
          registrationNumber: 09643
      - match:
          "Lieu d’enregistrement: Fédération de Russie (606083, région de Nizhny Novgorod,
          district de Volodarsky, Mulino) - Date d’enregistrement: 14.12.2009 - Principal
          établissement: Fédération de Russie: 3666162144 (numéro d’identification fiscale)"
        props:
          jurisdiction: ru
          address: "606083, région de Nizhny Novgorod, district de Volodarsky, Mulino"
          incorporationDate: 2009-12-14
          innCode: 3666162144
      - match:
          "Type d’entité: Société par actions ouverte/OAO - Lieu d’enregistrement:
          129164, Moscou, Prospekt Mira, 126 / 129164, г. Москва, пр-кт Мира, д. 126 - Date
          d’enregistrement: 8.6.2009 - Principal établissement: Moscou, Russie - Personnes
          associées: Aleksei Viktorovich Pimanov - Autres informations: Communications;
          organisation enregistrée auprès de l’autorité russe de régulation des médias:
          Numéro d’enregistrement: ИНН 7717653542 КПП 771701001"
        schema: Company
        associates:
          - Aleksei Viktorovich Pimanov
        props:
          jurisdiction: ru
          legalForm: Société par actions ouverte/OAO
          incorporationDate: 2009-06-08
          address: "129164, Moscou, Prospekt Mira, 126 / 129164, г. Москва, пр-кт Мира, д. 126"
          notes: "Communications; organisation enregistrée auprès de l’autorité russe de régulation des médias"
          innCode: 7717653542
          kppCode: 771701001
      - match:
          "Type d’entité: société à responsabilité limitée (SARL) - Lieu d’enregistrement:
          Russie - Date d’enregistrement: 24.12.2010 - Entité associée: société par actions
          Kalashnikov Concern: Numéro d’enregistrement: 1841015504"
        props:
          jurisdiction: ru
          legalForm: société à responsabilité limitée (SARL)
          incorporationDate: 2010-12-24
          notes: "Entité associée: société par actions Kalashnikov Concern"
          registrationNumber: 1841015504
      - match:
          "Lieu d’enregistrement: Fédération de Russie (606002, région de Nizhny Novgorod,
          Dzerzhinsk city, Sverdlov avenue, 4) - Date d’enregistrement: 11.12.1991 - Principal
          établissement: Fédération de Russie: 5249002485 (numéro d’identification fiscale)"
        props:
          jurisdiction: ru
          address: "606002, région de Nizhny Novgorod, Dzerzhinsk city, Sverdlov avenue, 4"
          incorporationDate: 1991-12-11
          innCode: 5249002485
      - match:
          "Type d’entité: société à responsabilité limitée (LLC) - Lieu d’enregistrement:
          Géorgie - Date d’enregistrement: 15.5.2015 - Principal établissement: Russie,
          Géorgie, Ukraine: Numéro d’enregistrement: 1159800030409"
        props:
          jurisdiction:
            - ge
            - ru
            - ua
          legalForm: société à responsabilité limitée (LLC)
          incorporationDate: 2015-05-15
          registrationNumber: 1159800030409
      - match:
          "Lieu d’enregistrement: Fédération de Russie (107023, Moscou, ul. Elektrozavodskaia,
          24 str. 1.) - Date d’enregistrement: 22.11.2007 - Principal établissement: Fédération
          de Russie: 7718676447 (numéro d’identification fiscale)"
        props:
          jurisdiction: ru
          address: "107023, Moscou, ul. Elektrozavodskaia, 24 str. 1."
          incorporationDate: 2007-11-22
          innCode: 7718676447
      - match:
          "Lieu d'enregistrement: Fédération de Russie (197110, Saint-Pétersbourg,
          ul. Pionerskaia, 44) - Date d'enregistrement: 28.9.2008 - Principal établissement:
          Fédération de Russie: 7813426574 (numéro d'identification fiscale)"
        props:
          jurisdiction: ru
          address: "197110, Saint-Pétersbourg, ul. Pionerskaia, 44"
          incorporationDate: 2008-09-28
          innCode: 7813426574
      - match:
          "Type d’entité: société par actions non publique -Lieu d’enregistrement:
          Fédération de Russie - Date d’enregistrement: 23.8.2002 - Principal établissement:
          Fédération de Russie: Numéro d’enregistrement: NIF – 7805060220 INN – 7805060220"
        props:
          jurisdiction: ru
          legalForm: société par actions non publique
          incorporationDate: 2002-08-23
          registrationNumber: 7805060220
          innCode: 7805060220
      - match:
          "Lieu d’enregistrement: Fédération de Russie (105094, Moscou, ul. Golianovskaia,
          7A str. 1) - Date d’enregistrement: 2.4.1992 - Principal établissement: Fédération
          de Russie: 7701024429 (numéro d’identification fiscale)"
        props:
          jurisdiction: ru
          address: "105094, Moscou, ul. Golianovskaia, 7A str. 1"
          incorporationDate: 1992-04-02
          innCode: 7701024429
      - match:
          "Type d’entité: Entité privée - Lieu d’enregistrement: Fédération de Russie
          - Date d’enregistrement: 9.7.2022 - - Principal établissement: Fédération de Russie
          - Autres informations: INN: 7714077682 PPC: 771401001: Numéro d’enregistrement:
          1027700010579"
        props:
          jurisdiction: ru
          legalForm: Entité privée
          incorporationDate: 2022-07-09
          innCode: 7714077682
          registrationNumber: 1027700010579
      - match:
          "Lieu d’enregistrement: Fédération de Russie (416506, région d’Astrakhan,
          district d’Akhtubinsky, Akhtubinsk, st. Sukhoi P.O., Building 12a) - Date d’enregistrement:
          10.10.2010 - Principal établissement: Fédération de Russie - Entités associées:
          Tactical Missile Corporation, société mère (NIF: 503210805145): 3001041615 (numéro
          d’identification fiscale)"
        associates:
          - Tactical Missile Corporation
        props:
          jurisdiction: ru
          address: "416506, région d’Astrakhan, district d’Akhtubinsky, Akhtubinsk, st. Sukhoi P.O., Building 12a"
          incorporationDate: 2010-10-10
          innCode: 3001041615
      - match:
          'Entités associées: Ancienne société mère: entreprise unitaire de l’État
          fédéral "Scientific and Production Center of Automation and Instrumentation named
          after academician N.A. Pilyugin" (JSC "NPCAP": Autres informations: TIN 7728171283'
        associates:
          - Scientific and Production Center of Automation and Instrumentation named after academician N.A. Pilyugin
        props:
          innCode: 7728171283
      - match:
          "Lieu d’enregistrement: Fédération de Russie (107241, Moscou, sh. Shchelkovskoe,
          23A, pomeshch. V kom. 33.) - Date d’enregistrement: 27.9.2017 - Principal établissement:
          Fédération de Russie: 9718077239 (numéro d’identification fiscale)"
        props:
          jurisdiction: ru
          address: "107241, Moscou, sh. Shchelkovskoe, 23A, pomeshch. V kom. 33."
          incorporationDate: 2017-09-27
          innCode: 9718077239
      - match: "Personnes ou entités associées: Sergei Shoigu"
        associates:
          - Sergei Shoigu
      - match: INN 5907001774 KPP 590701001 OKPO 07504034
        schema: Company
        props:
          innCode: 5907001774
          kppCode: 590701001
          okpoCode: 07504034
      - match:
          "Lieu d’enregistrement: Fédération de Russie (119121, Moscou, per. Truzhenikov
          1-i, 16 str.17) - Date d’enregistrement: 27.4.1999 - Principal établissement:
          Fédération de Russie: 7704199755 (numéro d’identification fiscale)"
        props:
          jurisdiction: ru
          address: "119121, Moscou, per. Truzhenikov 1-i, 16 str.17"
          incorporationDate: 1999-04-27
          innCode: 7704199755
      - match:
          "Lieu d’enregistrement: Fédération de Russie (région de Rostov, Rostov-sur-le-Don,
          st. Krasnoarmeiskaya, 9) - Date d’enregistrement: 1.2.2010 - Principal établissement:
          Fédération de Russie: 6164295259 (numéro d’identification fiscale)"
        props:
          jurisdiction: ru
          address: "région de Rostov, Rostov-sur-le-Don, st. Krasnoarmeiskaya, 9"
          incorporationDate: 2010-02-01
          innCode: 6164295259
      - match:
          "Lieu d’enregistrement: Fédération de Russie (105318, Moscou, ul. Ibragimova,
          31) -  Date d’enregistrement: 3.6.2010 - Principal établissement: Fédération de
          Russie: 7719751930 (numéro d’identification fiscale)"
        props:
          jurisdiction: ru
          address: "105318, Moscou, ul. Ibragimova, 31"
          incorporationDate: 2010-06-03
          innCode: 7719751930
      - match: "Lieu d'enregistrement: Fédération de Russie (193091, Saint Petersbourg, nab. Oktiabrskaia, 6,litera v, pomeshch. 8-n) - Date d'enregistrement: 25.8.2015 - Principal établissement: Fédération de Russie: 7811227439 (numéro d'identification fiscale)"
        props:
          jurisdiction: ru
          address: "193091, Saint Petersbourg, nab. Oktiabrskaia, 6,litera v, pomeshch. 8-n"
          incorporationDate: 2015-08-25
          innCode: 7811227439
      - match: "Type d'entité: société par actions - Lieu d'enregistrement: Fédération de Russie - Date d'enregistrement: 10.3.2015: Numéro d'enregistrement: 1157746176400"
        props:
          legalForm: "société par actions"
          jurisdiction: ru
          incorporationDate: 2015-03-10
          registrationNumber: 1157746176400
      - match: "Type d'entité: Propriété russe mixte avec une part de propriété fédérale - Lieu d'enregistrement: Fédération de Russie, 602205, région de Vladimir, Murom, 30 Let Pobedy St., 1a. - Date d'enregistrement: 1.7.2011 - Principal établissement: Fédération de Russie: Numéro d'enregistrement: 1113334001879"
        props:
          legalForm: "Propriété russe mixte avec une part de propriété fédérale"
          jurisdiction: ru
          address: "602205, région de Vladimir, Murom, 30 Let Pobedy St., 1a"
          incorporationDate: 2011-07-01
          registrationNumber: 1113334001879
      - match: "Lieu d'enregistrement: Moscou, Fédération de Russie (125080, Moscou, sh. Volokolamskoe, 1 str. 1, et 5; pom VI; kom 30B - Date d'enregistrement: 22.8.2014 - Principal établissement: Fédération de Russie, Pays-Bas - Autres informations: Sergei Iurevich Zubkov (directeur général): 7743937237 (numéro d'identification fiscale)"
        props:
          jurisdiction:
            - ru
            - nl
          address: "125080, Moscou, sh. Volokolamskoe, 1 str. 1, et 5; pom VI; kom 30B"
          incorporationDate: 2014-08-22
          notes: "Sergei Iurevich Zubkov (directeur général)"
          innCode: 7743937237
      - match: "Type d’entité: entreprise d’État - Lieu d’enregistrement: Myanmar/Birmanie - Lieu principal d’activité: Myanmar/Birmanie: /"
        props:
          legalForm: entreprise d’État
          jurisdiction: Myanmar
      - match: "Entreprise de d’information et de technologies - Lieu d’enregistrement: Russie - Date d’enregistrement: créée en 2001 - Principal lieu d’activité: Russie: /"
        props:
          jurisdiction: ru
          legalForm: Entreprise de d’information et de technologies
          incorporationDate: 2001
      - match: "Type d’entité: Entreprise d’État - Lieu d’enregistrement: 73, rue Dzerzhinskogo, Minsk, 220116 - Date d’enregistrement: 21.7.1997 -  Principal établissement: Minsk, Biélorussie: 101272253"
        props:
          jurisdiction: by
          legalForm: Entreprise d’État
          address: "73, rue Dzerzhinskogo, Minsk, 220116"
          incorporationDate: 1997-07-21
          registrationNumber: 101272253
      - match: "Lieu d’enregistrement: 4, rue Uralskaya, Minsk 220037, République de Biélorussie - Date d’enregistrement: 1.3.1994 - Type d’entité: Entreprise d’État: Numéro d’enregistrement: 100211261(УНП)"
        props:
          jurisdiction: by
          address: "4, rue Uralskaya, Minsk 220037, République de Biélorussie"
          incorporationDate: 1994-03-01
          legalForm: Entreprise d’État
          registrationNumber: 100211261
      - match: "Type d'entité: société par actions ouverte - Lieu d'enregistrement: Zhlobin, région de Gomel, Biélorussie - Principal établissement: Zhlobin, région de Gomel, Biélorussie. Date d'enregistrement: 24.4.1991 en tant que “БЕЛОРУССКИЙ МЕТАЛЛУРГИЧЕСКИЙ ЗАВОД”,11.9.1996 en tant que “Государственное предприятие – Белорусский металлургический завод”, 1.12.1997 en tant que “Белорусский металлургический завод”, 3.11.1999 en tant que “Республиканское унитарное предприятие ‘Белорусский металлургический з: 400074854"
        props:
          jurisdiction: by
          legalForm: société par actions ouverte
          address: "Zhlobin, région de Gomel, Biélorussie"
          alias:
            - БЕЛОРУССКИЙ МЕТАЛЛУРГИЧЕСКИЙ ЗАВОД
            - Государственное предприятие – Белорусский металлургический завод
            - Белорусский металлургический завод
            - Республиканское унитарное предприятие ‘Белорусский металлургический з'
          incorporationDate: 1991-04-24
          registrationNumber: 400074854
      - match: "NIF  - Type d’entité: Organe de presse - Lieu d’enregistrement: Moscou - Date d’enregistrement: 2.6.2003 - Principal lieu d’activité: Moscou: 7727214569"
        props:
          jurisdiction: ru
          legalForm: Organe de presse
          incorporationDate: 2003-06-02
          innCode: 7727214569
      - match: "NIF - Type d’entité: “Conseils en matière d’activités commerciales et de gestion”  - Lieu d’enregistrement: Moscou -Date d’enregistrement: 3.11.2005  - Principal lieu d’activité: Moscou: 7727536630"
        props:
          jurisdiction: ru
          legalForm: “Conseils en matière d’activités commerciales et de gestion”
          incorporationDate: 2005-11-03
          innCode: 7727536630
      - match: "Type d’entité: prison - Lieu d’enregistrement: Karaj, province d’Alborz, Iran: /"
        props:
          jurisdiction: ir
          legalForm: prison
          address: "Karaj, province d’Alborz, Iran"
      - match: "Type d'entité: société par actions. Lieu d'enregistrement: Fédération de Russie. Date d'enregistrement: 6.6.2003. Numéro d'enregistrement: 1031632202227. Principal établissement: Russie: uméro d'enregistrement: 1031632202227"
        props:
          jurisdiction: ru
          legalForm: société par actions
          incorporationDate: 2003-06-06
          registrationNumber: 1031632202227
      - match: "PSRN 1021601627090 le 25.11.2002"
        props:
          registrationNumber: 1021601627090
          incorporationDate: 2002-11-25
      - match: "OKPO 57243722"
        schema: Company
        props:
          okpoCode: 57243722
      - match: "N ° d'identification fiscale - En cours de liquidation - Liquidateur: Igor Staloverov: 7730018980"
        props:
          innCode: 7730018980
          status: En cours de liquidation
      - match: "Type d’entité: prison - Lieu d’enregistrement: Zahedan, Iran: /"
        props:
          jurisdiction: ir
          legalForm: prison
          address: "Zahedan, Iran"
      - match: "Lieu d'enregistrement: Dubaï, Émirats arabes unis (Unit OT 17-32, Level 17, Central Park Offices, Dubai International Financial Centre, Dubaï, 507065, Émirats arabes unis) . Date d'enregistrement: 2.8.2012. Principaux établissements: Émirats arabes unis, Fédérationde Russie, Union européenne: Numéro d'enregistrement: 1244"
        props:
          jurisdiction: ae
          country: ru
          address: "Unit OT 17-32, Level 17, Central Park Offices, Dubai International Financial Centre, Dubaï, 507065, Émirats arabes unis"
          incorporationDate: 2012-08-02
          registrationNumber: 1244
      - match: "Type d’entité: entité gouvernementale - Lieu d’enregistrement: Iran - Date d’enregistrement: 2012: /"
        props:
          jurisdiction: ir
          legalForm: entité gouvernementale
          incorporationDate: 2012
      - match: "Type d'entité: société à responsabilité limitée. Lieu d'enregistrement: rue Bolshaya Polyanka, 50/1 STR.1, 119180, Moscou, Russie. Date d'enregistrement: 21.2.2005. Numéro d'enregistrement: 1057746290469. Numéro d'identification du contribuable: 7706569306. Principal établissement: Moscou, Russie: Numéro d'enregistrement: 1057746290469"
        props:
          jurisdiction: ru
          legalForm: société à responsabilité limitée
          address: "rue Bolshaya Polyanka, 50/1 STR.1, 119180, Moscou, Russie"
          incorporationDate: 2005-02-21
          registrationNumber: 1057746290469
          innCode: 7706569306
      - match: "Type d'entité: société par actions. Date d'enregistrement: 26.9.2011. Lieu d’enregistrement: région de Nijni Novgorod, Fédération de Russie Principal lieu d’activité: Fédération de Russie: Date d'enregistrement: 26.9.2011"
        props:
          jurisdiction: ru
          legalForm: société par actions
          incorporationDate: 2011-09-26
      - match: "Type d’entité: prison - Lieu d’enregistrement: province du Kurdistan, nord-ouest de l’Iran: /"
        props:
          jurisdiction: ir
          legalForm: prison
          address: "province du Kurdistan, nord-ouest de l’Iran"
      - match: "Type d'entité: société par actions. Principal établissement: Russie: Société par actions"
        props:
          jurisdiction: ru
          legalForm: société par actions
      - match: "Type d’entité: prison - Lieu d’enregistrement: Ispahan, Iran: /"
        props:
          jurisdiction: ir
          legalForm: prison
          address: "Ispahan, Iran"
      - match: "Type d'entité: société par actions cotée. Lieu d'enregistrement: Perm, Fédération de Russie. Date d'enregistrement: 11.12.1992. Numéro d'enregistrement: 1025901364708. Principal établissement: Russie: Numéro d'enregistrement: 1025901364708"
        props:
          jurisdiction: ru
          legalForm: société par actions cotée
          address: "Perm, Fédération de Russie"
          incorporationDate: 1992-12-11
          registrationNumber: 1025901364708
      - match: "Type d'entité: entreprise unitaire publique fédérale. Lieu d'enregistrement: Pokhodnyy Proyezd 3- 2, 125373, Moscou, Russie. Date d'enregistrement: 14.10.2002. Numéro d'enregistrement: 1027700310076. Principal établissement: Moscou, Russie: Numéro d'enregistrement: 1027700310076"
        props:
          jurisdiction: ru
          legalForm: entreprise unitaire publique fédérale
          address: "Pokhodnyy Proyezd 3- 2, 125373, Moscou, Russie"
          incorporationDate: 2002-10-14
          registrationNumber: 1027700310076
      - match: "Type d'entité: organe de presse  - Lieu d'enregistrement: Iran - Date d'enregistrement: 30 juin 2012: /"
        props:
          jurisdiction: ir
          legalForm: organe de presse
          incorporationDate: 2012-06-30
      - match: "Type d'entité: groupe de moto  Lieu d'enregistrement: Fédération de Russie  Date d'enregistrement: 1989"
        props:
          jurisdiction: ru
          legalForm: groupe de moto
          incorporationDate: 1989
      - match: "Date d'enregistrement: 20.9.2001: Numéro d'enregistrement: SRN/OGRN  1021602498114"
        props:
          ogrnCode: 1021602498114
          incorporationDate: 2001-09-20
      - match: "Lieu d’enregistrement: Téhéran, Iran - Établissement principal: Iran: /"
        props:
          jurisdiction: ir
          address: "Téhéran, Iran"
      - match:
          "Lieu d’enregistrement: Téhéran, Iran - Établissement principal: Téhéran,
          Iran - Entités associées: Corps des gardiens de la révolution islamique (IRGC);
          Khatam al-Anbiya Construction Headquarters (KAA): Type d’entité: filiale de Khatam
          al-Anbiya Construction Headquarters, qui est une entreprise d’ingénierie contrôlée
          par l’IRGC"
        associates:
          - Corps des gardiens de la révolution islamique (IRGC)
          - Khatam al-Anbiya Construction Headquarters (KAA)
        props:
          jurisdiction: ir
          address: "Téhéran, Iran"
          legalForm: filiale de Khatam al-Anbiya Construction Headquarters, qui est une entreprise d’ingénierie contrôlée par l’IRGC
      - match:
          "Lieu d’enregistrement: Iran - Date d’enregistrement: 2006 - Établissement
          principal: Iran - Entités associées: Corps des gardiens de la révolution islamique
          (IRGC).Khatam al-Anbiya Construction Headquarters (KAA) - Site internet: www.sepanir.com:
          Entreprise publique"
        associates:
          - Corps des gardiens de la révolution islamique (IRGC)
          - Khatam al-Anbiya Construction Headquarters (KAA)
        props:
          jurisdiction: ir
          incorporationDate: 2006
          address: Iran
          legalForm: Entreprise publique
          website: http://www.sepanir.com
      - match:
          "Ghorb Nooh; Corps des gardiens de la révolution islamique (IRGC); Khatam
          al-Anbiya Construction Headquarters (KAA): Entités associées"
        associates:
          - Ghorb Nooh
          - Corps des gardiens de la révolution islamique (IRGC)
          - Khatam al-Anbiya Construction Headquarters (KAA)
      - match: "No d’enregistrement: société coopérative no 892"
        props:
          registrationNumber: 892
      - match: "Entités associées: Khatam al-Anbiya Construction Headquarters (KAA)"
        associates:
          - Khatam al-Anbiya Construction Headquarters (KAA)
      - match:
          "Type d’entité: entité publique - Lieu d’enregistrement: Téhéran, Iran -
          Établissement principal: Téhéran, Iran: /"
        props:
          jurisdiction: ir
          legalForm: entité publique
          address: "Téhéran, Iran"
      - match:
          "Corps des gardiens de la révolution islamique (IRGC); Ghorb Nooh; Khatam
          al-Anbiya Construction Headquarters (KAA): Entités associées"
        associates:
          - Corps des gardiens de la révolution islamique (IRGC)
          - Ghorb Nooh
          - Khatam al-Anbiya Construction Headquarters (KAA)
      - match: "Établissement principal: Iran: /"
        props:
          jurisdiction: ir
      - match:
          "Lieu d’enregistrement: Iran - Établissement principal: Iran - Personnes
          associées: Sardar Abed -(commandant de Khatam al-Anbiya Construction Headquarters)
          - Entités associées: Corps des gardiens de la révolution islamique (IRGC); Fater
          Institute; Niro Holding: Type d’entité: entreprise publique"
        associates:
          - Sardar Abed
          - Corps des gardiens de la révolution islamique (IRGC)
          - Fater Institute
          - Niro Holding
        props:
          jurisdiction: ir
          address: Iran
          legalForm: entreprise publique
      - match:
          "Entités associées: Shahid Baheri Industrial Group (SBIG);  Organisation
          des industries aérospatiales (AIO)"
        associates:
          - Shahid Baheri Industrial Group (SBIG)
          - Organisation des industries aérospatiales (AIO)
      - match:
          "Entités associées: Organisation des industries aérospatiales (AIO);  Pejman
          Industrial Services"
        associates:
          - Organisation des industries aérospatiales (AIO)
          - Pejman Industrial Services
      - match: "Lieu d'enregistrement: Syrie: /"
        props:
          jurisdiction: sy
      - match:
          "Lieu d’enregistrement: Iran - Personnes associées: Morteza Rezaie; Ali Akbar
          Ahmadian; Mohammad Reza Zahedi; Morteza Safari; Mohammad Bagher Zolghadr - Entités
          associées: Corps des gardiens de la révolution islamique (IRGC); force aérospatiale
          du Corps des gardiens de la révolution islamique (IRGC): Type d’entité: entreprise
          aéronautique"
        associates:
          - Morteza Rezaie
          - Ali Akbar Ahmadian
          - Mohammad Reza Zahedi
          - Morteza Safari
          - Mohammad Bagher Zolghadr
          - Corps des gardiens de la révolution islamique (IRGC)
          - force aérospatiale du Corps des gardiens de la révolution islamique (IRGC)
        props:
          jurisdiction: ir
          legalForm: entreprise aéronautique
      - match: "Lieu d’enregistrement: Iran - Établissement principal: Iran: /"
        props:
          jurisdiction: ir
      - match:
          "N° d’enregistrement - Lieu d’enregistrement: Iran - Date d’enregistrement:
          1992: 339747"
        props:
          jurisdiction: ir
          registrationNumber: 339747
          incorporationDate: 1992
      - match: "Lieu d’enregistrement: Iran - Établissement principal: Téhéran, Iran: /"
        props:
          jurisdiction: ir
          address: "Téhéran, Iran"
      - match:
          "Entités associées:  Yas Air; Pouya Air: Lieu d'enregistrement: Téhéran,
          Iran"
        associates:
          - Yas Air
          - Pouya Air
        props:
          jurisdiction: ir
          address: "Téhéran, Iran"
      - match:
          "Entités associées: Corps des gardiens de la révolution islamique (IRGC);
          Khatam al-Anbiya Construction Headquarters (KAA)"
        associates:
          - Corps des gardiens de la révolution islamique (IRGC)
          - Khatam al-Anbiya Construction Headquarters (KAA)
      - match: "Lieu d’enregistrement: Téhéran: /"
        props:
          jurisdiction: ir
          address: Téhéran
      - match:
          "Lieu d’enregistrement: Iran - Établissement principal: Iran - Entités associées:
          Corps des gardiens de la révolution islamique (IRGC); Khatam al-Anbiya Construction
          Headquarters (KAA); Niro Holding: Type d’entité: entreprise publique"
        associates:
          - Corps des gardiens de la révolution islamique (IRGC)
          - Khatam al-Anbiya Construction Headquarters (KAA)
          - Niro Holding
        props:
          jurisdiction: ir
          address: Iran
          legalForm: entreprise publique
      - match:
          "Khatam al-Anbiya - Construction Headquarters (KAA); Hara Company; Omran
          Sahel; Sahel Consultant Engineers; National Iranian Oil company (NIOC); Corps
          des gardiens de la révolution islamique (IRGC): Entités associées"
        associates:
          - Khatam al-Anbiya - Construction Headquarters (KAA)
          - Hara Company
          - Omran Sahel
          - Sahel Consultant Engineers
          - National Iranian Oil company (NIOC)
          - Corps des gardiens de la révolution islamique (IRGC)
      - match:
          "Lieu d’enregistrement: Mashad, Iran - Date d’enregistrement: 1993 - Établissement
          principal: Mashad, Iran: /"
        props:
          jurisdiction: ir
          address: "Mashad, Iran"
          incorporationDate: 1993
      - match: "Entités associées: Organisation des industries aérospatiales (AIO)"
        associates:
          - Organisation des industries aérospatiales (AIO)
      - match:
          "Organisation des industries de la défense (DIO); LIMMT Economic and Trade
          Company (LIMMT); Groupe des industries des munitions et de la métallurgie (AMIG);
          Shahid Sayyad Shirazi Industries: Entités associées"
        associates:
          - Organisation des industries de la défense (DIO)
          - LIMMT Economic and Trade Company (LIMMT)
          - Groupe des industries des munitions et de la métallurgie (AMIG)
          - Shahid Sayyad Shirazi Industries
      - match:
          "Entités associées: Saba Battery  Organisation des industries de la défense
          (DIO);  ministère de la défense et de la logistique des forces armées (MODAFL)"
        associates:
          - Saba Battery
          - Organisation des industries de la défense (DIO)
          - MODAFL
      - match:
          "Entités associées: Corps des gardiens de la révolution islamique (IRGC);  Khatam
          al-Anbiya Construction Headquarters (KAA): Établissement principal: Iran"
        associates:
          - Corps des gardiens de la révolution islamique (IRGC)
          - Khatam al-Anbiya Construction Headquarters (KAA)
        props:
          jurisdiction: ir
      - match: "Établissement principal: Téhéran, Iran Ispahan, Iran: /"
        props:
          jurisdiction: ir
          address:
            - Téhéran, Iran
            - Ispahan, Iran
      - match:
          "Lieu d’enregistrement: Iran - Date d’enregistrement: 1961 - Code économique:
          411315443678: No d’enregistrement: 860"
        props:
          jurisdiction: ir
          registrationNumber: 860
          taxNumber: 411315443678
          incorporationDate: 1961
      - match: "Date d’enregistrement: 1997 - Établissement principal: Iran: /"
        props:
          jurisdiction: ir
          incorporationDate: 1997
      - match:
          "Type d'entité: société par actions cotée. Lieu d'enregistrement: Fédération
          de Russie. Date d'enregistrement: 1992. Numéro d'enregistrement: 1027739555282.
          Principal établissement: Fédération de Russie: Numéro d'enregistrement: 1027739555282"
        props:
          jurisdiction: ru
          legalForm: société par actions cotée
          incorporationDate: 1992
          registrationNumber: 1027739555282
      - match:
          "Organisation des industries aérospatiales (AIO); Sabalan Company; Sabalan
          Petrochemical Company; Sabalan Petrochemical Industries Company; SPICO; SPC: Entités
          associées"
        associates:
          - Organisation des industries aérospatiales (AIO)
          - Sabalan Company
          - Sabalan Petrochemical Company
          - Sabalan Petrochemical Industries Company
          - SPICO
          - SPC
      - match:
          "Entités associées: Khatam al-Anbiya Construction Headquarters (KAA);  Ghorb
          Nooh"
        associates:
          - Khatam al-Anbiya Construction Headquarters (KAA)
          - Ghorb Nooh
      - match: "N° d’identification national - Établissement principal: Téhéran, Iran: 10103864724"
        props:
          jurisdiction: ir
          address: "Téhéran, Iran"
          idNumber: 10103864724
      - match:
          "Entités associées: Corps des gardiens de la révolution islamique (IRGC);
          Khatam al-Anbiya Construction Headquarters (KAA): Date d’enregistrement: 1992"
        props:
          jurisdiction: ir
          incorporationDate: 1992
        associates:
          - Corps des gardiens de la révolution islamique (IRGC)
          - Khatam al-Anbiya Construction Headquarters (KAA)
      - match:
          "Type d’entité: entreprise publique - Lieu d’enregistrement: Iran - Établissement
          principal: Iran: /"
        props:
          jurisdiction: ir
          legalForm: entreprise publique
      - match:
          "Type d’entité: fournisseur d’armes militaires  - Lieu d’enregistrement:
          Mashad, Iran - Établissement principal: Iran: /"
        props:
          jurisdiction: ir
          legalForm: fournisseur d’armes militaires
          address: "Mashad, Iran"
      - match:
          "Ali Akbar; Tabatabaei (IRGC); Azim Aghajani (IRGC); Esmail Ghani, alias
          Ismail Akbar Nezhad ou Esmail Qani - Entités associées: Corps des gardiens de
          la révolution islamique (IRGC): Personnes associées"
        associates:
          - Ali Akbar
          - Tabatabaei (IRGC)
          - Azim Aghajani (IRGC)
          - Esmail Ghani
          - Ismail Akbar Nezhad
          - Esmail Qani
          - Corps des gardiens de la révolution islamique (IRGC)
      - match:
          "Entités associées: IRGC; ministère de la défense et de la logistique des
          forces armées (MODAFL) de l’Iran; Organisation des industries de l’aviation de
          l’Iran (IAIO); Organisation des industries aérospatiales (AIO): Type d’entité:
          entreprise de construction aéronautique"
        props:
          jurisdiction: ir
          legalForm: entreprise de construction aéronautique
        associates:
          - IRGC
          - MODAFL
          - Organisation des industries de l’aviation de l’Iran (IAIO)
          - Organisation des industries aérospatiales (AIO)
      - match:
          "Lieu d'enregistrement: Iran - Date d'enregistrement: 2000 (en tant que
          Qeshm Air) et renommée Yas Air en 2008 - Entités associées: Pars Aviation Services
          Company (PASC); Corps des gardiens de la révolution islamique (IRGC) - Sites internet:
          pouyaair.com; yasair.com: Type d'entité: compagnie aérienne de fret"
        associates:
          - Pars Aviation Services Company (PASC)
          - Corps des gardiens de la révolution islamique (IRGC)
        props:
          jurisdiction: ir
          incorporationDate: 2000
          website:
            - http://pouyaair.com
            - http://yasair.com
          sector: compagnie aérienne de fret
      - match:
          "Type d’entité: filiale de l’Organisation des industries aérospatiales (AIO):
          /"
        associates:
          - Organisation des industries aérospatiales (AIO)
      - match:
          "The Parchin Military Complex (PMC); Zeinoddin Chemical Industries; Chemical
          Industries and Development of Material Group (CIDMG) Personnes associées: Davoud
          Damghani (attaché de la défense de l’Iran à Pékin); Li Zeming (Li) (employé de
          Zhejiang Qingji); Shen Weisheng (administrateur et directeur général de Zhejiang
          Qingji): Entités associée"
        associates:
          - The Parchin Military Complex (PMC)
          - Zeinoddin Chemical Industries
          - Chemical Industries and Development of Material Group (CIDMG)
          - Davoud Damghani
          - Li Zeming
          - Shen Weisheng
      - match: "Lieu d’enregistrement: Téhéran, Iran: Établissement principal: Iran"
        props:
          jurisdiction: ir
          address: "Téhéran, Iran"
      - match:
          "Lieu d’enregistrement: Iran - Établissement principal: Iran - Entités associées:
          Corps des gardiens de la révolution islamique (IRGC); Khatam al-Anbiya Construction
          Headquarters (KAA): Type d’entité: entreprise publique"
        associates:
          - Corps des gardiens de la révolution islamique (IRGC)
          - Khatam al-Anbiya Construction Headquarters (KAA)
        props:
          jurisdiction: ir
          address: Iran
          legalForm: entreprise publique
      - match:
          "Lieu d’enregistrement: Téhéran, Iran - Entités associées: Organisation des
          industries de la défense (DIO); ministère de la défense et de la logistique des
          forces armées en Iran (MODAFL): Type d’entité: filiale de l’Organisation des industries
          de la défense (DIO) de l’Iran, qui est elle-même une filiale du ministère de la
          défense et de la logistique des forces armées (MODAFL)"
        associates:
          - Organisation des industries de la défense (DIO)
          - MODAFL
        props:
          jurisdiction: ir
          address: "Téhéran, Iran"
          notes: filiale de l’Organisation des industries de la défense (DIO) de l’Iran, qui est elle-même une filiale du ministère de la défense et de la logistique des forces armées (MODAFL)
      - match:
          "Lieu d’enregistrement: Téhéran, Iran - Date d’enregistrement: 3.3.2008 -
          Établissement principal: Iran: /"
        props:
          jurisdiction: ir
          address: "Téhéran, Iran"
          incorporationDate: 2008-03-03
      - match: "Lieu d'enregistrement: Myanmar/Birmanie: /"
        props:
          jurisdiction: mm
      - match: "Lieu d'enregistrement: Iran - Établissement principal: Iran: /"
        props:
          jurisdiction: ir
      - match: "Lieu d'enregistrement: Téhéran - No d'enregistrement: 176855 - Code économique: 411139673763 - Date d'enregistrement: 1987 et 2001 - Personnes associées: Reza Sadougi, PDG: Numéro d'identification national 10102191894"
        props:
          jurisdiction: ir
          registrationNumber: 176855
          taxNumber: 411139673763
          incorporationDate:
            - 1987
            - 2001
        associates:
          - Reza Sadougi
      - match: "Déclarée le 22 septembre 2016 à la préfecture du Gard: W302013417,"
        props:
          registrationNumber: W302013417
          incorporationDate: 2016-09-22
      - match: "Lieu d'enregistrement: Al-jref Gharb Plot 134 Blok 1 h, Khartoum, Soudan: /"
        props:
          jurisdiction: sd
          address: "Al-jref Gharb Plot 134 Blok 1 h, Khartoum, Soudan"
      - match: "Lieu d’enregistrement: Téhéran, Iran - Date d’enregistrement: 2017 - Numéro d’enregistrement: 534295 - Principal établissement: Iran: Type d’entité: société à responsabilité limitée"
        props:
          jurisdiction: ir
          address: "Téhéran, Iran"
          incorporationDate: 2017
          registrationNumber: 534295
          legalForm: société à responsabilité limitée
      - match: "Ehsan Imaninejad (directeur général): Personnes associées"
        associates:
          - Ehsan Imaninejad
      - match: "Date d’enregistrement: 2002: Lieu d’enregistrement: Iran"
        props:
          jurisdiction: ir
          incorporationDate: 2002
      - match: "Rahmatollah Heidari (directeur général et membre du conseil d’administration): Personnes associées"
        associates:
          - Rahmatollah Heidari
      - match: "Lieu d’enregistrement: Iran: Numéro d’enregistrement: 10320661315 ou 414950 ou 47779."
        props:
          jurisdiction: ir
          registrationNumber:
            - 10320661315
            - 414950
            - 47779
      - match: "Lieu d'enregistrement: Téhéran, Iran - Date d'enregistrement: 2013 - Principal établissement: Iran: Type d'entité: société à responsabilité limitée"
        props:
          jurisdiction: ir
          address: "Téhéran, Iran"
          incorporationDate: 2013
          legalForm: société à responsabilité limitée
      - match: "Lieu d'enregistrement: Moscou (64 Zemlyanoy Val, bâtiment 2, bureau 201, Moscou, Fédération de Russie): /"
        props:
          jurisdiction: ru
          address: "64 Zemlyanoy Val, bâtiment 2, bureau 201, Moscou, Fédération de Russie"
      - match: "Lieu d’enregistrement: Moscou, Fédération de Russie - Date d’enregistrement: 9.7.2002 - Principal établissement: Fédération de Russie: Numéro d’identification fiscale: 7724244406"
        props:
          jurisdiction: ru
          address: "Moscou, Fédération de Russie"
          incorporationDate: 2002-07-09
          innCode: 7724244406
      - match: "Numéro d'enregistrement - Type d'entité: société à responsabilité limitée - Lieu d'enregistrement: Crimée - Date d'enregistrement: 9.6.2022: 1229100007366"
        props:
          jurisdiction: ru
          legalForm: société à responsabilité limitée
          registrationNumber: 1229100007366
          incorporationDate: 2022-06-09
      - match: "Numéro d’enregistrement - Type d’entité: entreprise fédérale d’État - Lieu d’enregistrement: Perm, région de Perm, Fédération de Russie - Date d’enregistrement: 5.6.1992: 1025901604156"
        props:
          jurisdiction: ru
          legalForm: entreprise fédérale d’État
          registrationNumber: 1025901604156
          incorporationDate: 1992-06-05
      - match: "Principal établissement: Crimée, Ukraine: Type d'entité: Établissement éducatif public d'enseignement complémentaire"
        props:
          jurisdiction: ua-cri
          legalForm: Établissement éducatif public d'enseignement complémentaire
      - match: "Lieu d'enregistrement: Crimée, Ukraine - Date d'enregistrement: 15.6.2015: Numéro d'enregistrement: 1159102101180"
        props:
          jurisdiction: ua-cri
          registrationNumber: 1159102101180
          incorporationDate: 2015-06-15
      - match: "Lieu d’enregistrement: Crimée, Ukraine - Date d’enregistrement: 15.6.2004 - Numéro d’enregistrement: 1047796423487 - Principal établissement: Crimée, Ukraine: Type d’entité: société à responsabilité limitée"
        props:
          jurisdiction: ua-cri
          incorporationDate: 2004-06-15
          registrationNumber: 1047796423487
          legalForm: société à responsabilité limitée
      - match: "Numéro d’enregistrement - Type d’entité: société par actions - Lieu d’enregistrement: Fédération de Russie - Date d’enregistrement: 4.9.2008: 1083340004527"
        props:
          jurisdiction: ru
          legalForm: société par actions
          registrationNumber: 1083340004527
          incorporationDate: 2008-09-04
      - match: "Numéro d’enregistrement: SRN - Type d’entité: société d’État chargée de la promotion du développement, de la production et de l’exportation de produits industriels de haute technologie “Rostec” - Lieu d’enregistrement: Fédération de Russie - Date d’enregistrement: 12.7.2012: 1127746541427"
        props:
          jurisdiction: ru
          legalForm: société d’État chargée de la promotion du développement, de la production et de l’exportation de produits industriels de haute technologie “Rostec”
          registrationNumber: 1127746541427
          incorporationDate: 2012-07-12
      - match: "NIF: 7726700943"
        props:
          innCode: 7726700943
      - match: "Lieu d’enregistrement: Toula, Fédération de Russie - Date d’enregistrement: 2.9.2002 - NIF: 7107003303: Immatriculation (numéro OGRN): 1027100507147"
        props:
          jurisdiction: ru
          address: "Toula, Fédération de Russie"
          incorporationDate: 2002-09-02
          innCode: 7107003303
          ogrnCode: 1027100507147
      - match: "Principal établissement: Toula, Fédération de Russie: Type d’entité: société publique par actions"
        props:
          jurisdiction: ru
          address: "Toula, Fédération de Russie"
          legalForm: société publique par actions
      - match: "Lieu d'enregistrement: Moscou, Fédération de Russie - Date d'enregistrement: 11.1.2019 - Numéro d'enregistrement: C77-74808 - Principal établissement: Moscou, Fédération de Russie: Type d'entité: Chaîne de télévision"
        props:
          jurisdiction: ru
          address: "Moscou, Fédération de Russie"
          incorporationDate: 2019-01-11
          registrationNumber: C77-74808
          legalForm: Chaîne de télévision
      - match: "Lieu d'enregistrement: Téhéran, Iran - Date d'enregistrement: 2017 - Numéro d'enregistrement: 534295 - Principal établissement: Iran: Type d'entité: société à responsabilité limitée"
        props:
          jurisdiction: ir
          address: "Téhéran, Iran"
          incorporationDate: 2017
          registrationNumber: 534295
          legalForm: société à responsabilité limitée
      - match:
          - "Numéro d'enregistrement - Type d'entité: société par actions - Lieu d'enregistrement: Fédération de Russie - Date d'enregistrement: 14.10.2002: 1027301482603"
          - "Numéro d'enregistrement - Type d'entité: société par actions  - Lieu d'enregistrement: Fédération de Russie - Date d'enregistrement: 14.10.2002: 1027301482603"
        props:
          jurisdiction: ru
          legalForm: société par actions
          registrationNumber: 1027301482603
          incorporationDate: 2002-10-14
      - match: "Principal établissement: Moscou, Fédération de Russie: Type d'entité: société par actions"
        props:
          jurisdiction: ru
          address: "Moscou, Fédération de Russie"
          legalForm: société par actions
      - match: "Lieu d'enregistrement: Moscou, Fédération de Russie - Date d'enregistrement: 7.7.2010: Numéro d'enregistrement: 1107746540087"
        props:
          jurisdiction: ru
          registrationNumber: 1107746540087
          incorporationDate: 2010-07-07
          address: "Moscou, Fédération de Russie"
      - match: "Date d'enregistrement: 2002: Lieu d'enregistrement: Iran"
        props:
          jurisdiction: ir
          incorporationDate: 2002
      - match: "Rahmatollah Heidari (directeur général et membre du conseil d'administration): Personnes associées"
        associates:
          - Rahmatollah Heidari
      - match: "Lieu d’enregistrement: Alabuga, Fédération de Russie - Principal établissement: Fédération de Russie: Type d’entité: société à responsabilité limitée"
        props:
          jurisdiction: ru
          address: "Alabuga, Fédération de Russie"
          legalForm: société à responsabilité limitée
      - match: "Numéro d’enregistrement - Type d’entité: société par actions - Lieu d’enregistrement: Crimée - Date d’enregistrement: 13.11.2018: 1189112039291"
        props:
          jurisdiction: ru
          legalForm: société par actions
          registrationNumber: 1189112039291
          incorporationDate: 2018-11-13
      - match: "Numéro d’enregistrement - Type d’entité: société par actions - Lieu d’enregistrement: Saint-Pétersbourg, Fédération de Russie - Date d’enregistrement:10.12.1992: 1027802749061"
        props:
          jurisdiction: ru
          legalForm: société par actions
          registrationNumber: 1027802749061
          incorporationDate: 1992-12-10
      - match: "Lieu d’enregistrement: Moscou, Fédération de Russie - Date d’enregistrement: 13.1.1994 - Principal établissement: Fédération de Russie: Numéro d’identification fiscale: 7735007358"
        props:
          jurisdiction: ru
          address: "Moscou, Fédération de Russie"
          incorporationDate: 1994-01-13
          innCode: 7735007358
      - match: "Lieu d’enregistrement: Fédération de Russie (Kraï de Krasnoyarsk., Zheleznogorsk, ul. Lenina, d. ZD. 52) - Date d’enregistrement: 3.3.2008 - Principal établissement: Fédération de Russie: Numéro d’identification fiscale: 2452034898"
        props:
          jurisdiction: ru
          address: "Fédération de Russie (Kraï de Krasnoyarsk., Zheleznogorsk, ul. Lenina, d. ZD. 52)"
          incorporationDate: 2008-03-03
          innCode: 2452034898
      - match: "Lieu d’enregistrement: Moscou, Fédération de Russie - Date d’enregistrement: 30.3.2016 - Principal établissement: Fédération de Russie: Numéro d’identification fiscale: 9701036178"
        props:
          jurisdiction: ru
          address: "Moscou, Fédération de Russie"
          incorporationDate: 2016-03-30
          innCode: 9701036178
      - match: "Lieu d’enregistrement: Moscou, Fédération de Russie - Date d’enregistrement: 1.12.1993 - Principal établissement: Fédération de Russie: Numéro d’identification fiscale: 7735040690"
        props:
          jurisdiction: ru
          address: "Moscou, Fédération de Russie"
          incorporationDate: 1993-12-01
          innCode: 7735040690
      - match: "Principal établissement: Fédération de Russie: Type d’entité: société par actions"
        props:
          jurisdiction: ru
          address: "Fédération de Russie"
          legalForm: société par actions
      - match: "Lieu d’enregistrement: Perova Polya proezd 9, building 1, Moscou, Fédération de Russie - Date d’enregistrement: 3.11.2015 -: Numéro d’enregistrement: (OGRN): 5157746008195"
        props:
          jurisdiction: ru
          address: "Perova Polya proezd 9, building 1, Moscou, Fédération de Russie"
          incorporationDate: 2015-11-03
          ogrnCode: 5157746008195
      - match: "Principal lieu d’activité: Moscou, Fédération de Russie: Type d’entité: société à responsabilité limitée"
        props:
          jurisdiction: ru
          address: "Moscou, Fédération de Russie"
          legalForm: société à responsabilité limitée
      - match: "Lieu d'enregistrement: Kumertau, Fédération de Russie - Numéro d'enregistrement: 1080262000609 - Principal établissement: Kumertau, Fédération de Russie: Type d'entité: société par actions"
        props:
          jurisdiction: ru
          address: "Kumertau, Fédération de Russie"
          registrationNumber: 1080262000609
          legalForm: société par actions
      - match: "Lieu d’enregistrement: Fédération de Russie (450022, République du Bashkortostan, Oufa, Mendeleev street, 134) - Date d’enregistrement: 29.7.2000 - Principal établissement: Fédération de Russie: Numéro d’identification fiscale: 0274068924"
        props:
          jurisdiction: ru
          address: "Fédération de Russie (450022, République du Bashkortostan, Oufa, Mendeleev street, 134)"
          incorporationDate: 2000-07-29
          innCode: 0274068924
      - contains: "30.12.2011: 1117154036911"
        props:
          jurisdiction: ru
          legalForm: société par actions
          registrationNumber: 1117154036911
          incorporationDate: 2011-12-30
      - match: "Lieu d’enregistrement: Moscou, Fédération de Russie - Date d’enregistrement: 7.11.2005 - Principal établissement: Fédération de Russie: Numéro d’identification fiscale: 7743575354"
        props:
          jurisdiction: ru
          address: "Moscou, Fédération de Russie"
          incorporationDate: 2005-11-07
          innCode: 7743575354
      - match: "Lieu d’enregistrement: Moscou, Fédération de Russie - Date d’enregistrement: 27.7.1995 - Principal établissement: Fédération de Russie: Numéro d’identification fiscale: 7702148410"
        props:
          jurisdiction: ru
          address: "Moscou, Fédération de Russie"
          incorporationDate: 1995-07-27
          innCode: 7702148410
      - match: "Numéro d’enregistrement - Type d’entité: société par actions non publique - Lieu d’enregistrement: Fédération de Russie - Date d’enregistrement: 11.10.2002: 1025001627859"
        props:
          jurisdiction: ru
          legalForm: société par actions non publique
          registrationNumber: 1025001627859
          incorporationDate: 2002-10-11
      - match: "Lieu d’enregistrement: Moscou, Fédération de Russie - Date d’enregistrement: 20.7.2010 - Principal établissement: Fédération de Russie: Numéro d’identification fiscale: 7716668049"
        props:
          jurisdiction: ru
          address: "Moscou, Fédération de Russie"
          incorporationDate: 2010-07-20
          innCode: 7716668049
      - match: "Lieu d’enregistrement: Fédération de Russie (115068, Moscou, Velozavodskaya st.,5) - Date d’enregistrement: 10.5.2012 - Principal établissement: Fédération de Russie: Numéro d’identification fiscale: 7723836671"
        props:
          jurisdiction: ru
          address: "Fédération de Russie (115068, Moscou, Velozavodskaya st.,5)"
          incorporationDate: 2012-05-10
          innCode: 7723836671
      - match: "Numéro d'enregistrement - Type d'entité: entreprise unitaire publique fédérale  - Lieu d'enregistrement: Fédération de Russie - Date d'enregistrement: 22.8.2002: 1027401350932"
        props:
          jurisdiction: ru
          legalForm: entreprise unitaire publique fédérale
          registrationNumber: 1027401350932
          incorporationDate: 2002-08-22
      - match: "Lieu d’enregistrement: Moscou, Fédération de Russie - Date d’enregistrement: 13.12.2019: Numéro d’enregistrement: 1197746727530"
        props:
          jurisdiction: ru
          address: "Moscou, Fédération de Russie"
          incorporationDate: 2019-12-13
          registrationNumber: 1197746727530
      - match: "Numéro d’enregistrement - Type d’entité: société par actions non publique, propriété privée  - Lieu d’enregistrement: Fédération de Russie, oblast de Vologda  - Date d’enregistrement:  17.10.2002: 1023500882437"
        props:
          jurisdiction: ru
          legalForm: société par actions non publique, propriété privée
          registrationNumber: 1023500882437
          incorporationDate: 2002-10-17
      - match: "INN (NIF): 3525023010"
        props:
          innCode: 3525023010
      - match: "Principal établissement: Fédération de Russie: Lieu des activités: Ukraine, Fédération de Russie"
        props:
          jurisdiction:
            - ua
            - ru
      - match: "Numéro d’enregistrement - Type d’entité: société à responsabilité limitée - Lieu d’enregistrement: Moscou, Fédération de Russie - Date d’enregistrement: 18.8.2011: 1117746641572"
        props:
          jurisdiction: ru
          legalForm: société à responsabilité limitée
          registrationNumber: 1117746641572
          incorporationDate: 2011-08-18
      - match: "Lieu d’enregistrement: Moscou, Fédération de Russie - Date d’enregistrement: 3.8.2009 - Principal établissement: Fédération de Russie: Numéro d’identification fiscale: 7736605544"
        props:
          jurisdiction: ru
          address: "Moscou, Fédération de Russie"
          incorporationDate: 2009-08-03
          innCode: 7736605544
      - match: "Numéro d’enregistrement - Type d’entité: société par actions  - Lieu d’enregistrement: Fédération de Russie  - Date d’enregistrement: 17.11.2003: 1037825058732"
        props:
          jurisdiction: ru
          legalForm: société par actions
          registrationNumber: 1037825058732
          incorporationDate: 2003-11-17
      - match: "Principal établissement: Fédération de Russie: Lieu des activités: Ukraine, Fédération de Russie"
        props:
          jurisdiction:
            - ua
            - ru
      - match: "Numéro d’enregistrement - Type d’entité: société à responsabilité limitée - Lieu d’enregistrement: Fédération de Russie - Date d’enregistrement: 7.7.2005: 1057747407398"
        props:
          jurisdiction: ru
          legalForm: société à responsabilité limitée
          registrationNumber: 1057747407398
          incorporationDate: 2005-07-07
      - match: "Lieu d’enregistrement: Moscou, Fédération de Russie (107450, Moscou, Myasnitskaya ul., 39/1) - Date d’enregistrement: 18.6.2004 - Principal établissement: Fédération de Russie: Numéro d’identification fiscale: 7708234633"
        props:
          jurisdiction: ru
          address: "Moscou, Fédération de Russie (107450, Moscou, Myasnitskaya ul., 39/1)"
          incorporationDate: 2004-06-18
          innCode: 7708234633
      - match: "Lieu d'enregistrement: Iran: Numéro d'enregistrement: 10320661315 ou 414950 ou 47779."
        props:
          jurisdiction: ir
          registrationNumber:
            - 10320661315
            - 414950
            - 47779
      - match: "Lieu d'enregistrement: Moscou, Fédération de Russie - Date d'enregistrement: 28.10.2015 - Principal établissement: Fédération de Russie: Numéro d'identification fiscale: 7706428753"
        props:
          jurisdiction: ru
          address: "Moscou, Fédération de Russie"
          incorporationDate: 2015-10-28
          innCode: 7706428753
      - match: "Lieu d’enregistrement: Moscou, Fédération de Russie - Date d’enregistrement: 24.2.2012 - Principal établissement: Fédération de Russie: Numéro d’identification fiscale: 7717719144"
        props:
          jurisdiction: ru
          address: "Moscou, Fédération de Russie"
          incorporationDate: 2012-02-24
          innCode: 7717719144
      - match: "Lieu d’enregistrement: Moscou, Fédération de Russie - Date d’enregistrement: 21.3.1995 - Principal établissement: Fédération de Russie: Numéro d’identification fiscale: 7710013769"
        props:
          jurisdiction: ru
          address: "Moscou, Fédération de Russie"
          incorporationDate: 1995-03-21
          innCode: 7710013769
      - match: "Numéros d’enregistrement: INN (NIF): 5013044999"
        props:
          innCode: 5013044999
      - match: "Numéros d’enregistrement: KPP: 504001001"
        schema: Company
        props:
          kppCode: 504001001
      - match: "Numéros d’enregistrement: OGRN: 1025001627012"
        props:
          ogrnCode: 1025001627012
      #- match: "Type d’entité: société à responsabilité limitée"
      #  props:
      #    legalForm: société à responsabilité limitée
      - match: "Lieu d’enregistrement: Saint-Pétersbourg, Fédération de Russie - Date d’enregistrement: 15.1.2015: Numéro d’enregistrement: 1154712000024"
        props:
          jurisdiction: ru
          address: "Saint-Pétersbourg, Fédération de Russie"
          incorporationDate: 2015-01-15
          registrationNumber: 1154712000024
      - match: "Principal établissement: Fédération de Russie: Lieu des activités: Ukraine, Fédération de Russie"
        props:
          jurisdiction:
            - ua
            - ru
      - match: "Numéro d’enregistrement - Type d’entité: société à responsabilité limitée - Lieu d’enregistrement: Moscou, Fédération de Russie - Date d’enregistrement: 24.12.2010: 1101841007938"
        props:
          jurisdiction: ru
          legalForm: société à responsabilité limitée
          registrationNumber: 1101841007938
          incorporationDate: 2010-12-24
      - match: "Lieu d'enregistrement: Moscou, Fédération de Russie - Date d'enregistrement: 31.5.1994: Type d'entité: société à responsabilité limitée"
        props:
          jurisdiction: ru
          address: "Moscou, Fédération de Russie"
          incorporationDate: 1994-05-31
          legalForm: société à responsabilité limitée
      - match: "Lieu d’enregistrement: Moscou, Fédération de Russie - Date d’enregistrement: 3.4.2023: Numéro d’enregistrement: (NIF) 9704211491; (OGRN) 1237700341801"
        props:
          jurisdiction: ru
          address: "Moscou, Fédération de Russie"
          incorporationDate: 2023-04-03
          innCode: 9704211491
          ogrnCode: 1237700341801
      - match: "Principal établissement: Moscou, Fédération de Russie: Type d’entité: organisation non gouvernementale"
        props:
          jurisdiction: ru
          address: "Moscou, Fédération de Russie"
          legalForm: organisation non gouvernementale
      - match: "Lieu d’enregistrement: Alabuga, Fédération de Russie - Principal établissement: Fédération de Russie: Type d’entité: société à responsabilité limitée"
        props:
          jurisdiction: ru
          address: "Alabuga, Fédération de Russie"
          legalForm: société à responsabilité limitée
      - match: "Principal établissement: Fédération de Russie: Lieu des activités: Ukraine, Fédération de Russie"
        props:
          jurisdiction:
            - ua
            - ru
      - match: "Type d’entité: société à responsabilité limitée; fournisseur de composants aéronautiques"
        props:
          legalForm: société à responsabilité limitée
          description: fournisseur de composants aéronautiques
      - match: "Lieu d’enregistrement: Fédération de Russie, Kraï de Krasnodar, Krasnodar, ul.Fadeeva (massif résidentiel Pachkovsky) Ter, 429/1 POD A, bureau 17 - Date d’enregistrement: 4.2.2004: Numéro d’enregistrement: 1042307154548"
        props:
          jurisdiction: ru
          address: "Fédération de Russie, Kraï de Krasnodar, Krasnodar, ul.Fadeeva (massif résidentiel Pachkovsky) Ter, 429/1 POD A, bureau 17"
          incorporationDate: 2004-02-04
          registrationNumber: 1042307154548
      - match: "Principal établissement: Kraï de Krasnodar, Krasnodar, Fédération de Russie"
        props:
          jurisdiction: ru
          address: "Kraï de Krasnodar, Krasnodar, Fédération de Russie"
      - match: "Lieu d’enregistrement: Moscou, Fédération de Russie (117525, Moscou, ul. Dnepropetrovskaya, D. 3, K. 5) - Date d’enregistrement: 24.11.2005 - Principal établissement: Fédération de Russie: Numéro d’identification fiscale: 7726531639"
        props:
          jurisdiction: ru
          address: "Moscou, Fédération de Russie (117525, Moscou, ul. Dnepropetrovskaya, D. 3, K. 5)"
          incorporationDate: 2005-11-24
          innCode: 7726531639
      - match: "Lieu d’enregistrement: Alabuga, Fédération de Russie - Principal établissement: Fédération de Russie: Type d’entité: société"
        props:
          jurisdiction: ru
          address: "Alabuga, Fédération de Russie"
          legalForm: société
      - match: "Numéro d’enregistrement - Type d’entité: société par actions - Lieu d’enregistrement: Fédération de Russie, région de Nizhny Novgorod, Nizhny Novgorod, st. Nartova, d. 6 k. 6, room 25 cab. 96 - Date d’enregistrement: 4.5.1993: 1025203018708"
        props:
          jurisdiction: ru
          legalForm: société par actions
          registrationNumber: 1025203018708
          incorporationDate: 1993-05-04
      - match: "Principal établissement: Arsenyev, Fédération de Russie: Type d'entité: société par actions"
        props:
          jurisdiction: ru
          address: "Arsenyev, Fédération de Russie"
          legalForm: société par actions
      - match: "Lieu d'enregistrement: Arsenyev, Fédération de Russie - Date d'enregistrement: 14.11.2002: Numéro d'enregistrement: 1022500510350"
        props:
          jurisdiction: ru
          address: "Arsenyev, Fédération de Russie"
          incorporationDate: 2002-11-14
          registrationNumber: 1022500510350
      - match: "Progress Arsenyev Aviation Company (www.rhc.aero): Site internet: Вертолёты России"
        props:
          website: "https://www.rhc.aero"
      - match: "Principal établissement: Fédération de Russie: Type d’entité: entreprise militaro- industrielle"
        props:
          jurisdiction: ru
          legalForm: entreprise militaro-industrielle
      - match: "Lieu d’enregistrement: Moscou, Fédération de Russie - Date d’enregistrement: 31.5.1994: Numéro d’enregistrement: 7701005930 (numéro d’identification fiscale)"
        props:
          jurisdiction: ru
          address: "Moscou, Fédération de Russie"
          incorporationDate: 1994-05-31
          registrationNumber: 7701005930
          innCode: 7701005930
      - match: "Lieu d’enregistrement: Saint-Pétersbourg, Fédération de Russie - Date d’enregistrement: 14.2.2011 - Principal établissement: Fédération de Russie: Numéro d’identification fiscale: 7804454896"
        props:
          jurisdiction: ru
          address: "Saint-Pétersbourg, Fédération de Russie"
          incorporationDate: 2011-02-14
          innCode: 7804454896
      - match: "Personne associée: Pavel Alekseevich Marinychev (PDG)"
        associates:
          - Pavel Alekseevich Marinychev
      - match:
          - "Principal lieu d’activité: Fédération de Russie"
          - "Lieu d’enregistrement: Fédération de Russie"
        props:
          jurisdiction: ru
      - match: "Date d’enregistrement: 17/07/2002"
        props:
          incorporationDate: 2002-07-17
      - match: "Lieu d’enregistrement: Damas, Syrie - Date d’enregistrement: 2007 - Principal établissement: Syrie: /"
        props:
          jurisdiction: sy
          address: "Damas, Syrie"
          incorporationDate: 2007
      - match: "Type d'entité: société à responsabilité limitée (Limited Company) - Date d'enregistrement: 2018: /"
        props:
          legalForm: Limited Company
          incorporationDate: 2018
      - match: "Type d'entité: entité publique - Date d'enregistrement: 1993: /"
        props:
          legalForm: entité publique
          incorporationDate: 1993
      - match: "Lieu d’enregistrement: Damas, Syrie - Date d’enregistrement: 2023 - Principal établissement: Damas, Syrie: /"
        props:
          jurisdiction: sy
          address: "Damas, Syrie"
          incorporationDate: 2023
      - match: "Type d'entité: société à responsabilité limitée (Limited Company) - Date d'enregistrement: 2009: /"
        props:
          legalForm: Limited Company
          incorporationDate: 2009
      - match: "Type d'entité: société à responsabilité limitée (Limited Company): /"
        props:
          legalForm: Limited Company
      - match: "Lieu d’enregistrement: Syrie, Dubaï - Principal établissement: Damas, Syrie: /"
        props:
          jurisdiction:
            - sy
            - ae
          address: "Damas, Syrie"
      - match: "Type d'entité: entreprise contrôlée par l'État - Date d'enregistrement: 1997: /"
        props:
          legalForm: entreprise contrôlée par l'État
          incorporationDate: 1997
      - match: "Type d’entité: société par actions - Lieu d’enregistrement: Fédération de Russie - Date d’enregistrement: 14.12.2010: /"
        props:
          legalForm: société par actions
          incorporationDate: 2010-12-14
      - match: "Type d’entité: Joint Stock Company (société par actions) - Lieu d’enregistrement: Fédération de Russie - Date d’enregistrement: 5.11.2008: /"
        props:
          legalForm: Joint Stock Company
          jurisdiction: ru
          incorporationDate: 2008-11-05
      - match: "Numéro d'enregistrement : 1086726001614"
        props:
          ogrnCode: 1086726001614
      - match: "Type d’entité: entreprise fédérale d’État - Lieu d’enregistrement: Fédération de Russie, 393192, Tambov region, Kotovsk, Truda Ave., 23 - Date d’enregistrement: 16.8.2000: /"
        props:
          legalForm: entreprise fédérale d’État
          jurisdiction: ru
          address: "Fédération de Russie, 393192, Tambov region, Kotovsk, Truda Ave., 23"
          incorporationDate: 2000-08-16
      - match: "Type d’entité: société par actions - Lieu d’enregistrement: Fédération de Russie - Date d’enregistrement: 28.4.1993: /"
        props:
          legalForm: société par actions
          jurisdiction: ru
          incorporationDate: 1993-04-28
      - match: "OGRN: 770801001"
        props:
          registrationNumber: 770801001 # does't validate as OGRN
      - match: "Type d’entité: société par actions - Lieu d’enregistrement: Fédération de Russie - Date d’enregistrement: 3.12.2002: /"
        props:
          legalForm: société par actions
          jurisdiction: ru
          incorporationDate: 2002-12-03
      - match: "Type d’entité: société publique par actions - Lieu d’enregistrement: Rostov, Moscou, Fédération de Russie - Date d’enregistrement: 23.9.2002: /"
        props:
          legalForm: société publique par actions
          jurisdiction: ru
          incorporationDate: 2002-09-23
      - match: "Type d’entité: société publique par actions - Lieu d’enregistrement: Ryazan, Fédération de Russie - Date d’enregistrement: 30.9.2002: /"
        props:
          legalForm: société publique par actions
          jurisdiction: ru
          incorporationDate: 2002-09-30
      - match: "Type d’entité: entreprise fédérale d’État - Lieu d’enregistrement: Fédération de Russie, 420032, Republic of Tatarstan, city of Kazan, Pervogo Maya Street, 14 - Date d’enregistrement: 25.6.2003: /"
        props:
          legalForm: entreprise fédérale d’État
          jurisdiction: ru
          address: "Fédération de Russie, 420032, Republic of Tatarstan, city of Kazan, Pervogo Maya Street, 14"
          incorporationDate: 2003-06-25
      - match: "Numéro d’enregistrement: 1031624002937"
        props:
          ogrnCode: 1031624002937
      - match: "Numéro d’immatriculation: 600122610"
        props:
          registrationNumber: 600122610
      - match: "Numéro d’immatriculation - Date d'enregistrement : 04/01/1996: 600390798"
        props:
          registrationNumber: 600390798
          incorporationDate: 1996-04-01
      - match: "Type d’entité: entreprise fédérale d’État - Lieu d’enregistrement: Fédération de Russie, 393192, Tambov region, Kotovsk, Truda Ave., 23 - Date d’enregistrement: 16.8.2000: /"
        props:
          legalForm: entreprise fédérale d’État
          jurisdiction: ru
          address: "Fédération de Russie, 393192, Tambov region, Kotovsk, Truda Ave., 23"
          incorporationDate: 2000-08-16
      - match: "Numéro d’immatriculation: 600122610"
        props:
          registrationNumber: 600122610
      - match: "Lieu d’enregistrement: Fédération de Russie - Date d’enregistrement: 24.2.2016: Numéro d’enregistrement: 5029208152"
        props:
          jurisdiction: ru
          incorporationDate: 2016-02-24
          registrationNumber: 5029208152
      - match: "Principal établissement: Fédération de Russie, Mytishchi"
        props:
          jurisdiction: ru
          address: "Fédération de Russie, Mytishchi"
      - match: "Type d’entité: société par actions - Date d’enregistrement: 14.10.2002: /"
        props:
          legalForm: société par actions
          incorporationDate: 2002-10-14
      - match: "Type d’entité: entreprise d’État fédérale Lieu d’enregistrement: Fédération de Russie - Date d’enregistrement: 13.12.2002 - Principal établissement: Fédération de Russie: Numéro d’enregistrement: 1020202089115"
        props:
          jurisdiction: ru
          legalForm: entreprise d'État fédérale
          incorporationDate: 2002-12-13
          ogrnCode: 1020202089115
      - match: "Lieu d'enregistrement: Fédération de Russie, 620091, Sverdlovsk region, Yekaterinburg, Kosmonavtov Ave., building 18 - Date d'enregistrement: 31.5.1994 - Principal établissement: Fédération de Russie: Numéro d'identification fiscale: 6663003800"
        props:
          jurisdiction: ru
          address: "Fédération de Russie, 620091, Sverdlovsk region, Yekaterinburg, Kosmonavtov Ave., building 18"
          incorporationDate: 1994-05-31
          innCode: 6663003800
      - match: "Lieu d'enregistrement: Fédération de Russie (606083, région de Nizhny Novgorod, district de Volodarsky, Mulino) - Date d'enregistrement: 14.12.2009 - Principal établissement: Fédération de Russie: 3666162144 (numéro d'identification fiscale)"
        props:
          jurisdiction: ru
          address: "606083, région de Nizhny Novgorod, district de Volodarsky, Mulino"
          incorporationDate: 2009-12-14
          innCode: 3666162144
      - match: "Fédération de Russie (125183, Moscou, Bolshaya Akademicheskaya st., 73 k. 3, premises. 5n) - Date d'enregistrement: 29.5.2020 - Principal établissement: Fédération de Russie: 9715384055 (numéro d'identification fiscale)"
        props:
          jurisdiction: ru
          address: "125183, Moscou, Bolshaya Akademicheskaya st., 73 k. 3, premises. 5n"
          incorporationDate: 2020-05-29
          innCode: 9715384055
      - match: "Type d’entité: société à responsabilité limitée - Lieu d’enregistrement: Fédération de Russie - Date d’enregistrement: 27.11.2015: /"
        props:
          legalForm: société à responsabilité limitée
          jurisdiction: ru
          incorporationDate: 2015-11-27
      - match: "Type d’entité: société par actions - Lieu d’enregistrement: Moscou, Fédération de Russie - Date d’enregistrement: 18.7.2005: /"
        props:
          legalForm: société par actions
          jurisdiction: ru
          incorporationDate: 2005-07-18
      - match: "Numéro d’identification fiscale: 7722307636"
        props:
          innCode: 7722307636
      - match: "Lieu d’enregistrement: Fédération de Russie, Omsk region, Omsk, Karl Marx Avenue, 41 - Date d’enregistrement: 24.7.2002 Principal établissement: Fédération de Russie: Numéro d’identification fiscale: 5508000955"
        props:
          jurisdiction: ru
          address: "Fédération de Russie, Omsk region, Omsk, Karl Marx Avenue, 41"
          incorporationDate: 2002-07-24
          innCode: 5508000955
      - match: "Type d’entité: fait partie du ministère russe de la défense - Lieu d’enregistrement: Fédération de Russie: /"
        props:
          legalForm: fait partie du ministère russe de la défense
          jurisdiction: ru
      - match: "Type d’entité: société par actions - Lieu d’enregistrement: Petrovsk, Fédération de Russie - Date d’enregistrement: 21.1.2014: /"
        props:
          legalForm: société par actions
          jurisdiction: ru
          incorporationDate: 2014-01-21
      - match: "Type d’entité: fondation caritative: Lieu d’enregistrement: Minsk, République de Biélorussie"
        props:
          legalForm: fondation caritative
          jurisdiction: by
      - match: "Lieu d’enregistrement: Moscou, Fédération de Russie - Date d’enregistrement: 8.9.2005: /"
        props:
          jurisdiction: ru
          incorporationDate: 2005-09-08
      - match: "Type d’entité: société par actions - Lieu d’enregistrement: Fédération de Russie, 624981, Sverdlovsk region, Serov city, Aglomeratchikov str. 10 - Date d’enregistrement: 23.12.2011: /"
        props:
          legalForm: société par actions
          jurisdiction: ru
          address: "Fédération de Russie, 624981, Sverdlovsk region, Serov city, Aglomeratchikov str. 10"
          incorporationDate: 2011-12-23
      - match: "Type d’entité: société par actions - Lieu d’enregistrement: Petrovsk, Fédération de Russie - Date d’enregistrement: 21.1.2014: /"
        props:
          legalForm: société par actions
          jurisdiction: ru
          incorporationDate: 2014-01-21
      - match: "Type d’entité: organisation non gouvernementale"
        props:
          legalForm: organisation non gouvernementale
      - match: "Lieu d’enregistrement: Fédération de Russie, 420036, Republic of Tatarstan, Kazan, Dementyeva st., 1 - Type d’entité: société par actions - Date d’enregistrement: 23.4.2002 Principal établissement: Fédération de Russie: Numéro d’identification fiscale: 1661008339"
        props:
          jurisdiction: ru
          address: "Fédération de Russie, 420036, Republic of Tatarstan, Kazan, Dementyeva st., 1"
          legalForm: société par actions
          incorporationDate: 2002-04-23
          innCode: 1661008339
      - match: "Type d’entité: société par actions - Lieu d’enregistrement: Saint-Pétersbourg, Fédération de Russie - Date d’enregistrement: 18.5.2006: /"
        props:
          legalForm: société par actions
          jurisdiction: ru
          incorporationDate: 2006-05-18
      - match: "Type d'entité: société par actions - Lieu d'enregistrement: Saint-Pétersbourg, Fédération de Russie : Numéro d'enregistrement: 1227800167242"
        props:
          legalForm: société par actions
          jurisdiction: ru
          registrationNumber: 1227800167242
      - match: "Type d’entité: entreprise fédérale d’État - Lieu d’enregistrement: Fédération de Russie, 393192, Tambov region, Kotovsk, Truda Ave., 23 - Date d’enregistrement: 16.8.2000: /"
        props:
          legalForm: entreprise fédérale d’État
          jurisdiction: ru
          address: "Fédération de Russie, 393192, Tambov region, Kotovsk, Truda Ave., 23"
          incorporationDate: 2000-08-16
      - match: "Type d’entité: entreprise publique fédérale - Lieu d’enregistrement: Fédération de Russie - Date d’enregistrement: 30.3.1992: /"
        props:
          legalForm: entreprise publique fédérale
          jurisdiction: ru
          incorporationDate: 1992-03-30
      - match:
          - "Lieu d’enregistrement: République populaire démocratique de Corée"
          - "Principal établissement: République populaire démocratique de Corée"
        props:
          jurisdiction: kp
      - match: "Type d’entité: société par actions - Lieu d’enregistrement: 01, Yuzhny mkr, Iskitim, Novosibirsk region, 633208, Fédération de Russie Date d’enregistrement: 1.7.2011 - Principal établissement: Fédération de Russie: Numéro d’enregistrement: 1115483001567"
        props:
          jurisdiction: ru
          address: "01, Yuzhny mkr, Iskitim, Novosibirsk region, 633208, Fédération de Russie"
          legalForm: société par actions
          incorporationDate: 2011-07-01
          registrationNumber: 1115483001567
      - match: "Type d’entité: société par actions - Lieu d’enregistrement: Fédération de Russie, Saint-Pétersbourg - Date d’enregistrement: 13.5.1992 Principal établissement: Fédération de Russie: Numéro d’enregistrement: 7814027653"
        props:
          jurisdiction: ru
          address: "Fédération de Russie, Saint-Pétersbourg"
          legalForm: société par actions
          incorporationDate: 1992-05-13
          registrationNumber: 7814027653
      - match: "Type d’entité: société par actions - Date d’enregistrement: 5.5.2003: /"
        props:
          legalForm: société par actions
          incorporationDate: 2003-05-05
      - match: "Lieu d’enregistrement: Moscou, Fédération de Russie - Date d’enregistrement: 8.5.2009 - Type d’entité: société publique par actions: Numéro d’enregistrement: 1097746281160"
        props:
          jurisdiction: ru
          address: "Moscou, Fédération de Russie"
          incorporationDate: 2009-05-08
          legalForm: société publique par actions
          registrationNumber: 1097746281160
      - match: "Type d’entité: société par actions - Lieu d’enregistrement: Fédération de Russie, 191014, Saint-Pétersbourg, Paradnaya st., 8 - Date d’enregistrement: 16.8.2010: /"
        props:
          legalForm: société par actions
          jurisdiction: ru
          address: "Fédération de Russie, 191014, Saint-Pétersbourg, Paradnaya st., 8"
          incorporationDate: 2010-08-16
      - match: "Numéro d’enregistrement: 1107847269045"
        props:
          registrationNumber: 1107847269045
      - match: "Type d’entité: société par actions - Lieu d’enregistrement: Fédération de Russie - Date d’enregistrement: 13.3.2009: /"
        props:
          legalForm: société par actions
          jurisdiction: ru
          incorporationDate: 2009-03-13
      - match: "Numéro d’enregistrement: 6453104288"
        props:
          registrationNumber: 6453104288
      - match: "Type d’entité: société à responsabilité limitée Lieu d’enregistrement: Fédération de Russie - Date d’enregistrement: 27.10.2003 - Principal établissement: Fédération de Russie: Numéro d’enregistrement: 1037723044039"
        props:
          jurisdiction: ru
          legalForm: société à responsabilité limitée
          incorporationDate: 2003-10-27
          registrationNumber: 1037723044039
      - match: "Lieu d’enregistrement: Moscou, Fédération de Russie: /"
        props:
          jurisdiction: ru
          address: "Moscou, Fédération de Russie"
      - match: "Type d’entité: société par actions - Lieu d’enregistrement: Moscou, Fédération de Russie - Date d’enregistrement: 22.6.2005: /"
        props:
          legalForm: société par actions
          jurisdiction: ru
          incorporationDate: 2005-06-22
      - match: "Type d’entité: société par actions - Lieu d’enregistrement: Petrovsk, Fédération de Russie - Date d’enregistrement: 21.1.2014: /"
        props:
          legalForm: société par actions
          jurisdiction: ru
          incorporationDate: 2014-01-21
      - match: "Type d’entité: société par actions - Date d’enregistrement: 7.5.2008: Numéro d’enregistrement: 1085261002628"
        props:
          legalForm: société par actions
          incorporationDate: 2008-05-07
          registrationNumber: 1085261002628
      - match:
          - "Zones d'activité: bande de Gaza, Cisjordanie, Sud-Liban"
          - "Zones d’activité: bande de Gaza, Cisjordanie, Sud-Liban"
        props:
          country:
            - Gaza Strip
            - West Bank
            - Lebanon
      - match: "Type d’entité: entreprise fédérale d’État - Lieu d’enregistrement: Fédération de Russie, 393192, Tambov region, Kotovsk, Truda Ave., 23 - Date d’enregistrement: 16.8.2000: /"
        props:
          legalForm: entreprise fédérale d’État
          jurisdiction: ru
          address: "Fédération de Russie, 393192, Tambov region, Kotovsk, Truda Ave., 23"
          incorporationDate: 2000-08-16
      - match: "Type d’entité: entreprise publique fédérale - Lieu d’enregistrement: Fédération de Russie - Date d’enregistrement: 30.3.1992: /"
        props:
          legalForm: entreprise publique fédérale
          jurisdiction: ru
          incorporationDate: 1992-03-30
      - match: "Type d’entité: société par actions - Lieu d’enregistrement: Fédération de Russie, 191014, Saint-Pétersbourg, Paradnaya st., 8 - Date d’enregistrement: 16.8.2010: /"
        props:
          legalForm: société par actions
          jurisdiction: ru
          address: "Fédération de Russie, 191014, Saint-Pétersbourg, Paradnaya st., 8"
          incorporationDate: 2010-08-16
      - match: "Type d’entité: société par actions - Lieu d’enregistrement: Fédération de Russie - Date d’enregistrement: 13.3.2009: /"
        props:
          legalForm: société par actions
          jurisdiction: ru
          incorporationDate: 2009-03-13
      - match: "Directeur général: Victor Victorovich Branchugov"
        associates:
          - Victor Victorovich Branchugov
      - match: "Type d’entité: société par actions - Lieu d’enregistrement: Fédération de Russie - Date d’enregistrement: 18.10.1993: /"
        props:
          legalForm: société par actions
          jurisdiction: ru
          incorporationDate: 1993-10-18
      - match: "Type d’entité: société à responsabilité limitée - Date d’enregistrement: 18.3.2021: /"
        props:
          legalForm: société à responsabilité limitée
          incorporationDate: 2021-03-18
      - match: "Numéro d’identification fiscale: 9701173086"
        props:
          innCode: 9701173086
      - match: "Type d’entité: société à responsabilité limitée - Lieu d’enregistrement: Fédération de Russie - Date d’enregistrement: 6.9.2010: Numéro d’enregistrement: 1107746720322"
        props:
          legalForm: société à responsabilité limitée
          jurisdiction: ru
          incorporationDate: 2010-09-06
          registrationNumber: 1107746720322
      - match: "Type d'entité: société publique par actions - Lieu d'enregistrement: 222511, République de Biélorussie, Minsk Region, Borisov District, Borisov, Gagarin St., 54 - Date d'enregistrement: 25.6.1998: Numéro d'enregistrement: 600012284"
        props:
          legalForm: société publique par actions
          jurisdiction: by
          address: "222511, République de Biélorussie, Minsk Region, Borisov District, Borisov, Gagarin St., 54"
          incorporationDate: 1998-06-25
          registrationNumber: 600012284
      - match: "Type d’entité: société par actions non publique - Lieu d’enregistrement: Fédération de Russie - Date d’enregistrement: 29.8.2001: /"
        props:
          legalForm: société par actions non publique
          jurisdiction: ru
          incorporationDate: 2001-08-29
      - match: "Type d'entité: société par actions - Lieu d'enregistrement: Fédération de Russie, Moscou - Date d'enregistrement: 8.2.1993: /"
        props:
          legalForm: société par actions
          jurisdiction: ru
          incorporationDate: 1993-02-08
      - match: "Type d’entité: société par actions - Lieu d’enregistrement: Ryazan, Fédération de Russie - Date d’enregistrement: 18.2.2008: /"
        props:
          legalForm: société par actions
          jurisdiction: ru
          incorporationDate: 2008-02-18
      - match: "Type d’entité: société par actions - Lieu d’enregistrement: Omsk, Fédération de Russie - Date d’enregistrement: 31.1.2008: /"
        props:
          legalForm: société par actions
          jurisdiction: ru
          incorporationDate: 2008-01-31
      - match: "Directeur général: Oleg Yurevitsh Martinov"
        associates:
          - Oleg Yurevitsh Martinov
      - match: "Lieu d'enregistrement: Saint-Pétersbourg, Fédération de Russie - Date d'enregistrement: 3.7.2013 - Directeur général: Viktor Yurievitch Ilyin: INN 7802830545 BIN 1137847251740 PPC 780101001 OKPO 27492853"
        props:
          jurisdiction: ru
          address: "Saint-Pétersbourg, Fédération de Russie"
          incorporationDate: 2013-07-03
          innCode: 7802830545
          description: BIN 1137847251740, PPC 780101001
          # ppcCode: 780101001
          okpoCode: 27492853
        associates:
          - Viktor Yurievitch Ilyin
      - match: "Type d’entité: société à responsabilité limitée - Date d’enregistrement: 24.3.2008: /"
        props:
          legalForm: société à responsabilité limitée
          incorporationDate: 2008-03-24
      - match: "Lieu d’enregistrement: Fédération de Russie - Date d’enregistrement: 29.9.2009 -Principal établissement: Moscou, Fédération de Russie: Numéro d’enregistrement: 1095027010242"
        props:
          jurisdiction: ru
          incorporationDate: 2009-09-29
          address: "Moscou, Fédération de Russie"
          registrationNumber: 1095027010242
      - match: "Numéro d'enregistrement national: 1079847085966"
        props:
          registrationNumber: 1079847085966
      - match: "Type d’entité: société par actions cotée - Date d’enregistrement: 29.9.1992: /"
        props:
          legalForm: société par actions cotée
          incorporationDate: 1992-09-29
      - match: "Type d’entité: société publique par actions - Lieu d’enregistrement: République de Biélorussie - Date d’enregistrement: 11.9.1991: /"
        props:
          legalForm: société publique par actions
          jurisdiction: by
          incorporationDate: 1991-09-11
      - match: "Lieu d'enregistrement: Fédération de Russie (305502, région de Koursk, pos. Marshal Zhukov, military unit 32406) - Date d'enregistrement: 26.11.2009 - Principal établissement: Fédération de Russie: 4611010810 (numéro d'identification fiscale)"
        props:
          jurisdiction: ru
          address: "305502, région de Koursk, pos. Marshal Zhukov, military unit 32406"
          incorporationDate: 2009-11-26
          innCode: 4611010810
      - match: "Lieu d’enregistrement: Fédération de Russie, 424003, Republic of Mari El, Yoshkar-Ola, st. Suvorova, 15 - Date d’enregistrement: 18.4.2002 Principal établissement: Fédération de Russie: Numéro d’identification fiscale: 1200001885"
        props:
          jurisdiction: ru
          address: "Fédération de Russie, 424003, Republic of Mari El, Yoshkar-Ola, st. Suvorova, 15"
          incorporationDate: 2002-04-18
          innCode: 1200001885
      - match: "Type d’entité: société par actions - Lieu d’enregistrement: Reutov, Fédération de Russie - Date d’enregistrement: 28.2.2007: /"
        props:
          legalForm: société par actions
          jurisdiction: ru
          incorporationDate: 2007-02-28
      - match: "Type d’entité: société par actions - Lieu d’enregistrement: Kaspiysk, République du Daghestan, Fédération de Russie - Date d’enregistrement: 24.11.2000: /"
        props:
          legalForm: société par actions
          jurisdiction: ru
          incorporationDate: 2000-11-24
      - match: "OGRN: 1020502130351"
        props:
          ogrnCode: 1020502130351
      - match: "Lieu d’enregistrement: Fédération de Russie, 105120, Moscou, Syromyatnichesky pr-d, 6 k.1 - Principal établissement: Fédération de Russie: Numéro d’identification fiscale: 7709827690"
        props:
          jurisdiction: ru
          address: "Fédération de Russie, 105120, Moscou, Syromyatnichesky pr-d, 6 k.1"
          incorporationDate: 2002-11-06
          innCode: 7709827690
      - match: "Lieu d’enregistrement: Fédération de Russie, 432030, Ulyanovsk region, Ulyanovsk city, Narimanov Ave., 75 - Type d’entité: société par actions - Date d’enregistrement: 26.6.2008 Principal établissement: Fédération de Russie: Numéro d’identification fiscale: 7325081527"
        props:
          jurisdiction: ru
          address: "Fédération de Russie, 432030, Ulyanovsk region, Ulyanovsk city, Narimanov Ave., 75"
          legalForm: société par actions
          incorporationDate: 2008-06-26
          innCode: 7325081527
      - match: "Lieu d’enregistrement: Fédération de Russie, 129226, Moscou, Mira Avenue, 125 - Date d’enregistrement: 24.2.2011 - Principal établissement: Fédération de Russie: Numéro d’identification fiscale: 7717693545"
        props:
          jurisdiction: ru
          address: "Fédération de Russie, 129226, Moscou, Mira Avenue, 125"
          incorporationDate: 2011-02-24
          innCode: 7717693545
      - match: "Type d’entité: société à responsabilité limitée - Date d’enregistrement: 11.9.2020: /"
        props:
          legalForm: société à responsabilité limitée
          incorporationDate: 2020-09-11
      - match: "Lieu d’enregistrement: République de Biélorussie - Date d’enregistrement: 16.6.1992 - Principal établissement: République de Biélorussie: Numéro d’enregistrement: 300072763"
        props:
          jurisdiction: by
          incorporationDate: 1992-06-16
          registrationNumber: 300072763
      - match: "Type d’entité: société par actions - Lieu d’enregistrement: Petrovsk, Fédération de Russie  - Date d’enregistrement: 21.1.2014: /"
        props:
          legalForm: société par actions
          jurisdiction: ru
          incorporationDate: 2014-01-21
      - match: "Type d’entité: entreprise fédérale d’État  - Lieu d’enregistrement: Fédération de Russie, 393192, Tambov region, Kotovsk, Truda Ave., 23 - Date d’enregistrement: 16.8.2000: /"
        props:
          legalForm: entreprise fédérale d’État
          jurisdiction: ru
          address: "Fédération de Russie, 393192, Tambov region, Kotovsk, Truda Ave., 23"
          incorporationDate: 2000-08-16
      - match: "Type d’entité: entreprise publique fédérale  - Lieu d’enregistrement: Fédération de Russie - Date d’enregistrement: 30.3.1992: /"
        props:
          legalForm: entreprise publique fédérale
          jurisdiction: ru
          incorporationDate: 1992-03-30
      - match: "Type d’entité: société par actions  - Lieu d’enregistrement: Fédération de Russie, 191014, Saint-Pétersbourg, Paradnaya st., 8 - Date d’enregistrement: 16.8.2010: /"
        props:
          legalForm: société par actions
          jurisdiction: ru
          address: "Fédération de Russie, 191014, Saint-Pétersbourg, Paradnaya st., 8"
          incorporationDate: 2010-08-16
      - match: "Type d’entité: société par actions  - Lieu d’enregistrement: Fédération de Russie - Date d’enregistrement: 13.3.2009: /"
        props:
          legalForm: société par actions
          jurisdiction: ru
          incorporationDate: 2009-03-13
      - match: "Type d’entité: société par actions  - Date d’enregistrement: 3.10.2002: /"
        props:
          legalForm: société par actions
          incorporationDate: 2002-10-03
      - match: "Type d’entité: société par actions  - Date d’enregistrement: 12.9.2002: /"
        props:
          legalForm: société par actions
          incorporationDate: 2002-09-12
      - match: "Type d’entité: société publique par actions  - Lieu d’enregistrement: République de Biélorussie - Date d’enregistrement: 11.9.1991: /"
        props:
          legalForm: société publique par actions
          jurisdiction: by
          incorporationDate: 1991-09-11
      - match: "Type d’entité: société par actions  - Lieu d’enregistrement: Reutov, Fédération de Russie - Date d’enregistrement: 28.2.2007: /"
        props:
          legalForm: société par actions
          jurisdiction: ru
          incorporationDate: 2007-02-28
      - match: "Type d’entité: société à responsabilité limitée  - Date d’enregistrement: 17.9.2013: /"
        props:
          legalForm: société à responsabilité limitée
          incorporationDate: 2013-09-17
      - match: "Lieu d’enregistrement: Prague, République tchèque - Date d’enregistrement: 14.3.2023: CZ05185327"
        props:
          jurisdiction: cz
          address: "Prague"
          incorporationDate: 2023-03-14
          registrationNumber: CZ05185327
      - match: "Type d’entité: entité publique - Lieu d’enregistrement: Bandar Abbas, Iran - Date d’enregistrement: 1981 - Principal établissement: Iran: /"
        props:
          jurisdiction: ir
          address: "Bandar Abbas, Iran"
          incorporationDate: 1981
      - match: "Entité publique: /"
        props:
          legalForm: entité publique
      - match: "Numéro d’enregistrement: (Iran): 495080"
        props:
          registrationNumber: 495080
          jurisdiction: ir
      - match: "Numéro d’identification national (Iran): 14005997725"
        props:
          idNumber: 14005997725
          jurisdiction: ir
      - match: "Type d’entité: société à responsabilité limitée (SARL) - Lieu d’enregistrement: Iran  - Date d’enregistrement: 13.7.2016 - Principal établissement: Iran: /"
        props:
          legalForm: société à responsabilité limitée
          jurisdiction: ir
          incorporationDate: 2016-07-13
      - match: "déclarée à la préfecture du Nord (59) le 23 février 2018 sous le numéro W595030728: W595030728"
        props:
          jurisdiction: fr
          registrationNumber: W595030728
          incorporationDate: 2018-02-23
      - match: "déclarée à la préfecture du Rhône (69) le 23 novembre 2009 sous le numéro W691075246: W691075246"
        props:
          jurisdiction: fr
          registrationNumber: W691075246
          incorporationDate: 2009-11-23
      - match: "déclarée à la préfecture de police (75) le 28 mars 1990, sous le numéro W751148995: W751148995"
        props:
          jurisdiction: fr
          registrationNumber: W751148995
          incorporationDate: 1990-03-28
      - match: "déclarée le 1er juillet 2019 à la préfecture de police de Paris (75) sous le numéro W751252965 et le numéro SIREN 889271375 : W751252965"
        props:
          jurisdiction: fr
          registrationNumber:
            - W751252965
            - "889271375"
          incorporationDate: 2019-07-01
      - match: "Type d’entité: entité publique - Lieu d’enregistrement: Iran - Principal établissement: Iran: /"
        props:
          jurisdiction: ir
          legalForm: entité publique
      - match: "UNP: 100185185"
        props:
          taxNumber: 100185185
      - match: "Lieu d'enregistrement: Fédération de Russie, 125284, Moscou, Leningradskiy Prospekt, d. 31a, str. 1 - Type d'entité: société par actions -Date d'enregistrement: 20.12.2002 -Principal établissement: Fédération de Russi e: Numéro d'identification fiscale: 0814118403"
        props:
          jurisdiction: ru
          address: "Fédération de Russie, 125284, Moscou, Leningradskiy Prospekt, d. 31a, str. 1"
          legalForm: société par actions
          incorporationDate: 2002-12-20
          innCode: 0814118403
      - match: "Lieu d'enregistrement: Fédération de Russie, 620024, Ekaterinbourg, ulitsa Simkaya, d. 2 - Type d'entité: société par actions - Date d'enregistrement: 18.5.2009 - Principal établissement: Fédération de Russie: Numéro d'identification fiscale: 6674331056"
        props:
          jurisdiction: ru
          address: "Fédération de Russie, 620024, Ekaterinbourg, ulitsa Simkaya, d. 2"
          legalForm: société par actions
          incorporationDate: 2009-05-18
          innCode: 6674331056
      - match: "Date d’enregistrement: 20.5.2019, (enregistrement en tant que petite et moyenne entreprise) - 10.7.2023 (enregistrement en tant que petite entreprise): /"
        props:
          incorporationDate: 2019-05-20
      - match: "Type d’entité: société anonyme par actions - Lieu d’enregistrement: Fédération de Russie - Date d’enregistrement: 4.3.2006 - Principal établissement: Khimki, Fédération de Russie: /"
        props:
          jurisdiction: ru
          address: "Khimki, Fédération de Russie"
          legalForm: société anonyme par actions
          incorporationDate: 2006-03-04
      - match: "Type d'entité: Société par actions - Lieu d'enregistrement: Fédération de Russie - Date d'enregistrement: 31.12.2013 - Principal établissement: Fédération de Russie: /"
        props:
          jurisdiction: ru
          legalForm: société par actions
          incorporationDate: 2013-12-31
      - match: "Type d'entité: Société par actions - Lieu d'enregistrement: 672530, territoire de Transbaïkalie, district de Tchita, 1 Atamanovskoye, Atamanovka, ul. Zavodskaya, d.1 - Date d'enregistrement: 11.6.2009: /"
        props:
          jurisdiction: ru
          address: "672530, territoire de Transbaïkalie, district de Tchita, 1 Atamanovskoye, Atamanovka, ul. Zavodskaya, d.1"
          legalForm: société par actions
          incorporationDate: 2009-06-11
      - match: "Type d'entité: Société par actions - Lieu d'enregistrement: 672530, territoire de Transbaïkalie, district de Tchita, 1 Atamanovskoye, Atamanovka, ul. Zavodskaya, d.1 - Date d'enregistrement: 11.6.2009 - Principal établissement: Fédération de Russie: /"
        props:
          jurisdiction: ru
          address: "672530, territoire de Transbaïkalie, district de Tchita, 1 Atamanovskoye, Atamanovka, ul. Zavodskaya, d.1"
          legalForm: société par actions
          incorporationDate: 2009-06-11
      - match: "Type d'entité: société par action"
        props:
          legalForm: société par action
      - match: "Type d'entité: société par actions cotée - Lieu d'enregistrement: Fédération de Russie - Date d'enregistrement: 10.11.1993 (date de constitution: 12.9.2002) - Principal établissement: Fédération de Russie - Numéro d'identification fiscale: 7449006184: 1027402696023"
        props:
          jurisdiction: ru
          legalForm: société par actions cotée
          incorporationDate: 1993-11-10
          registrationNumber: 1027402696023
      - match: "Type d'entité: société par actions - Lieu d'enregistrement: Saint-Pétersbourg et Moscou, Fédération de Russie - Date d'enregistrement: 1988: 1027739028712"
        props:
          jurisdiction: ru
          address: "Saint-Pétersbourg et Moscou"
          legalForm: société par actions
          incorporationDate: 1988
          registrationNumber: 1027739028712
      - match: "Type d’entité: société par actions - Lieu d'enregistrement: Fédération de Russie - Date d'enregistrement: 12.11.1993: 1027700032161"
        props:
          jurisdiction: ru
          legalForm: société par actions
          incorporationDate: 1993-11-12
          registrationNumber: 1027700032161
      - match: "Type d'entité: entreprise unitaire publique fédérale - Lieu d'enregistrement: Donetsk, Ukraine - Date d'enregistrement: 8.6.2023 - Principal établissement: Ukraine: /"
        props:
          jurisdiction: ua
          address: "Donetsk, Ukraine"
          legalForm: entreprise unitaire publique fédérale
          incorporationDate: 2023-06-08
      - match: "Type d'entité: Société par actions - Lieu d'enregistrement: Fédération de Russie - Date d'enregistrement: 7.9.2020 - Principal établissement: Fédération de Russie: /"
        props:
          jurisdiction: ru
          legalForm: société par actions
          incorporationDate: 2020-09-07
      - match: "Type d'entité: société à responsabilité limitée - Lieu d'enregistrement: Fédération de Russie - Date d'enregistrement: 3.2.2016 - Principal établissement: Fédération de Russie - Numéro d'identification fiscale: 7811285656: 1167847076825"
        props:
          jurisdiction: ru
          legalForm: société à responsabilité limitée
          incorporationDate: 2016-02-03
          innCode: 7811285656
          registrationNumber: 1167847076825
      - match: "Type d'entité: société à responsabilité limitée - Lieu d'enregistrement: Nakhodka, Fédération de Russie - Principal établissement: Nakhodka, Fédération de Russie: /"
        props:
          jurisdiction: ru
          address: "Nakhodka, Fédération de Russie"
          legalForm: société à responsabilité limitée
      - match: "Type d'entité: société à responsabilité limitée - Lieu d'enregistrement: Fédération de Russie, 105082, Moscou, Rubtsovskaya nab., 3 p. 1 -Date d'enregistrement: 29.4.2011 - Principal établissement: Moscou, Fédération de Russie: OGRN: 1117746345166"
        props:
          jurisdiction: ru
          address: "Fédération de Russie, 105082, Moscou, Rubtsovskaya nab., 3 p. 1"
          legalForm: société à responsabilité limitée
          incorporationDate: 2011-04-29
          registrationNumber: 1117746345166
      - match: "Type d'entité: société à responsabilité limitée - Lieu d'enregistrement: Fédération de Russie - Date d'enregistrement: 26.9.2016 - Principal établissement: Fédération de Russie - Numéro d'identification fiscale: 5050127869: 1165050054949"
        props:
          jurisdiction: ru
          legalForm: société à responsabilité limitée
          incorporationDate: 2016-09-26
          innCode: 5050127869
          registrationNumber: 1165050054949
      - match: "Type d'entité: établissement scientifique relevant du budget de l'État fédéral - Lieu d'enregistrement: Fédération de Russie - Date d'enregistrement: 12.4.1993 (date de constitution: 11.9.2002) - Principal établissement: Fédération de Russie: /"
        props:
          jurisdiction: ru
          legalForm: établissement scientifique relevant du budget de l'État fédéral
          incorporationDate: 1993-04-12
      - match: "Lieu d'enregistrement: Fédération de Russie, 123298, Moscou, ulitsa Narodnogo Opolcheniya, d. 40, k. 2- Type d'entité: société à responsabilité limitée - Date d'enregistrement: 25.11.2002 - Principal établissement: Fédération de Russie: Numéro d'identification fiscale: 8608049090"
        props:
          jurisdiction: ru
          address: "Fédération de Russie, 123298, Moscou, ulitsa Narodnogo Opolcheniya, d. 40, k. 2"
          legalForm: société à responsabilité limitée
          incorporationDate: 2002-11-25
          innCode: 8608049090
      - match: "Type d'entité: société à responsabilité limitée"
        props:
          legalForm: société à responsabilité limitée
      - match: "Type d'entité: société à responsabilité limitée - Lieu d'enregistrement: Fédération de Russie - Date d'enregistrement: 6.3.2019 - Principal établissement: Fédération de Russie - Numéro d'identification fiscale: 7816691806: 119784705296"
        props:
          jurisdiction: ru
          legalForm: société à responsabilité limitée
          incorporationDate: 2019-03-06
          innCode: 7816691806
          registrationNumber: 119784705296
      - match: "Type d'entité: Société par actions - Lieu d'enregistrement: Fédération de Russie - Date d'enregistrement: 26.3.2014 - Principal établissement: Fédération de Russie: /"
        props:
          jurisdiction: ru
          legalForm: société par actions
          incorporationDate: 2014-03-26
      - match: "Lieu d'enregistrement: 630004, Ulitsa Lenina d. 52, Novossibirsk, Fédération de Russie - Type d'entité: société à responsabilité limitée - Date d'enregistrement: 27.4.2015 - Principal établissement: Fédération de Russie: Numéro d'identification fiscale: 5407223338"
        props:
          jurisdiction: ru
          address: "630004, Ulitsa Lenina d. 52, Novossibirsk"
          legalForm: société à responsabilité limitée
          incorporationDate: 2015-04-27
          innCode: 5407223338
      - match: "Type d'entité: société par action"
        props:
          legalForm: société par action
      - match: "Type d'entité: Compagnie aérienne / Société par actions ouverte - Lieu d'enregistrement: Iekaterinbourg, Fédération de Russie - Date d'enregistrement: 28.12.1993 - Principal établissement: Fédération de Russie: /"
        props:
          jurisdiction: ru
          address: "Iekaterinbourg, Fédération de Russie"
          legalForm: société par actions ouverte
          incorporationDate: 1993-12-28
      - match: "Numéros d'enregistrement: 6608003013"
        props:
          registrationNumber: 6608003013
      - match: "Numéros d'enregistrement: 668501001"
        props:
          registrationNumber: 668501001
      - match: "Type d'entité: société à responsabilité limitée - Lieu d'enregistrement: Fédération de Russie - Date d'enregistrement: 18.6.2010 - Principal établissement: Fédération de Russie - Numéro d'identification fiscale: 5008054416: 1105047006954"
        props:
          jurisdiction: ru
          legalForm: société à responsabilité limitée
          incorporationDate: 2010-06-18
          innCode: 5008054416
          registrationNumber: 1105047006954
      - match: "Type d'entité: organisation non gouvernementale"
        props:
          legalForm: organisation non gouvernementale
      - match: "Numéro d’enregistrement: 1237700470842"
        props:
          registrationNumber: 1237700470842
      - match: "Lieu d'enregistrement: Moscou, Fédération de Russie - Date d'enregistrement: 19.9.2014 -Principal établissement: Fédération de Russie: 1147799015231"
        props:
          jurisdiction: ru
          address: "Moscou, Fédération de Russie"
          incorporationDate: 2014-09-19
          registrationNumber: 1147799015231
      - match: "Lieu d'enregistrement: Leningradskaya ul., bâtiment 41 Gourzouf, Yalta, Crimée Ukraine - Date d'enregistrement: 15.8.2014 - Principal établissement: Crimée, Ukraine: /"
        props:
          jurisdiction: ua
          address: "Leningradskaya ul., bâtiment 41 Gourzouf, Yalta, Crimée Ukraine"
          incorporationDate: 2014-08-15
      - match: "Type d'entité: Société par actions - Lieu d'enregistrement: Fédération de Russie - Date d'enregistrement: 2.7.1990 (date de constitution: 30.7.2002) - Principal établissement: Fédération de Russie: /"
        props:
          jurisdiction: ru
          legalForm: société par actions
          incorporationDate: 1990-07-02
      - match: "1077328004841"
        props:
          registrationNumber: 1077328004841
      - match: "Date d'enregistrement: 9.7.2007 - Type d'entité: société à responsabilité limitée - Principal établissement: Fédération de Russie -: 1077757722206"
        props:
          incorporationDate: 2007-07-09
          legalForm: société à responsabilité limitée
          registrationNumber: 1077757722206
      - match: "Type d'entité: Société par actions ouverte - Lieu d'enregistrement: Biélorussie - Date d'enregistrement: 24.3.1992. Principal établissement: Biélorussie: OKPO: 14541426"
        props:
          jurisdiction: by
          legalForm: société par actions ouverte
          incorporationDate: 1992-03-24
          registrationNumber: 14541426
      - match: "Type d’entité: société à responsabilité limitée internationale: /"
        props:
          legalForm: société à responsabilité limitée internationale
      - match: "Type d'entité: entreprise unitaire publique fédérale - Lieu d'enregistrement: Donetsk, Ukraine - Date d'enregistrement: 8.6.2023  - Principal établissement: Ukraine: /"
        props:
          jurisdiction: ua
          address: "Donetsk, Ukraine"
          legalForm: entreprise unitaire publique fédérale
          incorporationDate: 2023-06-08
      - match: "Type d’entité: société par actions - Lieu d’enregistrement: Moscou, Fédération de Russie - Date d’enregistrement: 12.7.2023: /"
        props:
          jurisdiction: ru
          address: "Moscou, Fédération de Russie"
          legalForm: société par actions
          incorporationDate: 2023-07-12
      - match: "Type d'entité: organisation non  gouvernementale"
        props:
          legalForm: organisation non gouvernementale
      - match: "Type d'entité: société à responsabilité limitée - Lieu d'enregistrement: Téhéran, Iran - Date d'enregistrement: 24.10.2016 - Principal établissement: Iran: /"
        props:
          jurisdiction: ir
          address: "Téhéran, Iran"
          legalForm: société à responsabilité limitée
          incorporationDate: 2016-10-24
      - match: "Type d’entité: gang haïtien opérant principalement dans les départements de l’Artibonite et du Nord-Ouest: /"
        props:
          description: gang haïtien
          address: "départements de l’Artibonite et du Nord-Ouest"
      - match: "Type d’entité: centre de rétention - Lieu d’enregistrement: Comté d’Onsong, province de Hamgyong du Nord, République populaire démocratique de Corée (RPDC): /"
        props:
          jurisdiction: kp
          description: centre de rétention
          address: "Comté d’Onsong, province de Hamgyong du Nord, République populaire démocratique de Corée (RPDC)"
      - match: "Date de création: 15.12.2023  - Lieu de création: Kenya: /"
        props:
          jurisdiction: ke
          incorporationDate: 2023-12-15
      - match: "Entités associées: Ammunition and Metallurgy Industries Group [Groupe des industries des munitions et de la métallurgie] (AMIG); ministère de la défense et de la logistique des forces armées (MODAFL); Defense Industries Organization [Organisation des industries de la défense] (DIO): /"
        associates:
          - Ammunition and Metallurgy Industries Group
          - ministère de la défense et de la logistique des forces armées
          - Defense Industries Organization
      - match: "Ali Akbar Tabatabaei (IRGC); Azim Aghajani (IRGC) - Entités associées: Corps des gardiens de la révolution islamique (IRGC): Personnes associées"
        associates:
          - Ali Akbar Tabatabaei (IRGC)
          - Azim Aghajani(IRGC)
          - Corps des gardiens de la révolution islamique (IRGC)
      - match: "Type d'entité: entité publique - Lieu d'enregistrement: Téhéran, Iran - Établissement principal: Téhéran, Iran - Entités associées: ministère de la défense et de la logistique des forces armées (MODAFL); Defense Industries Organization [Organisation des industries de la défense] (DIO): /"
        associates:
          - ministère de la défense et de la logistique des forces armées (MODAFL)
          - Defense Industries Organization (DIO)
          - Organisation des industries de la défense
        props:
          jurisdiction: ir
          legalForm: entité publique
          address: "Téhéran, Iran"
      - match: "Entités associées: Shahid Sattari Industries; Parchin Ammunition Industries; 7th of Tir Industries Complex; Yazd Metallurgy Industries; Khorasan Metallurgy Industries. Shahid Sayyade Shirazi Industries; Defense Industries Organization [Organisation des industries de la défense] (DIO): /"
        associates:
          - Shahid Sattari Industries
          - Parchin Ammunition Industries
          - 7th of Tir Industries Complex
          - Yazd Metallurgy Industries
          - Khorasan Metallurgy Industries
          - Shahid Sayyade Shirazi Industries
          - Defense Industries Organization (DIO)
          - Organisation des industries de la défense
      - match: "Date d'enregistrement: 1989 et 1990 - Entités associées: Corps des gardiens de la révolution islamique (IRGC); Khatam al-Anbiya Construction Headquarters (KAA): Lieu d'enregistrement: Iran"
        associates:
          - Corps des gardiens de la révolution islamique (IRGC)
          - Khatam al-Anbiya Construction Headquarters (KAA)
        props:
          jurisdiction: ir
          incorporationDate:
            - 1989
            - 1990
      - match: "Date de création: 15.12.2023 - Lieu de création: Kenya: /"
        props:
          jurisdiction: ke
          incorporationDate: 2023-12-15
      - match: "Lieu d'enregistrement: Iran - Date d'enregistrement: 1961 - Code économique: 411315443678: No d'enregistrement: 860"
        props:
          jurisdiction: ir
          incorporationDate: 1961
          taxNumber: 411315443678
          registrationNumber: 860
      - match: "Defense Industries Organization [Organisation des industries de la défense] (DIO); Ammunition and Metallurgy Industries Group [Groupe des industries des munitions et de la métallurgie] (AMIG); Shahid Sayyad Shirazi Industrie: Entités associées"
        associates:
          - Defense Industries Organization (DIO)
          - Ammunition and Metallurgy Industries Group (AMIG)
          - Shahid Sayyad Shirazi Industrie
      - match: "Lieu d'enregistrement: Iran - Établissement principal: Iran - Entités associées: Corps des gardiens de la révolution islamique (IRGC); Khatam al-Anbiya Construction Headquarters (KAA): Type d'entité: entreprise publique"
        associates:
          - Corps des gardiens de la révolution islamique (IRGC)
          - Khatam al-Anbiya Construction Headquarters (KAA)
        props:
          legalForm: entreprise publique
          jurisdiction: ir
      - match: "Lieu d'enregistrement: Mashad, Iran - Date d'enregistrement: 1993 - Établissement principal: Mashad, Iran: /"
        props:
          jurisdiction: ir
          address: "Mashad, Iran"
          incorporationDate: 1993
      - match: "Entités associées: Defense Industries Organization [Organisation des industries de la défense] (DIO); Ammunition and Metallurgy Industries Group [Groupe des industries des munitions et de la métallurgie] (AMIG): /"
        associates:
          - Defense Industries Organization (DIO)
          - Ammunition and Metallurgy Industries Group (AMIG)
      - match: "No d'enregistrement: société coopérative no 892"
        props:
          registrationNumber: 892
      - match: "ministère de la défense et de la logistique des forces armées (MODAFL); Defense Industries Organization [Organisation des industries de la défense] (DIO); Aerospace Industries Organization [Organisation des industries aérospatiales] (AIO); Iran Electronic Industries (IEI): Entités associées"
        associates:
          - ministère de la défense et de la logistique des forces armées (MODAFL)
          - Defense Industries Organization (DIO)
          - Aerospace Industries Organization (AIO)
          - Iran Electronic Industries (IEI)
      - match: "N° d'identification national - Établissement principal: Téhéran, Iran - Entités associées: Aerospace Industries Organisation [Organisation des industries aérospatiales] (AIO): 10103864724"
        associates:
          - Aerospace Industries Organisation (AIO)
        props:
          jurisdiction: ir
          address: "Téhéran, Iran"
          idNumber: 10103864724
      - match: "N° d'enregistrement - Lieu d'enregistrement: Iran - Date d'enregistrement: 1992: 339747"
        props:
          jurisdiction: ir
          incorporationDate: 1992
          registrationNumber: 339747
      - match: "Lieu d'enregistrement: Iran - Date d'enregistrement: 2000 (en tant que Qeshm Air) et renommée Yas Air en 2008 - Entités associées:  Corps des gardiens de la révolution islamique (IRGC) - Sites internet: pouyaair.com; yasair.com: Type d'entité: compagnie aérienne de fret"
        associates:
          - Corps des gardiens de la révolution islamique (IRGC)
        props:
          jurisdiction: ir
          incorporationDate:
            - 2000
            - 2008
          website:
            - pouyaair.com
            - yasair.com
          sector: compagnie aérienne de fret
      - match: "Lieu d'enregistrement: Téhéran, Iran: Établissement principal: Iran"
        props:
          jurisdiction: ir
          address: "Téhéran, Iran"
      - match: "Entités associées: Defense Industries Organization [Organisation des industries de la défense] (DIO); ministère de la défense et de la logistique des forces armées (MODAFL: /"
        associates:
          - Defense Industries Organization (DIO)
          - ministère de la défense et de la logistique des forces armées (MODAFL)
      - match: "Aerospace Industries Organisation [Organisation des industries aérospatiales] (AIO): Entités associées"
        associates:
          - Aerospace Industries Organisation (AIO)
      - match: "Entités associées: Iran's Aerospace Industries  Organisation [Organisation des industries  aérospatiales] (AIO)"
        associates:
          - Iran's Aerospace Industries Organisation (AIO)
      - match: "Lieu d'enregistrement: Iran - Établissement principal: Iran -  Entités associées: Corps des gardiens de la révolution islamique (IRGC); Fater Institute: Type d'entité: entreprise publique"
        associates:
          - Corps des gardiens de la révolution islamique (IRGC)
          - Fater Institute
        props:
          jurisdiction: ir
          legalForm: entreprise publique
      - match: "Lieu d'enregistrement: Téhéran, Iran - Établissement principal: Iran: /"
        props:
          jurisdiction: ir
          address: "Téhéran, Iran"
      - match: "Entités associées: Ammunition and Metallurgy Industries Group [Groupe des industries des munitions et de la métallurgie] (AMIG); Defense Industries Organization [Organisation des industries de la défense] (DIO): /"
        associates:
          - Ammunition and Metallurgy Industries Group (AMIG)
          - Defense Industries Organization (DIO)
      - match: "Entités associées: Kaveh Cutting Tool Company; 7th of Tir Industries; Khorasan Metallurgy Industries; Iran Aviation Industries Organization (IAIO) [Organisation des industries de l’aviation de l’Iran] (IAIO); Aerospace Industries Organization [Organisation des industries aérospatiales] (AIO); Iran Electronic Industries (IEI); ministère de la défense et de la logistique des forces armées (MODAFL): /"
        associates:
          - Kaveh Cutting Tool Company
          - 7th of Tir Industries
          - Khorasan Metallurgy Industries
          - Iran Aviation Industries Organization (IAIO)
          - Aerospace Industries Organization (AIO)
          - Iran Electronic Industries (IEI)
          - ministère de la défense et de la logistique des forces armées (MODAFL)
      - match: "Lieu d'enregistrement: Téhéran - No d'enregistrement: 176855 - Code économique: 411139673763 - Date d'enregistrement: 1987 et 2001 - : Numéro d'identification national 10102191894"
        props:
          jurisdiction: ir
          address: "Téhéran"
          registrationNumber: 176855
          taxNumber: 411139673763
          incorporationDate:
            - 1987
            - 2001
          idNumber: 10102191894
      - match: "Lieu d’enregistrement: 676811 Amurskaya oblast, Belogorskiy Rayon, Vozhaevka, Fédération de Russie: Numéro d'identification fiscale: 2811005250"
        props:
          jurisdiction: ru
          address: "676811 Amurskaya oblast, Belogorskiy Rayon, Vozhaevka"
          innCode: 2811005250
      - match: "Type d'entité: société par actions: /"
        props:
          legalForm: société par actions
      - match: "Lieu d'enregistrement: Fédération de Russie (107241, Moscou, sh. Shchelkovskoe, 23A, pomeshch. V kom. 33.) - Date d'enregistrement: 27.9.2017 - Principal établissement: Fédération de Russie: /"
        props:
          jurisdiction: ru
          address: "107241, Moscou, sh. Shchelkovskoe, 23A, pomeshch. V kom. 33."
          incorporationDate: 2017-09-27
      - match: "Type d'entité: société par actions. Lieu d'enregistrement: 127287, st. Khutorskaya 2nd, 38A, Moscou, Fédération de Russie - Date d'enregistrement: 28.11.2002 -  Principal établissement: Fédération de Russie: /"
        props:
          jurisdiction: ru
          address: "127287, st. Khutorskaya 2nd, 38A, Moscou"
          legalForm: société par actions
          incorporationDate: 2002-11-28
      - match: "Numéro d’enregistrement: 1027739642281"
        props:
          registrationNumber: 1027739642281
      - match: "Type d'entité: société publique par actions - Lieu d'enregistrement: 107078, Moscou, Masha Poryvaeva str., 34, Fédération de Russie - Date d'enregistrement: 2.3.1993 - Principal établissement: Fédération de Russie: /"
        props:
          jurisdiction: ru
          address: "107078, Moscou, Masha Poryvaeva str., 34"
          legalForm: société publique par actions
          incorporationDate: 1993-03-02
      - match: "Type d'entité: entreprise fédérale d'État - Lieu d'enregistrement: Kuibyshev, région de Novosibirsk, Fédération de Russie - Date d'enregistrement: 15.6.2006 - Principal établissement: Kuibyshev, Fédération de Russie: /"
        props:
          jurisdiction: ru
          address: "Kuibyshev, région de Novosibirsk"
          legalForm: entreprise fédérale d'État
          incorporationDate: 2006-06-15
      - match: "Type d'entité: société par actions - Lieu d'enregistrement: 27 Kalanchevskaya str. Moscou, 107078, Fédération de Russie - Date d'enregistrement: 26.7.2022 - Principal établissement: Fédération de Russie: /"
        props:
          jurisdiction: ru
          address: "27 Kalanchevskaya str. Moscou, 107078"
          legalForm: société par actions
          incorporationDate: 2022-07-26
      - match: "Type d'entité: société par actions - Lieu d'enregistrement: Fédération de Russie - Date d'enregistrement: 17.1.2003 - Principal établissement: Fédération de Russie: /"
        props:
          jurisdiction: ru
          legalForm: société par actions
          incorporationDate: 2003-01-17
      - match: "Type d'entité: société par actions non publique - Lieu d'enregistrement: Fédération de Russie - Date d'enregistrement: 19.7.1995- Principal établissement: Fédération de Russie: /"
        props:
          jurisdiction: ru
          legalForm: société par actions non publique
          incorporationDate: 1995-07-19
      - match: "Type d'entité: société à responsabilité limitée  -  Lieu d'enregistrement: passage piéton, propriété 3. bâtiment 2, 125373, Moscou, Fédération de Russie - Date d'enregistrement: 10.12.2021: /"
        props:
          jurisdiction: ru
          address: "passage piéton, propriété 3. bâtiment 2, 125373, Moscou"
          legalForm: société à responsabilité limitée
          incorporationDate: 2021-12-10
      - match: "Numéro d’enregistrement: 1115248002110"
        props:
          registrationNumber: 1115248002110
      - match: "Type d'entité: société par actions - Date d'enregistrement: 26.9.2011 - Lieu d'enregistrement: région de Nijni Novgorod, Fédération de Russie - Principal établissement: Fédération de Russie: Date d'enregistrement: 26.9.2011"
        props:
          jurisdiction: ru
          legalForm: société par actions
          incorporationDate: 2011-09-26
          address: "région de Nijni Novgorod"
      - match: "NIF: 7703438908"
        props:
          innCode: 7703438908
      - match: "Type d'entité: entreprise de technologies de l’information- Lieu d'enregistrement: Russie - Date d'enregistrement:  crée en 2009 - Principal établissement : Russie"
        props:
          jurisdiction: ru
          sector: entreprise de technologies de l’information
          incorporationDate: 2009
      - match: "Type d'entité: société par actions - Principal établissement: Russie: /"
        props:
          jurisdiction: ru
          legalForm: société par actions
      - match: "Numéro d’enregistrement: 1026605611339"
        props:
          registrationNumber: 1026605611339
      - match: "Numéro d’enregistrement: 1037739692385"
        props:
          registrationNumber: 1037739692385
      - match: "Type d'entité: société par actions - Principal établissement: Russie: /"
        props:
          jurisdiction: ru
          legalForm: société par actions
      - match: "OGRN: 1027746003438"
        props:
          ogrnCode: 1027746003438
      - match: "Type d'entité: société par actions -  Date d'enregistrement: 23.4.2002  -  Principal établissement: Russie: /"
        props:
          jurisdiction: ru
          legalForm: société par actions
          incorporationDate: 2002-04-23
      - match: "Numéro d’enregistrement: 1021801143374"
        props:
          ogrnCode: 1021801143374
      - match: "Numéro d’enregistrement: 1050202782277"
        props:
          ogrnCode: 1050202782277
      - match: "Type d’entité: organisation autonome à but non lucratif - Lieu d’enregistrement: Russie - Principal établissement: Russie: /"
        props:
          jurisdiction: ru
          legalForm: organisation autonome à but non lucratif
      - match: "Type d'entité: société par actions - Date d'enregistrement: 1.2.2008: /"
        props:
          legalForm: société par actions
          incorporationDate: 2008-02-01
      - match: "Principal établissement: province de Téhéran (Iran): /"
        props:
          address: "province de Téhéran (Iran)"
      - match: "Type d’entité: organisation autonome non commerciale: /"
        props:
          legalForm: organisation autonome non commerciale
      - match: "Numéros d’enregistrement - Immatriculation (numéro OGRN): 1247700291200"
        props:
          ogrnCode: 1247700291200
      - match: "INN (numéro d’identification fiscale): 9707028663"
        props:
          innCode: 9707028663
      - match: "Principal établissement: province du Khorasan (Iran): /"
        props:
          address: "province du Khorasan (Iran)"
      - match: "Numéro d’enregistrement: Iran: 427320"
        props:
          registrationNumber:
      - match: "Type d’entité: entité publique  - Lieu d’enregistrement: Téhéran, Iran: /"
        props:
          jurisdiction: ir
          legalForm: entité publique
          address: "Téhéran, Iran"
      - match: "Numéro d’enregistrement - Type d’entité: société à responsabilité limitée: 466887"
        props:
          registrationNumber: 466887
          legalForm: société à responsabilité limitée
      - match: "Numéro d’identification national: 14004684489"
        props:
          idNumber: 14004684489
      - match: "Type d’entité: entité publique - Lieu d’enregistrement: Téhéran, Iran: /"
        props:
          jurisdiction: ir
          legalForm: entité publique
          address: "Téhéran, Iran"
      - match: "Lieu d’enregistrement: Myanmar/Birmanie - Principal établissement: Shwe Kokko, canton de Myawaddy, district de Myawaddy, État de Kayin, Myanmar/Birmanie: /"
        props:
          jurisdiction: mm
          address: "Shwe Kokko, canton de Myawaddy, district de Myawaddy, État de Kayin, Myanmar/Birmanie"
      - match: "Type d’entité: compagnie maritime: /"
        props:
          sector: "compagnie maritime"
      - match: "Numéro d’enregistrement: OMI: 5122966"
        props:
          imoNumber: 5122966
          # registrationNumber: 5122966
      - match: "Lieu d’enregistrement: Iran: /"
        props:
          jurisdiction: ir
      - match: "Numéro d’enregistrement: OMI: 6189893"
        props:
          imoNumber: 6189893
          # registrationNumber: 6189893
      - match: "Numéro d’enregistrement: OMI: 6016988"
        props:
          imoNumber: 6016988
          # registrationNumber: 6016988
      - match: "NIF, numéro d'identification fiscale - Lieu d'enregistrement: Bangui (République centrafricaine) - Date d'enregistrement: 24.10.2017 - Principal établissement: République centrafricaine: M 354838 D 0001"
        props:
          jurisdiction: Central African Republic
          address: "Bangui"
          incorporationDate: 2017-10-24
          registrationNumber: M 354838 D 0001
      - match: "Lieu d'enregistrement: Bangui (République centrafricaine)  : /"
        props:
          jurisdiction: Central African Republic
          address: "Bangui"
      - match: "Principal établissement: République centrafricaine: /"
        props:
          jurisdiction: Central African Republic
      - match: "Numéro d’enregistrement: CA/BG2019B519"
        props:
          registrationNumber: CA/BG2019B519
      - match: "Date d’enregistrement: 28.3.2019 - Principal établissement: République centrafricaine: /"
        props:
          incorporationDate: 2019-03-28
          jurisdiction: Central African Republic
      - match: "Numéro d’enregistrement: 1197700003137"
        props:
          ogrnCode: 1197700003137
      - match: "Numéro fiscal individuel: 7709448606"
        props:
          taxNumber: 7709448606
      - match: "Lieu d'enregistrement: d. 76 korp. 4 litera A ofis N620, prospekt Obukhovskoi Oborony Saint-Pétersbourg, Fédération de Russie : /"
        props:
          jurisdiction: ru
          address: "d. 76 korp. 4 litera A ofis N620, prospekt Obukhovskoi Oborony Saint-Pétersbourg"
      - match: "No d'identification fiscale: 7811636632"
        props:
          innCode: 7811636632
      - match: "Principal établissement: Khartoum, Soudan: /"
        props:
          address: "Khartoum, Soudan"
      - match: "Date d’enregistrement: 6.1.2016  Numéro d’enregistrement: 690664113"
        props:
          incorporationDate: 2016-01-06
          registrationNumber: 690664113
      - match: "Lieu d’enregistrement: Lomé, Togo - Date d’enregistrement: janvier 2022: /"
        props:
          jurisdiction: tg
          address: "Lomé, Togo"
          incorporationDate: 2022-01
      - match: "Lieu d’enregistrement: 105077, Moscou 11th Parkovaya Street, 38A: /"
        props:
          jurisdiction: ru
          address: "105077, Moscou 11th Parkovaya Street, 38A"
      - match: "No d’enregistrement: 7719737879"
        props:
          registrationNumber: 7719737879
      - match: "Numéro OGRN: 1097746770395"
        props:
          ogrnCode: 1097746770395
      - match: "Lieu d’enregistrement: Moscou, Russie - Date d’enregistrement: Septembre 2023: /"
        props:
          jurisdiction: ru
          address: "Moscou, Russie"
          incorporationDate: 2023-09
      - match: "Date d’enregistrement: 16.4.2013  Numéro d’enregistrement: 192003422"
        props:
          incorporationDate: 2013-04-16
          registrationNumber: 192003422
      - match: "Numéro d’identification fiscale: 3234043140"
        props:
          innCode: 3234043140
      - match: "Type d’entité: société par actions - Lieu d’enregistrement: Fédération de Russie - Date d’enregistrement: 22.1.1993 (date d’enregistrement national: 16.6.2002) - Personne associée: Pavel Gennadievich Tochilin (directeur général) (NIF: 504501388297): Numéro d’enregistrement: 1025005917023"
        props:
          jurisdiction: ru
          legalForm: société par actions
          incorporationDate: 1993-01-22
          registrationNumber: 1025005917023
        associates:
          - Pavel Gennadievich Tochilin
      - match: "Numéro d’identification fiscale: 5045002261"
        props:
          innCode: 5045002261
      - match: "Numéro d’enregistrement: 1028600508991"
        props:
          registrationNumber: 1028600508991
      - match: "Principal établissement: Fédération de Russie: Numéro d’identification fiscale: 7204002873"
        props:
          address: "Fédération de Russie"
          innCode: 7204002873
      - match: "Date d’enregistrement: 30.5.2023 - Entités associées: — OOO TSK Vektor, autrement connue sous le nom de LLC TSK Vektor — Xiamen Limbach Aviation Engine Co., Ltd: Numéro d’identification fiscale:  91440300MA5HX80Y1Q"
        props:
          incorporationDate: 2023-05-30
          uscCode: 91440300MA5HX80Y1Q
        associates:
          - OOO TSK Vektor
          - Xiamen Limbach Aviation Engine Co., Ltd
      - match: "Principal établissement: Fédération de Russie - Personnes associées: Artem Mikhaylovich Yamshchikov - Entités associées: — IEMZ Kupol— Juhang Aviation Technology Shenzhen Co. Limited — Redlepus TSK Vektor Industrial (Shenzhen) Co., Ltd — Xiamen Limbach Aviation Engine Co., Ltd: Numéro d’enregistrement: 1153850042246"
        props:
          address: "Fédération de Russie"
          registrationNumber: 1153850042246
        associates:
          - Artem Mikhaylovich Yamshchikov
          - IEMZ Kupol
          - Juhang Aviation Technology Shenzhen Co. Limited
          - Redlepus TSK Vektor Industrial (Shenzhen) Co., Ltd
          - Xiamen Limbach Aviation Engine Co., Ltd
      - match: "Numéro d’identification fiscale: 3849055365"
        props:
          innCode: 3849055365
      - match: "Date d’enregistrement: 18.3.2021 - Entités associées: — OOO TKS Vektor, autrement connue sous le nom de LLC TSK Vektor— Xiamen Limbach Aviation Engine Co., Ltd: Numéro d’identification fiscale:  91440300MA5GN73B4F"
        props:
          incorporationDate: 2021-03-18
          uscCode: 91440300MA5GN73B4F
        associates:
          - OOO TKS Vektor
          - Xiamen Limbach Aviation Engine Co., Ltd
      - match: "Date d’enregistrement: 20.11.2012 - Entités associées: — OOO TSK Vektor, ou LLC TSK Vektor — Redlepus TSK Vektor Industrial (Shenzhen) Co., Ltd — Juhang Aviation Technology Shenzhen Co.: Numéro d’identification fiscale:  91350200051193084R"
        props:
          incorporationDate: 2012-11-20
          uscCode: 91350200051193084R
        associates:
          - OOO TSK Vektor
          - Redlepus TSK Vektor Industrial (Shenzhen) Co., Ltd
          - Juhang Aviation Technology Shenzhen Co.
      - match: "Type d’entité: société par actions - Lieu d’enregistrement: Fédération de Russie - Date d’enregistrement: 5.9.1994 - Entité associée: gérée par la United Aircraft Corporation (numéro d’enregistrement: 1067759884598): Numéro d’enregistrement: 1025900895712"
        props:
          jurisdiction: ru
          legalForm: société par actions
          incorporationDate: 1994-09-05
          registrationNumber: 1025900895712
        associates:
          - United Aircraft Corporation
      - match: "NIF: 5904100329"
        props:
          innCode: 5904100329
      - match: "Principal établissement: Fédération de Russie - Personne associée: Tkachuk Vladimir Ilyich (directeur général): Type d’entité: société à responsabilité limitée"
        props:
          address: "Fédération de Russie"
          legalForm: société à responsabilité limitée
        associates:
          - Tkachuk Vladimir Ilyich
      - match: "Type d’entité: entreprise d’État fédérale - Lieu d’enregistrement: Fédération de Russie - Date d’enregistrement: 23.3.2006: Numéro d’enregistrement: 1066147003658"
        props:
          jurisdiction: ru
          legalForm: entreprise d’État fédérale
          incorporationDate: 2006-03-23
          registrationNumber: 1066147003658
      - match: "Numéro d’identification fiscale: 6147025090"
        props:
          innCode: 6147025090
      - match: "Type d’entité: société publique par actions - Principal établissement: Fédération de Russie"
        props:
          jurisdiction: ru
          legalForm: société publique par actions
          address: "Fédération de Russie"
      - match: "Type d’entité: société par actions - Principal établissement: Fédération de Russie: Numéro d’enregistrement: 1027739137084"
        props:
          jurisdiction: ru
          legalForm: société par actions
          address: "Fédération de Russie"
          registrationNumber: 1027739137084
      - match: "Numéro d’identification fiscale: 7713011336"
        props:
          innCode: 7713011336
      - match: "Type d’entité: société à responsabilité limitée - Lieu d’enregistrement: Moscou, Fédération de Russie - Personne associée: Alexander Valerievich Gavrilov (directeur général) - Autres informations d’identification: Limited Liability Company Gumich RTK (filiale): Numéro d’enregistrement: 1187746509081"
        props:
          jurisdiction: ru
          legalForm: société à responsabilité limitée
          address: "Moscou, Fédération de Russie"
          registrationNumber: 1187746509081
        associates:
          - Alexander Valerievich Gavrilov
          - Limited Liability Company Gumich RTK (filiale)
      - match: "Numéro d’identification fiscale: 9709032552"
        props:
          innCode: 9709032552
      - match: "Type d’entité: société à responsabilité limitée - Lieu d’enregistrement: Moscou, Fédération de Russie - Personne associée: Pavel Vladimirovich Babin (directeur général): Numéro d’enregistrement: 5157746030976"
        props:
          jurisdiction: ru
          legalForm: société à responsabilité limitée
          address: "Moscou, Fédération de Russie"
          registrationNumber: 5157746030976
        associates:
          - Pavel Vladimirovich Babin
      - match: "Numéro d’identification fiscale: 7729481489"
        props:
          innCode: 7729481489
      - match: "Type d’entité: société par actions - Lieu d’enregistrement: 428903, Fédération de Russie, République de Tchouvachie, Cheboksary, p. I.Yakovleva, 4 - Date d’enregistrement: 14.10.2011 - Principal établissement: Fédération de Russie: Numéro d’enregistrement: 1112130013270"
        props:
          jurisdiction: ru
          legalForm: société par actions
          address: "428903, Fédération de Russie, République de Tchouvachie, Cheboksary, p. I.Yakovleva, 4"
          incorporationDate: 2011-10-14
          registrationNumber: 1112130013270
      - match: "Numéro d’identification fiscale: 2130094170"
        props:
          innCode: 2130094170
      - match: "Type d’entité: société à responsabilité limitée - Lieu d’enregistrement: Samara, Fédération de Russie - Personne associée: Igor Alexandrovich Ganin (directeur général): Numéro d’enregistrement: 1056317028350"
        props:
          jurisdiction: ru
          legalForm: société à responsabilité limitée
          address: "Samara, Fédération de Russie"
          registrationNumber: 1056317028350
        associates:
          - Igor Alexandrovich Ganin
      - match: "Numéro d’identification fiscale: 6317060306"
        props:
          innCode: 6317060306
      - match: "Numéro d’identification fiscale: 7722698108"
        props:
          innCode: 7722698108
      - match: "Type d’entité: société à responsabilité limitée - Lieu d’enregistrement: Moscou, Fédération de Russie - Personne associée: Fedor Fedorovich Potekhin (directeur général) - Autres informations d’identification: Limited Liability Company Gumich (société mère): Numéro d’enregistrement: 1227700009349"
        props:
          jurisdiction: ru
          legalForm: société à responsabilité limitée
          address: "Moscou, Fédération de Russie"
          registrationNumber: 1227700009349
        associates:
          - Fedor Fedorovich Potekhin
          - Limited Liability Company Gumich
      - match: "Numéro d’identification fiscale: 9726005407"
        schema: Company
        props:
          innCode: 9726005407
      - match: "Type d’entité: société à responsabilité limitée - Lieu d’enregistrement: Fédération de Russie - Date d’enregistrement: 25.10.2006 - Entité associée: JSC Kalashnikov Concern (société holding) (numéro d’enregistrement: 1111832003018): Numéro d’enregistrement: 1061831040688"
        props:
          jurisdiction: ru
          legalForm: société à responsabilité limitée
          incorporationDate: 2006-10-25
          registrationNumber: 1061831040688
        associates:
          - JSC Kalashnikov Concern
      - match: "Numéro d’identification fiscale: 1831117433"
        props:
          innCode: 1831117433
      - match: "Type d’entité: société par actions - Principal établissement: Fédération de Russie - Personnes associées: Alexander Alekseevich Balashov (directeur général): Numéro d’enregistrement: 11177411001388"
        props:
          jurisdiction: ru
          legalForm: société par actions
          address: "Fédération de Russie"
          registrationNumber: 11177411001388
        associates:
          - Alexander Alekseevich Balashov
      - match: "Numéro d’identification fiscale: 7411009901"
        props:
          innCode: 7411009901
      - match: "Numéro d’identification fiscale: 2635000092"
        props:
          innCode: 2635000092
      - match: "Type d’entité: société par actions - Lieu d’enregistrement: Fédération de Russie - Date d’enregistrement: 28.6.2012 - Principal établissement: Fédération de Russie - Autres informations: JSC “KRET” (société associée): Numéro d’enregistrement: 1124011001058"
        props:
          jurisdiction: ru
          legalForm: société par actions
          incorporationDate: 2012-06-28
          address: "Fédération de Russie"
          registrationNumber: 1124011001058
        associates:
          - JSC “KRET”
      - match: "Numéro d’identification fiscale: 4007017378"
        props:
          innCode: 4007017378
      - match: "Type d’entité: société d’État - Lieu d’enregistrement: Donetsk, Ukraine - Personne associée: Andrey Yurievich Kalyuzhny (président faisant fonction du conseil d’administration): Numéro d’enregistrement: 1229300132104"
        props:
          jurisdiction: ua
          legalForm: société d’État
          address: "Donetsk, Ukraine"
          registrationNumber: 1229300132104
        associates:
          - Andrey Yurievich Kalyuzhny
      - match: "Numéro d’identification fiscale: 9303024230"
        props:
          innCode: 9303024230
      - match: "Type d’entité: société par actions - Lieu d’enregistrement: 300002, Fédération de Russie, Tula, Mosina str., 2 - Date d’enregistrement: 29.8.2002 - Principal établissement: Fédération de Russie: Numéro d’enregistrement: 1027100507114"
        props:
          jurisdiction: ru
          legalForm: société par actions
          address: "300002, Fédération de Russie, Tula, Mosina str., 2"
          incorporationDate: 2002-08-29
          registrationNumber: 1027100507114
      - match: "Type d’entité: société à responsabilité limitée - Principal établissement: République populaire de Chine/Hong Kong: /"
        props:
          jurisdiction: hk
          legalForm: société à responsabilité limitée
          address: "République populaire de Chine/Hong Kong"
      - match: "Numéros d’enregistrement: 2182045 64199990-000 CR No. 2182045"
        props:
          registrationNumber:
            - 2182045
            - 64199990-000
      - match: "Type d’entité: société à responsabilité limitée (Limited Company) - Principal établissement: République populaire de Chine/Hong Kong: /"
        props:
          jurisdiction: hk
          legalForm: société à responsabilité limitée (Limited Company)
          address: "République populaire de Chine/Hong Kong"
      - match: "Type d’entité: société à responsabilité limitée (Limited Company): /"
        props:
          legalForm: société à responsabilité limitée (Limited Company)
      - match: "Lieu d'enregistrement: Iran - Date d'enregistrement: 2014 - Principal établissement: Iran: /"
        props:
          jurisdiction: ir
          incorporationDate: 2014
      - match: "Lieu d'enregistrement: République du Tatarstan, Fédération de Russie Date d'enregistrement: 12.2.2007 Numéro d'enregistrement: 1071650002874"
        props:
          jurisdiction: ru
          address: "République du Tatarstan"
          incorporationDate: 2007-02-12
          registrationNumber: 1071650002874
      - match: "Numéro d'identification fiscale: 1650153253; KPP: 165001001"
        schema: Company
        props:
          innCode: 1650153253
          kppCode: 165001001
      - match: "Date d'enregistrement: 3.1.2003 (fondé en 1918) Numéro d'enregistrement: 1037804006998 Numéro d'identification fiscale: 7802072267 KPP: 780201001"
        schema: Company
        props:
          incorporationDate: 2003-01-03
          registrationNumber: 1037804006998
          innCode: 7802072267
          kppCode: 780201001
      - match: "Type d'entité: société par actions non publique Numéro d'enregistrement: 1026103161930 INN: 6163013800 KPP: 616301001"
        schema: Company
        props:
          legalForm: société par actions non publique
          registrationNumber: 1026103161930
          innCode: 6163013800
          kppCode: 616301001
      - match: "Lieu d'enregistrement: Minsk, Biélorussie Date d'enregistrement: 1.8.2013 Numéro d'enregistrement: 100386629"
        props:
          jurisdiction: by
          address: "Minsk"
          incorporationDate: 2013-08-01
          registrationNumber: 100386629
      - match: "Lieu d'enregistrement: Brodnikov pereulok 7, Moscou, Fédération de Russie Date d'enregistrement: 9.3.2023 Numéro d'enregistrement: 1237700185645"
        props:
          jurisdiction: ru
          address: "Brodnikov pereulok 7, Moscou"
          incorporationDate: 2023-03-09
          registrationNumber: 1237700185645
      - match: "Date d'enregistrement: 27.12.2012 Numéro d'enregistrement: 1127747292738 Numéro d'identification fiscale: 772077038"
        props:
          incorporationDate: 2012-12-27
          registrationNumber: 1127747292738
          taxNumber: 772077038
      - match: "Lieu d'enregistrement: Saint-Pétersbourg, Fédération de Russie; Date d'enregistrement: 15.12.2023; Numéro d'enregistrement: 1237800143569"
        props:
          jurisdiction: ru
          address: "Saint-Pétersbourg"
          incorporationDate: 2023-12-15
          registrationNumber: 1237800143569
      - match: "Lieu d'enregistrement: Saint-Pétersbourg, Fédération de Russie Date d'enregistrement: 29.9.2022 Numéro d'enregistrement: 1227800127840"
        props:
          jurisdiction: ru
          address: "Saint-Pétersbourg"
          incorporationDate: 2022-09-29
          registrationNumber: 1227800127840
      - match: "Lieu d'enregistrement: Moscou, Fédération de Russie Date d'enregistrement: 12.2.2015 Numéro d'enregistrement: 1157746097629"
        props:
          jurisdiction: ru
          address: "Moscou"
          incorporationDate: 2015-02-12
          registrationNumber: 1157746097629
      - match: "Lieu d'enregistrement: d'abord l'Ukraine, puis, après l'annexion illégale de la Crimée, la Fédération de Russie"
        props:
          jurisdiction: ua-cri
          address: "Ukraine"
      - match: "Date d'enregistrement: 22.7.1992 (Ukraine), 13.8.2014 (Fédération de Russie) Numéro d'enregistrement: 1149102030186"
        props:
          incorporationDate: ["1992-07-22", "2014-08-13"]
          registrationNumber: 1149102030186
      - match: "INN: 9102019769; OKPO: 00204814"
        props:
          innCode: 9102019769
          okpoCode: 00204814
      - match: "Principal établissement: Fédération de Russie et Crimée"
        props:
          address: "Fédération de Russie et Crimée"
      - match: "Date d'enregistrement: 22.7.2010 Numéro d'enregistrement: 1107746582052"
        props:
          incorporationDate: 2010-07-22
          registrationNumber: 1107746582052
      - match: "Numéro d'enregistrement: 110108010146888 Code de crédit social unifié: 91110108661572276L"
        props:
          registrationNumber: 110108010146888
          uscCode: 91110108661572276L
      - match: "Date d'enregistrement: 4.2.2003 Numéro d'enregistrement: 1037700128828"
        props:
          incorporationDate: 2003-02-04
          registrationNumber: 1037700128828
      - match: "Numéro d'enregistrement: 1105249001120 Numéro d'identification fiscale: 5214010100 KPP: 521401001 Entités associées: JSC Technodinamika"
        schema: Company
        props:
          registrationNumber: 1105249001120
          innCode: 5214010100
          kppCode: 521401001
        associates:
          - JSC Technodinamika
      - match: "Date d'enregistrement: 6.11.1992 Numéro d'enregistrement: 1027739610018"
        props:
          incorporationDate: 1992-11-06
          registrationNumber: 1027739610018
      - match: "Date d'enregistrement: 2.4.2015 Numéro d'enregistrement: 1159102083238 Numéro d'identification fiscale: 9104005842 Principal établissement: Crimée"
        props:
          incorporationDate: 2015-04-02
          registrationNumber: 1159102083238
          innCode: 9104005842
          address: "Crimée"
      - match: 'Autres entités associées: mouvement panrusse social d''État à destination des enfants et des jeunes "Le mouvement des premiers"'
        associates:
          - mouvement panrusse social d'État à destination des enfants et des jeunes "Le mouvement des premiers"
      - match: "Date d'enregistrement: 18.8.2023, précédemment enregistrée sous le nom de southfront.org depuis 30.4.2015"
        props:
          incorporationDate: ["2023-08-18", "2015-04-30"]
      - match: "Lieu d'enregistrement: Kirov, Fédération de Russie; Date d'enregistrement: 2.6.2003 ; Numéro d'enregistrement: 1034316578680"
        props:
          jurisdiction: ru
          address: "Kirov"
          incorporationDate: 2003-06-02
          registrationNumber: 1034316578680
      - match: 'Lieu d''enregistrement: Komsomolsky Pr. 22, ville de Donetsk, district de Donetsk, soi-disant "République populaire de Donetsk"'
        props:
          address: "Komsomolsky Pr. 22, ville de Donetsk, district de Donetsk, soi-disant République populaire de Donetsk"
      - match: "Date du premier enregistrement: 28.2.2017"
        props:
          incorporationDate: 2017-02-28
      - match: "Date d'enregistrement dans la Fédération de Russie (à la suite des référendums illégaux tenus dans les territoires occupés de l'Ukraine): 30.11.2022"
        props:
          incorporationDate: 2022-11-30
      - match: 'Principal établissement: zones ukrainiennes qui ne sont pas sous le contrôle du gouvernement, à savoir les oblasts de Donetsk et de Louhansk (les soi-disant "République populaire de Donetsk" et "Répub"'
        props:
          address: "zones ukrainiennes qui ne sont pas sous le contrôle du gouvernement, à savoir les oblasts de Donetsk et de Louhansk (les soi-disant République populaire de Donetsk et Répub"
      - match: "Numéro OGRN: 1027700590521"
        props:
          ogrnCode: 1027700590521
      - match: "ETH: 0x002471b8A185f9980708d0eAEC5B289714F56f8d"
        wallets:
          - currency: ETH
            publicKey: 0x002471b8A185f9980708d0eAEC5B289714F56f8d
      - match: "BTC: bc1qwtz3zv95x2flu4w26kgfepf529z50r2sqc5zml bc1qwxqxd25yk2dtw2ml04vxj9atq3huv4rdytf6vt 3My1ffQr5qQzmq4aBFgRqwRYqfB5zPAt8t"
        wallets:
          - currency: BTC
            publicKey: bc1qwtz3zv95x2flu4w26kgfepf529z50r2sqc5zml
          - currency: BTC
            publicKey: bc1qwxqxd25yk2dtw2ml04vxj9atq3huv4rdytf6vt
          - currency: BTC
            publicKey: 3My1ffQr5qQzmq4aBFgRqwRYqfB5zPAt8t
      - match: "BSC: 0x3051Ca7cB7f6C599fA2f27385AD75010cf0f2bbF TRX: TA1hsikRfsgGiW9nEBpT4tEXEySTNYLr2d"
        wallets:
          - currency: BSC
            publicKey: 0x3051Ca7cB7f6C599fA2f27385AD75010cf0f2bbF
          - currency: TRX
            publicKey: TA1hsikRfsgGiW9nEBpT4tEXEySTNYLr2d
      - match: "Type d'entité: Institution fédérale financée par l'État - Lieu d'enregistrement: Fédération de Russie - Date d'enregistrement: 3.1.2003 (fondé en 1918): /"
        props:
          jurisdiction: ru
          legalForm: Institution fédérale financée par l'État
          incorporationDate: 2003-01-03
      - match: "Type d'entité: organisation autonome à but non lucratif - Lieu d'enregistrement: Brodnikov pereulok 7, Moscou, Fédération de Russie - Date d'enregistrement: 9.3.2023 - Principal établissement: Fédération de Russie: /"
        props:
          jurisdiction: ru
          legalForm: organisation autonome à but non lucratif
          address: "Brodnikov pereulok 7, Moscou, Fédération de Russie"
          incorporationDate: 2023-03-09
      - match: "Lieu d'enregistrement: Trekhprudny 5, Moscou, Fédération de Russie: /"
        props:
          address: "Trekhprudny 5, Moscou, Fédération de Russie"
      - match: "Type d'entité: société par actions - Date d'enregistrement: 27.12.2012 - Principal établissement: Fédération de Russie: /"
        props:
          jurisdiction: ru
          legalForm: société par actions
          incorporationDate: 2012-12-27
      - match: "Type d'entité: société à responsabilité limitée - Lieu d'enregistrement: Saint-Pétersbourg, Fédération de Russie - Date d'enregistrement: 15.12.2023: /"
        props:
          jurisdiction: ru
          legalForm: société à responsabilité limitée
          address: "Saint-Pétersbourg, Fédération de Russie"
          incorporationDate: 2023-12-15
      - match: "Type d'entité: société à responsabilité limitée - Lieu d'enregistrement: Moscou, Fédération de Russie - Date d'enregistrement: 12.2.2015: /"
        props:
          jurisdiction: ru
          legalForm: société à responsabilité limitée
          address: "Moscou, Fédération de Russie"
          incorporationDate: 2015-02-12
      - match: "Type d'entité: société publique par actions - Principal établissement: Fédération de Russie - Lieu d'enregistrement: Saint-Pétersbourg: /"
        props:
          jurisdiction: ru
          legalForm: société publique par actions
      - match: "Type d'entité: société par actions - Date d'enregistrement: 22.7.2010 - Principal établissement: Fédération de Russie: /"
        props:
          jurisdiction: ru
          legalForm: société par actions
          incorporationDate: 2010-07-22
      - match: "Code de crédit social unifié: 91110108661572276L"
        props:
          uscCode: 91110108661572276L
      - match: "Type d'entité: société par actions - Lieu d'enregistrement: Moscou, Fédération de Russie - Date d'enregistrement: 4.2.2003 - Principal établissement: Fédération de Russie: /"
        props:
          jurisdiction: ru
          legalForm: société par actions
          address: "Moscou, Fédération de Russie"
          incorporationDate: 2003-02-04
      - match: "Type d'entité: société par actions - Lieu d'enregistrement: Saint-Pétersbourg, Fédération de Russie - Principal établissement: Fédération de Russie: /"
        props:
          jurisdiction: ru
          legalForm: société par actions
          address: "Saint-Pétersbourg, Fédération de Russie"
      - match: "Type d'entité: Fondation caritative privée - Lieu d'enregistrement: Fédération de Russie - Date d'enregistrement: 4.4.2023: /"
        props:
          jurisdiction: ru
          legalForm: Fondation caritative privée
          incorporationDate: 2023-04-04
      - match: "Date d'enregistrement: 6.11.1992 - Principal établissement: Fédération de Russie: /"
        props:
          incorporationDate: 1992-11-06
          jurisdiction: ru
      - match: "Type d'entité: société à responsabilité limitée - Date d'enregistrement: 2.4.2015 - Principal établissement: Crimée: /"
        props:
          jurisdiction: ru
          legalForm: société à responsabilité limitée
          incorporationDate: 2015-04-02
          address: "Crimée"
      - match: "Type d'entité: société par actions non publique - Lieu d'enregistrement: Kirov, Fédération de Russie - Date d'enregistrement: 2.6.2003 - Principal établissement: Fédération de Russie: /"
        props:
          jurisdiction: ru
          legalForm: société par actions non publique
          address: "Kirov, Fédération de Russie"
          incorporationDate: 2003-06-02
      - match: "Type d'entité: société par actions - Date d'enregistrement: 31.1.2023 - Principal établissement: Fédération de Russie: /"
        props:
          jurisdiction: ru
          legalForm: société par actions
          incorporationDate: 2023-01-31
      - match: "Type d'entité: société par actions - Lieu d'enregistrement: République du Tatarstan, Fédération de Russie - Date d'enregistrement: 12.2.2007 - Principal établissement: Fédération de Russie: /"
        props:
          jurisdiction: ru
          legalForm: société par actions
          address: "République du Tatarstan, Fédération de Russie"
          incorporationDate: 2007-02-12
      - match: "Numéro d'identification fiscale:  1650153253"
        props:
          innCode: 1650153253
      - match: "Type d'entité: société par actions - Lieu d'enregistrement: Minsk, Biélorussie - Date d'enregistrement: 1.8.2013 - Principal établissement: Biélorussie: /"
        props:
          jurisdiction: by
          legalForm: société par actions
          address: "Minsk, Biélorussie"
          incorporationDate: 2013-08-01
      - match: "Type d'entité: plateforme d'échange de cryptomonnaies - Lieu d'enregistrement: Moscou, Fédération de Russie - Principal établissement: Fédération de Russie: /"
        props:
          jurisdiction: ru
          legalForm: plateforme d'échange de cryptomonnaies
          address: "Moscou, Fédération de Russie"
      - match: "Adresse de portefeuille de chaîne de blocs connues de Garantex: ETH: 0x002471b8A185f9980708d0eAEC5B289714F56f8d"
        wallets:
          - currency: ETH
            publicKey: 0x002471b8A185f9980708d0eAEC5B289714F56f8d
      - match: "Adresse de portefeuille de chaîne de blocs connues de Garantex: BTC: bc1qwtz3zv95x2flu4w26kgfepf529z50r2sqc5zmlbc1qwxqxd25yk2dtw2ml04vxj9atq3huv4rdytf6vt3My1ffQr5qQzmq4aBFgRqwRYqfB5zPAt8t"
        wallets:
          - currency: BTC
            publicKey: bc1qwtz3zv95x2flu4w26kgfepf529z50r2sqc5zml
          - currency: BTC
            publicKey: bc1qwxqxd25yk2dtw2ml04vxj9atq3huv4rdytf6vt
          - currency: BTC
            publicKey: 3My1ffQr5qQzmq4aBFgRqwRYqfB5zPAt8t
      - match: "Adresse de portefeuille de chaîne de blocs connues de Garantex: BSC: 0x3051Ca7cB7f6C599fA2f27385AD75010cf0f2bbF  TRX: TA1hsikRfsgGiW9nEBpT4tEXEySTNYLr2d"
        wallets:
          - currency: BSC
            publicKey: 0x3051Ca7cB7f6C599fA2f27385AD75010cf0f2bbF
          - currency: TRX
            publicKey: TA1hsikRfsgGiW9nEBpT4tEXEySTNYLr2d
      - match: "Type d'entité: société par actions - Lieu d'enregistrement: Fédération de Russie - Date d'enregistrement: 19.7.1993 - Principal établissement: Fédération de Russie: /"
        props:
          jurisdiction: ru
          legalForm: société par actions
          address: "Fédération de Russie"
          incorporationDate: 1993-07-19
      - match: "Numéro d'enregistrement:  1037800001304"
        props:
          registrationNumber: 1037800001304
      - match: "OKPO: 07614320"
        props:
          okpoCode: 07614320
      - match: "Type d'entité: société à responsabilité limitée - Lieu d'enregistrement: République du Tatarstan, Fédération de Russie - Date d'enregistrement: 12.2.2007: /"
        props:
          jurisdiction: ru
          legalForm: société à responsabilité limitée
          address: "République du Tatarstan, Fédération de Russie"
          incorporationDate: 2007-02-12
      - match: "Type d'entité: société par actions - Lieu d'enregistrement: d'abord l'Ukraine, puis, après l'annexion illégale de la Crimée, la Fédération de Russie - Date d'enregistrement: 22.7.1992 (Ukraine), 13.8.2014 (Fédération de Russie) - Principal établissement: Fédération de Russie et Crimée: /"
        props:
          jurisdiction: ua-cri
          legalForm: société par actions
          address: "Fédération de Russie et Crimée"
          incorporationDate: ["1992-07-22", "2014-08-13"]
      - match: "INN: 9102019769"
        props:
          innCode: 9102019769
      - match: "OKPO: 00204814"
        props:
          okpoCode: 00204814
      - match: "Type d'entité: société publique par actions - Lieu d'enregistrement: Fédération de Russie - Date d'enregistrement: 27.9.2011 - Principal établissement: Fédération de Russie: /"
        props:
          jurisdiction: ru
          legalForm: société publique par actions
          address: "Fédération de Russie"
          incorporationDate: 2011-09-27
      - match: "Numéro d'identification fiscale russe: 6317088527"
        props:
          innCode: 6317088527
      - match: "Type d'entité: société par actions - Date d'enregistrement: 13.1.2003: /"
        props:
          legalForm: société par actions
          incorporationDate: 2003-01-13
      - match: 'Type d''entité: entreprise unitaire d''État - Lieu d''enregistrement: Komsomolsky Pr. 22, ville de Donetsk, district de Donetsk, soi-disant "République populaire de Donetsk": /'
        props:
          legalForm: entreprise unitaire d'État
          address: "Komsomolsky Pr. 22, ville de Donetsk, district de Donetsk, soi-disant République populaire de Donetsk"
      - match: "Date du premier enregistrement: 28.2.2017 - Date d'enregistrement dans la Fédération de Russie (à la suite des référendums illégaux tenus dans les territoires occupés de l'Ukraine): 30.11.2022 : /"
        props:
          incorporationDate: ["2017-02-28", "2022-11-30"]
      - match: 'Principal établissement: zones ukrainiennes qui ne sont pas sous le contrôle du gouvernement, à savoir les oblasts de Donetsk et de Louhansk (les soi-disant "République populaire de Donetsk" et "République populaire de Louhansk"), de Kherson et de Zaporijjia: /'
        props:
          address: "zones ukrainiennes qui ne sont pas sous le contrôle du gouvernement, à savoir les oblasts de Donetsk et de Louhansk (les soi-disant République populaire de Donetsk et République populaire de Louhansk), de Kherson et de Zaporijjia"
      - match: "Type d'entité: société à responsabilité limitée - Lieu d'enregistrement: Fédération de Russie - Date d'enregistrement: 21.7.2023: /"
        props:
          jurisdiction: ru
          legalForm: société à responsabilité limitée
          incorporationDate: 2023-07-21
      - match: "49681112 - OKPO"
        props:
          okpoCode: 49681112
      - match: "6671172432 - Numéro d'identification fiscale"
        props:
          taxNumber: 6671172432
      - match: "6671172432 - Numéro d'identification fiscale"
        props:
          taxNumber: 6671172432
      - match: "Type d'entité: musée - Lieu d'enregistrement: Crimée, Ukraine"
        props:
          jurisdiction: ua-cri
          legalForm: musée
      - match: "7710026574 - numéro d'identification fiscale"
        props:
          taxNumber: 7710026574
      - match: "1027700186062 - Numéro d'enregistrement"
        props:
          registrationNumber: 1027700186062
      - match: "7706441909 - Numéro d'identification fiscale"
        props:
          taxNumber: 7706441909
      - match: "1167746856738 - Numéro d'enregistrement"
        props:
          registrationNumber: 1167746856738
      - match: "027801001 - KPP"
        schema: Company
        props:
          kppCode: 027801001
      - match: "0278179819 - Numéro d'identification fiscale"
        props:
          taxNumber: 0278179819
      - match: "1110280031531 - Numéro d'enregistrement"
        props:
          registrationNumber: 1110280031531
      - match: "502701001 - KPP"
        schema: Company
        props:
          kppCode: 502701001
      - match: "5027150193 - Numéro d'identification fiscale"
        props:
          taxNumber: 5027150193
      - match: "1095027006722 - Numéro d'enregistrement"
        props:
          registrationNumber: 1095027006722
      - match: "Site internet: 61btrz.ru"
        props:
          website: 61btrz.ru
      - match: "780501001 - KPP"
        schema: Company
        props:
          kppCode: 780501001
      - match: "04343841 - Numéro d'enregistrement (Royaume Uni)"
        props:
          registrationNumber: 04343841
          jurisdiction: gb
      - match: "7728804257 - Numéro d'identification fiscale"
        props:
          taxNumber: 7728804257
      - match: "772801001 - KPP"
        schema: Company
        props:
          kppCode: 772801001
      - match: "1116165003635 - Numéro d'enregistrement"
        props:
          registrationNumber: 1116165003635
      - match: "6165169426 - Numéro d'identification fiscale"
        props:
          taxNumber: 6165169426
      - match: "1027802718437 - Numéro d'enregistrement"
        props:
          registrationNumber: 1027802718437
      - match: "7805230257 - Numéro d'identification fiscale"
        props:
          taxNumber: 7805230257
      - match: "540201001 - KPP"
        schema: Company
        props:
          kppCode: 540201001
      - match: "402501001 - KPP"
        schema: Company
        props:
          kppCode: 402501001
      - match: "21620758 - OKPO"
        props:
          okpoCode: 21620758
      - match: "1245400007346 - Numéro d'enregistrement"
        props:
          registrationNumber: 1245400007346
      - match: "1025005326202 - Numéro d'enregistrement"
        props:
          registrationNumber: 1025005326202
      - match: "5042010793 - Numéro d'identification fiscale"
        props:
          taxNumber: 5042010793
      - match: "91110000100001529B - Code de crédit social unifié"
        props:
          uscCode: 91110000100001529B
      - match: "1097746030030 - Numéro d'enregistrement"
        props:
          registrationNumber: 1097746030030
      - match: "7707696113 - Numéro d'identification fiscale"
        props:
          taxNumber: 7707696113
      - match: "770701001 - KPP"
        schema: Company
        props:
          kppCode: 770701001
      - match: "5177746268530 - Numéro d'enregistrement"
        props:
          registrationNumber: 5177746268530
      - match: "9723038796 - Numéro d'identification fiscale"
        props:
          taxNumber: 9723038796
      - match: "1025203016717 - Numéro d'enregistrement"
        props:
          registrationNumber: 1025203016717
      - match: "5260902190 - Numéro d'identification fiscale"
        props:
          taxNumber: 5260902190
      - match: "526001001 - KPP"
        schema: Company
        props:
          kppCode: 526001001
      - match: "DMCC-850120 - Numéro d'enregistrement"
        props:
          registrationNumber: DMCC-850120
      - match: "1037703022158 - Numéro d'enregistrement"
        props:
          registrationNumber: 1037703022158
      - match: "7703371192 - Numéro d'identification fiscale"
        props:
          taxNumber: 7703371192
      - match: "NN (NIF)/ KPP: 2901170107 / 519001001"
        schema: Company
        props:
          taxNumber: 2901170107
          kppCode: 519001001
      - match: "1127746262390 - Numéro d'enregistrement"
        props:
          registrationNumber: 1127746262390
      - match: "773101001 - KPP"
        schema: Company
        props:
          kppCode: 773101001
      - match: "1207700173581 - Numéro d'enregistrement"
        props:
          registrationNumber: 1207700173581
      - match: "7722488005 - Numéro d'identification fiscale"
        props:
          taxNumber: 7722488005
      - match: "1027400875149 - Numéro d'enregistrement"
        props:
          registrationNumber: 1027400875149
      - match: "7415015198 - Numéro d'identification fiscale"
        props:
          taxNumber: 7415015198
      - match: "BIN: 1027739334479"
        props:
          registrationNumber: 1027739334479
      - match: "1164027059382 - Numéro d'enregistrement"
        props:
          registrationNumber: 1164027059382
      - match: "4018011096 - Numéro d'identification fiscale"
        props:
          taxNumber: 4018011096
      - match: "401801001 - KPP"
        schema: Company
        props:
          kppCode: 401801001
      - match: "1229000019346 - Numéro d'enregistrement"
        props:
          registrationNumber: 1229000019346
      - match: "9001011019 - Numéro d'identification fiscale"
        props:
          taxNumber: 9001011019
      - match: "1115476008889 - Numéro d'enregistrement"
        props:
          registrationNumber: 1115476008889
      - match: "5402534361 - Numéro d'identification fiscale"
        props:
          taxNumber: 5402534361
      - match: "1024000947464 - Numéro d'enregistrement"
        props:
          registrationNumber: 1024000947464
      - match: "4025019280 - Numéro d'identification fiscale"
        props:
          taxNumber: 4025019280
      - match: "1225000003458 - Numéro d'enregistrement"
        props:
          registrationNumber: 1225000003458
      - match: "5040176793 - numéro d'identification fiscale"
        props:
          taxNumber: 5040176793
      - match: "91210242MA10F83X1K - Code de crédit social unifié"
        props:
          uscCode: 91210242MA10F83X1K
      - match: "504201001 - 504201001"
        schema: Company
        props:
          kppCode: 504201001
      - match: "91370125MA3F547335 - Code de crédit social unifié"
        props:
          uscCode: 91370125MA3F547335
      - match: "1229300088423 - Numéro d'enregistrement"
        props:
          registrationNumber: 1229300088423
      - match: "930801335 - Numéro d'identification fiscale"
        props:
          taxNumber: 930801335
      - match: "1097746813010 - Numéro d'enregistrement"
        props:
          registrationNumber: 1097746813010
      - match: "7703712332 - Numéro d'identification fiscale"
        props:
          taxNumber: 7703712332
      - match: "771501001 - KPP"
        schema: Company
        props:
          kppCode: 771501001
      - match: "914201126983165914 - Code de crédit social unifié"
        props:
          uscCode: 914201126983165914
      - match: "1237700447324 - Numéro d'enregistrement"
        props:
          registrationNumber: 1237700447324
      - match: "7726030449 - Numéro d'identification fiscale"
        props:
          taxNumber: 7726030449
      - match: "1026201260447 - Numéro d'enregistrement"
        props:
          registrationNumber: 1026201260447
      - match: "6231006875 - Numéro d'identification fiscale"
        props:
          taxNumber: 6231006875
      - match: "623401001 - KPP"
        schema: Company
        props:
          kppCode: 623401001
      - match: "1149204071675 - Numéro d'enregistrement"
        props:
          registrationNumber: 1149204071675
      - match: "9201502053 - Numéro d'identification fiscale"
        props:
          taxNumber: 9201502053
      - match: "91210213MA0YKTWE4K - Code de crédit social unifié"
        props:
          uscCode: 91210213MA0YKTWE4K
      - match: "1216600040194 - Numéro d'enregistrement"
        props:
          registrationNumber: 1216600040194
      - match: "Autres entités associées: Intervesp-M LLC"
        associates:
          - Intervesp-M LLC
      - match: "Date d'enregistrement: 7.7.1998 (ancienne entité), 27.11.2002"
        props:
          incorporationDate: ["1998-07-07", "2002-11-27"]
      - match: "Numéro de registre économique: 12415926"
        props:
          registrationNumber: 12415926
      - match: "Date d'enregistrement: 10.2.2022: 13906017"
        props:
          incorporationDate: 2022-02-10
          registrationNumber: 13906017
      - match: "Lieu d'enregistrement: Istanbul - Lieu d'enregistrement: Istanbul: No d'identification TVA: 0081804196"
        props:
          jurisdiction: tr
          address: Istanbul
          taxNumber: 0081804196
      - match: "100000000001523 - Numéro d'enregistrement"
        props:
          registrationNumber: 100000000001523
      - match: "Type d’entité: société à responsabilité limitée - Date de création: 22.10.2017 - Siège: Damas"
        props:
          jurisdiction: sy
          legalForm: société à responsabilité limitée
          incorporationDate: 2017-10-22
          address: Damas
      - match: "enregistrée le 17/04/2018: numéro 11314143"
        props:
          registrationNumber: 11314143
          incorporationDate: 2018-04-17
      - match: "Date d’enregistrement: 18.8.1983 - Principaux lieux d’activité: Iran, Turquie, Europe"
        props:
          incorporationDate: 1983-08-18
          country:
            - ir
            - tr
            - eu
      - match: "Type d’entité: unités militaires - Lieu d’enregistrement: région de Kaliningrad, Fédération de Russie"
        props:
          legalForm: unités militaires
          country: ru
          address: région de Kaliningrad
      - match: "Type d'entité: société minière - Date d'enregistrement: dans les années 1960 - Principal établissement: Émirats arabes unis'"
        props:
          legalForm: société minière
          jurisdiction: ae
      - match: "Numéro d'enregistrement: identifiant de groupe: 16463"
        props:
          registrationNumber: 16463
      - match: "Type d’entité: établissement financier - Principal établissement: Khartoum, Soudan"
        props:
          legalForm: établissement financier
          address: Khartoum, Soudan
      - match: "Numéro d’enregistrement: SUDAN-EO14098"
        props:
          registrationNumber: SUDAN-EO14098
      - match: "Type d’entité: unités militaire - Lieu d’enregistrement: région de Kaliningrand, Fédération de Russie"
        props:
          legalForm: unités militaire
          jurisdiction: ru
          address: région de Kaliningrand, Fédération de Russie
      - match: "Type d’entité: société publique par actions - Lieu d’enregistrement: Fédération de Russie - Date d’enregistrement: 20.11.2002 / 16.5.1964"
        props:
          jurisdiction: ru
          legalForm: société publique par actions
          incorporationDate: ["2002-11-20", "1964-05-16"]
      - match: "Type d’entité: société à responsabilité limitée - Lieu d’enregistrement: Singapour - Date d’enregistrement: 11.12.2014"
        props:
          jurisdiction: sg
          legalForm: société à responsabilité limitée
          incorporationDate: 2014-12-11
      - match: "Type d'entité: société à responsabilité limitée - Lieu d'enregistrement: Biélorussie - Date d'enregistrement: 10.2.2017 - Principal établissement: Minsk, Biélorussie"
        props:
          jurisdiction: by
          legalForm: société à responsabilité limitée
          incorporationDate: 2017-02-10
          address: Minsk, Biélorussie
      - match: "Type d’entité: société à responsabilité limitée - Lieu d’enregistrement: République de Maurice - Date d’enregistrement: 27.10.2003"
        props:
          jurisdiction: mu
          legalForm: société à responsabilité limitée
          incorporationDate: 2003-10-27
      - match: "Numéro d'enregistrement: DSO-ZZCO-16068"
        props:
          registrationNumber: DSO-ZZCO-16068
      - match: "Type d’entité: société à responsabilité limitée - Lieu d’enregistrement: Inde - Date d’enregistrement: 11.9.1989"
        props:
          jurisdiction: in
          legalForm: société à responsabilité limitée
          incorporationDate: 1989-09-11
      - match: "Type d’entité: Société de droit public - Lieu d’enregistrement: Fédération de Russie - Date d’enregistrement: 20.10.2017"
        props:
          jurisdiction: ru
          legalForm: Société de droit public
          incorporationDate: 2017-10-20
      - match: "Type d’entité: entreprise unitaire publique fédérale - Lieu d’enregistrement: Fédération de Russie - Date d’enregistrement: 25.2.2003"
        props:
          jurisdiction: ru
          legalForm: entreprise unitaire publique fédérale
          incorporationDate: 2003-02-25
      - match: "Type d'entité: société par actions ouverte - Lieu d'enregistrement: Vitebsk, Biélorussie - Date d'enregistrement: 1.2.1994 - Principal établissement: Biélorussie"
        props:
          jurisdiction: by
          legalForm: société par actions ouverte
          incorporationDate: 1994-02-01
          address: Vitebsk, Biélorussie
      - match: "Type d’entité: société à responsabilité limitée - Lieu d’enregistrement: Inde - Date d’enregistrement: 2.11.2018"
        props:
          jurisdiction: in
          legalForm: société à responsabilité limitée
          incorporationDate: 2018-11-02
      - match: "Numéro d'identification de l'entreprise: U74990MH2018PTC316730"
        props:
          registrationNumber: U74990MH2018PTC316730
      - match: "Code d’entreprise d’importation et d’exportation: 3700MA3ERW0G0"
        props:
          registrationNumber: 3700MA3ERW0G0
      - match: "Type d’entité: société à responsabilité limitée - Lieu d’enregistrement: Azerbaïdjan - Date d’enregistrement: 15.8.2024"
        props:
          jurisdiction: az
          legalForm: société à responsabilité limitée
          incorporationDate: 2024-08-15
      - match: "Type d’entité: entreprise d’État - Lieu d’enregistrement: Biélorussie - Date d’enregistrement: 26.5.1992: Type d'entité: entreprise d'État"
        props:
          jurisdiction: by
          legalForm: entreprise d'État
          incorporationDate: 1992-05-26
      - match: "Type d'entité: société à responsabilité limitée - Lieu d'enregistrement: Biélorussie - Date d'enregistrement: 24.2.2000 - Principal établissement: Minsk, Biélorussie"
        props:
          jurisdiction: by
          legalForm: société à responsabilité limitée
          incorporationDate: 2000-02-24
          address: Minsk, Biélorussie
      - match: "Type d’entité: constituée en société - Lieu d’enregistrement: République de Maurice - Date d’enregistrement: 11.1.2024"
        props:
          jurisdiction: mu
          legalForm: constituée en société
          incorporationDate: 2024-01-11
      - match: "Enregistrée le 16 juillet 2023, immatriculée au RCS sous le numéro SIRET 4492923740039: SIRET 4492923740039"
        props:
          registrationNumber: 4492923740039
          incorporationDate: 2023-07-16
      - match: "Etablissement secondaire de la société “SODELIM” dénommé “Centre Tawhid”, enregistré le 16 juillet 2023, immatriculée au RCS sous le numéro SIRET 4492923740039: SIRET 4492923740039,"
        schema: Company
        props:
          name: Centre Tawhid
          registrationNumber: 4492923740039
          incorporationDate: 2023-07-16
        associates:
          - SODELIM
      - match: "Autre dénomination: PEDEC. Numéro d’enregistrement: IR0000054377. Date d’enregistrement: 27.8.1980"
        props:
          registrationNumber: IR0000054377
          incorporationDate: 1980-08-27
        aliases:
          - PEDEC
      - match: "1368932 - Numéro d’identification fiscale (États-Unis)"
        props:
          taxNumber: 1368932
          jurisdiction: us
      - match: "4000000128233- Numéro d’enregistrement"
        props:
          registrationNumber: 4000000128233
      - match: "Lieu d’enregistrement: Région de Volgograd, Volgograd, Fédération de Russie"
        props:
          address: "Région de Volgograd, Volgograd, Fédération de Russie"
          jurisdiction: ru
      - match: "IRL0000000024809 - Numéro d’enregistrement"
        props:
          registrationNumber: IRL0000000024809
      - match: "IR915378784 - Numéro d’enregistrement"
        props:
          registrationNumber: IR915378784
      - match: "Type d’entité: société par actions - Lieu d’enregistrement: Fédération de Russie - Date d’enregistrement: 14.10.2002 - Numéro d’enregistrement: 1027301482603 - Principal établissement: Fédération de Russie - Autres informations: INN/KPP 7303026762 / 732701001"
        schema: Company
        props:
          jurisdiction: ru
          legalForm: société par actions
          incorporationDate: 2002-10-14
          ogrnCode: 1027301482603
          innCode: 7303026762
          kppCode: 732701001
          address: Fédération de Russie
      - match: "IR916378778 (Numéro d’enregistrement)"
        props:
          registrationNumber: IR916378778
      - match: "Lieu d'enregistrement: Fédération de Russie, 420036, Republic of Tatarstan, Kazan, Dementyeva st., 1 - Type d'entité: société par actions - Date d'enregistrement: 26.11.2002 Principal établissement: Fédération de Russie: Numéro d'identification fiscale: 1661008339"
        props:
          jurisdiction: ru
          legalForm: société par actions
          incorporationDate: 2002-11-26
          innCode: 1661008339
          address: "Fédération de Russie, 420036, Republic of Tatarstan, Kazan, Dementyeva st., 1"
      - match: "Lieu d’enregistrement: Région de Bryansk, Bryansk, Fédération de Russie"
        props:
          address: "Région de Bryansk, Bryansk, Fédération de Russie"
          jurisdiction: ru
      - match: "Certificat d’inscription au registre du commerce, délivré en mars 2009: 5478431"
        props:
          registrationNumber: 5478431
          incorporationDate: 2009-03
      - match: "Numéro OMI attribué en 2009: 5878431"
        props:
          imoNumber: 5878431
      - match: "02772297 - Numéro d’entreprise (Royaume Uni)"
        props:
          registrationNumber: 02772297
          jurisdiction: gb
      - match: "Autorisation commerciale (Bahreïn): 13388"
        props:
          registrationNumber: 13388
          jurisdiction: bh
      - match: "IR0000365670 - Numéro d’enregistrement"
        props:
          registrationNumber: IR0000365670
      - match: "Autres dénominations: Maroun Oil and Gas Operations ou Maround Oil and Gas Production Co. ou MOGPC. Numéro d'enregistrement: IR0052586388. Date d'enregistrement: 2.12.1998"
        props:
          registrationNumber: IR0052586388
          incorporationDate: 1998-12-02
        aliases:
          - Maroun Oil and Gas Operations
          - Maround Oil and Gas Production Co.
          - MOGPC
      - match: "Lieu d'enregistrement: Fédération de Russie, 620024, Ekaterinburg, ulitsa Simkaya, d. 2 - Type d'entité: société par actions - Date d'enregistrement: 18.5.2009 - Principal établissement: Fédération de Russie - Numéro d’enregistrement: 1096674009332: Numéro d'identification fiscale: 6674331056"
        props:
          jurisdiction: ru
          legalForm: société par actions
          incorporationDate: 2009-05-18
          ogrnCode: 1096674009332
          innCode: 6674331056
          address: "Fédération de Russie, 620024, Ekaterinburg, ulitsa Simkaya, d. 2"
      - match: "Type d'entité: société par actions - Lieu d'enregistrement: Fédération de Russie, Saint-Pétersbourg - Date d'enregistrement: 14.10.1993 Principal établissement: Fédération de Russie - Numéro d'identification fiscale: 7814027653 : Numéro d'enregistrement: 1027807560186"
        props:
          jurisdiction: ru
          legalForm: société par actions
          incorporationDate: 1993-10-14
          ogrnCode: 1027807560186
          innCode: 7814027653
          address: "Fédération de Russie, Saint-Pétersbourg"
      - match: "382231 (Numéro d’enregistrement)"
        props:
          registrationNumber: 382231
      - match: "Lieu d’enregistrement: Fédération de Russie (450022, République du Bashkortostan, Oufa, Mendeleev street, 134) - Date d’enregistrement: 12.8.2002 - Principal établissement: Fédération de Russie - Numéro d’enregistrement: 1020202551423: Numéro d'identification fiscale: 00274068924"
        props:
          jurisdiction: ru
          incorporationDate: 2002-08-12
          ogrnCode: 1020202551423
          innCode: 0274068924
          address: "Fédération de Russie (450022, République du Bashkortostan, Oufa, Mendeleev street, 134)"
      - match: "Lieu d'enregistrement: 676811 oblast d’Amurskaya, Belogorskiy Rayon, Vozhaevka, Fédération de Russie - Date d’enregistrement: 25.5.2009 - Principal établissement: Fédération de Russie - Numéro d’enregistrement: 1092804000255: Numéro d'identification fiscale: 2811005250"
        props:
          jurisdiction: ru
          incorporationDate: 2009-05-25
          ogrnCode: 1092804000255
          innCode: 2811005250
          address: "676811 oblast d’Amurskaya, Belogorskiy Rayon, Vozhaevka, Fédération de Russie"
      - match: "Type d’entité: société par actions - Lieu d’enregistrement: Fédération de Russie - Date d’enregistrement: 17.1.2003 - Principal établissement: Fédération de Russie - Autres informations: INN/KPP 5008011331/771701001 - Télécopieur: +7 (495) 909-83-73"
        schema: Company
        props:
          jurisdiction: ru
          legalForm: société par actions
          incorporationDate: 2003-01-17
          innCode: 5008011331
          kppCode: 771701001
          address: Fédération de Russie
      - match: "Type d’entité: société par actions - Lieu d’enregistrement: Fédération de Russie - Date d’enregistrement: 17.1.2003 - Principal établissement: Fédération de Russie - Autres informations: INN/KPP 5008011331/771701001 - Télécopieur: +7 (495) 909-83-73"
        schema: Company
        props:
          jurisdiction: ru
          legalForm: société par actions
          incorporationDate: 2003-01-17
          innCode: 5008011331
          kppCode: 771701001
          address: Fédération de Russie
      - match: "Type d’entité: entreprise unitaire publique fédérale - Lieu d’enregistrement: Fédération de Russie - Date d’enregistrement: 17.12.1992 - Numéro d’enregistrement: 1027401350932 - Principal établissement: Fédération de Russie - Autres informations: INN/KPP 7423000572 / 745901001 - Télécopieur: +8 (351) 465-22-33, +8 (351) 465-55-66"
        schema: Company
        props:
          jurisdiction: ru
          legalForm: entreprise unitaire publique fédérale
          incorporationDate: 1992-12-17
          ogrnCode: 1027401350932
          innCode: 7423000572
          kppCode: 745901001
          address: Fédération de Russie
      - match: "Type d’entité: société par actions non publique, propriété privée - Lieu d’enregistrement: Fédération de Russie, oblast de Vologda - Date d’enregistrement: 14.4.1994 - Numéro d’enregistrement: 1023500882437 - Principal établissement: Fédération de Russie - Autres informations: INN: 3525023010 OKPO: 07500548 KPP: 352501001"
        schema: Company
        props:
          jurisdiction: ru
          legalForm: société par actions non publique, propriété privée
          incorporationDate: 1994-04-14
          ogrnCode: 1023500882437
          innCode: 3525023010
          okpoCode: 07500548
          kppCode: 352501001
          address: "Fédération de Russie, oblast de Vologda"
      - match: "Numéro d’enregistrement: HRB 81573"
        props:
          registrationNumber: HRB 81573
      - match: "Numéro d’enregistrement - Type d’entité: société à responsabilité limitée - Lieu d’enregistrement: Moscou, Fédération de Russie - Date d’enregistrement: 18.8.2011 - Principal établissement: Fédération de Russie - Télécopieur: +7 (499) 608-90-03 - Numéro d’identification fiscale: 7718857267 - KPP: 770501001: 1117746641572"
        schema: Company
        props:
          ogrnCode: 1117746641572
          jurisdiction: ru
          legalForm: société à responsabilité limitée
          incorporationDate: 2011-08-18
          innCode: 7718857267
          kppCode: 770501001
          address: "Moscou, Fédération de Russie"
      - match: "Type d’entité: société par actions - Lieu d’enregistrement: Fédération de Russie - Date d’enregistrement: 17.11.2003 - Numéro d’enregistrement: 1037825058732 - Principal établissement: Fédération de Russie - Autres informations: INN/KPP 7811144648 / 781101001"
        schema: Company
        props:
          jurisdiction: ru
          legalForm: société par actions
          incorporationDate: 2003-11-17
          ogrnCode: 1037825058732
          innCode: 7811144648
          kppCode: 781101001
          address: Fédération de Russie
      - match: "Numéros d'enregistrement: OGRN - Type d’entité: société par actions - Lieu d’enregistrement: Fédération de Russie - Date d’enregistrement: 27.9.2002 - Principal établissement: Fédération de Russie - Télécopieur: 742-35-87: 1025001627012"
        schema: Company
        props:
          ogrnCode: 1025001627012
          jurisdiction: ru
          legalForm: société par actions
          incorporationDate: 2002-09-27
          address: Fédération de Russie
      - match: "Type d'entité: société par actions. Lieu d'enregistrement: Oblast de Tcheliabinsk, Fédération de Russie. Date d'enregistrement: 22.6.2000. Numéro d'enregistrement: 1027400870826. Principal établissement: Russie. Numéro d’identification fiscale: 7415029289: Numéro d'enregistrement: 1027400870826"
        schema: Company
        props:
          jurisdiction: ru
          legalForm: société par actions
          incorporationDate: 2000-06-22
          ogrnCode: 1027400870826
          innCode: 7415029289
          address: Oblast de Tcheliabinsk, Fédération de Russie
      - match: "Lieu d'enregistrement: Fédération de Russie, 123298, Moscou, ulitsa Narodnogo Opolcheniya, d. 40, k. 2- Type d'entité: société à responsabilité limitée - Date d'enregistrement: 25.11.2002 - Principal établissement: Fédération de Russie - Numéro d’enregistrement: 1028601443034: Numéro d'identification fiscale: 8608049090"
        schema: Company
        props:
          jurisdiction: ru
          legalForm: société à responsabilité limitée
          incorporationDate: 2002-11-25
          ogrnCode: 1028601443034
          innCode: 8608049090
          address: "Fédération de Russie, 123298, Moscou, ulitsa Narodnogo Opolcheniya, d. 40, k. 2"
      - match: "Lieu d'enregistrement: Fédération de Russie, 424003, République des Maris, Yoshkar-Ola, st. Suvorova, 15 - Date d'enregistrement: 18.4.2002 - Numéro d’enregistrement: 1021200757808 - Principal établissement: Fédération de Russie: Numéro d'identification fiscale: 1200001885"
        schema: Company
        props:
          jurisdiction: ru
          incorporationDate: 2002-04-18
          ogrnCode: 1021200757808
          innCode: 1200001885
          address: "Fédération de Russie, 424003, République des Maris, Yoshkar-Ola, st. Suvorova, 15"
      - match: "Numéro d’enregistrement: 1047422507736 ou 1127746188536"
        props:
          ogrnCode:
            - 1047422507736
            - 1127746188536
      - match: "Numéro d’identification fiscale: 7449044990 ou 7715909132"
        props:
          innCode:
            - 7449044990
            - 7715909132
      - match: "IR0000102447 - Numéro d’enregistrement"
        props:
          registrationNumber: IR0000102447
      - match: "Type d'entité: société par actions - Lieu d'enregistrement: Fédération de Russie - Date d'enregistrement: 22.1.1993 (date d'enregistrement national: 16.6.2000) - Personne associée: Pavel Gennadievich Tochilin (directeur général) (NIF: 504501388297): Numéro d'enregistrement: 1025005917023"
        schema: Company
        props:
          jurisdiction: ru
          legalForm: société par actions
          incorporationDate: ["1993-01-22", "2000-06-16"]
          ogrnCode: 1025005917023
          innCode: 504501388297
          address: Fédération de Russie
        associates:
          - Pavel Gennadievich Tochilin
      - match: "SWIFT: REF AIRTH"
        props:
          swiftBic: REFAIRTH
      - match: "Autre dénomination: KEPCO"
        props:
          alias: KEPCO
      - match: "Autre dénomination: Gacharsan Oil Gas Co"
        props:
          alias: Gacharsan Oil Gas Co
      - match: "Autre dénomination: AOGC"
        props:
          alias: AOGC
      - match: "Type d’entité: société par actions non publique - Lieu d’enregistrement: Fédération de Russie - Date d’enregistrement: 11.10.2002 - Numéro d’enregistrement: 1025001627859 - Principal établissement: Fédération de Russie - Autres informations: Numéro d’identification: 13185231 INN: 5013045054 KPP: 504001001 OGRN: 1025001627859"
        schema: Company
        props:
          jurisdiction: ru
          legalForm: société par actions non publique
          incorporationDate: 2002-10-11
          ogrnCode: 1025001627859
          innCode: 5013045054
          kppCode: 504001001
          address: Fédération de Russie
      - match: "Type d'entité: société par actions cotée. Lieu d'enregistrement: Fédération de Russie. Date d'enregistrement: 1992. Numéro d'enregistrement: 1027739555282. Numéro d’identification fiscale: 7734202860. Principal établissement: Fédération de Russie: Numéro d'enregistrement: 1027739555282"
        schema: Company
        props:
          jurisdiction: ru
          legalForm: société par actions cotée
          incorporationDate: 1992
          ogrnCode: 1027739555282
          innCode: 7734202860
          address: Fédération de Russie
      - match: "IR0000047087 - Numéro d’enregistrement"
        props:
          registrationNumber: IR0000047087
      - match: "SG199004388C - Numéro d’enregistrement: (Singapour)"
        props:
          registrationNumber: SG199004388C
          jurisdiction: sg
      - match: "Date d’enregistrement: 5.9.1990 (Singapour)"
        props:
          incorporationDate: 1990-09-05
          jurisdiction: sg
      - match: "Type d’entité: société à responsabilité limitée - Lieu d’enregistrement: Fédération de Russie - Date d’enregistrement: 7.7.2005 - Numéro d’enregistrement: 1057747407398 - Principal établissement: Crimée - Télécopieur: +7 (495) 363-44-43 - Numéro d’identification fiscale: 7721533826 - KPP: 910201001"
        schema: Company
        props:
          jurisdiction: ru
          legalForm: société à responsabilité limitée
          incorporationDate: 2005-07-07
          ogrnCode: 1057747407398
          innCode: 7721533826
          kppCode: 910201001
          address: Crimée
      - match: "IR0000368792 - Numéro d’enregistrement"
        props:
          registrationNumber: IR0000368792
      - match: "IR0052586382 - Numéro d’enregistrement"
        props:
          registrationNumber: IR0052586382
      - match: "Code SWIFT succursale de Kish Island: SCERIRTH KSH"
        props:
          swiftBic: SCERIRTH KSH
      - match: "Code SWIFT succursale de Dubaï: SCTSAEA1"
        props:
          swiftBic: SCTSAEA1
      - match: "Code SWIFT succursale de Téhéran: SCERIRTH"
        props:
          swiftBic: SCERIRTH
      - match: "IR0052586388 - Numéro d’enregistrement"
        props:
          registrationNumber: IR0052586388
      - match: "03503060 - Numéro d’enregistrement (Royaume Uni)"
        props:
          registrationNumber: 03503060
          jurisdiction: gb
      - match: "CH-550.1.031.089-Numéro d’enregistrement"
        props:
          registrationNumber: CH-550.1.031.089
      - match: "CHE-109.711.148 - Numéro de TVA"
        props:
          taxNumber: CHE-109.711.148
      - match: "Fondée en 1995"
        props:
          incorporationDate: 1995
      - match: "IR0022770444 - Numéro d’enregistrement"
        props:
          registrationNumber: IR0022770444
      - match: "IR0000047088 - Numéro d’enregistrement"
        props:
          registrationNumber: IR0000047088
      - match: "Numéro d'enregistrement - Type d’entité: société par actions - Lieu d’enregistrement: Fédération de Russie, région de Sverdlovsk, Yekaterinburg - Date d’enregistrement: 15.5.2009 - Principal établissement: Fédération de Russie, Yekaterinburg - Numéro d’identification fiscale: 6659190900 - KPP: 668601001 - Télécopieur: +7 (343) 352-46-32, +7 (343) 334-46-42, +7 (343) 336-71-20, +7 (343) 329-77-00 - Site internet: www.uraltransmash.com: 1096659005200"
        schema: Company
        props:
          ogrnCode: 1096659005200
          jurisdiction: ru
          legalForm: société par actions
          incorporationDate: 2009-05-15
          innCode: 6659190900
          kppCode: 668601001
          address: "Fédération de Russie, région de Sverdlovsk, Yekaterinburg"
      - match: "Type d'entité: établissement financier - SWIFT/BIC code: KHJBSDKH et 5040942458 - Principal établissement: Khartoum, Soudan"
        props:
          legalForm: établissement financier
          swiftBic:
            - KHJBSDKH
          registrationNumber:
            - 5040942458
          address: Khartoum, Soudan
      - match: "Télécopieur : +7 (495) 660-40-99; +7 (812) 385-94-49"
        props:
          phone:
            - +7 (495) 660-40-99
            - +7 (812) 385-94-49
      - match: "Télécopieur: +7 (495) 785-08-88"
        props:
          phone: +7 (495) 785-08-88
      - match: "Fax: 8890028"
        props: []
      - match: "Numéro d'enregistrement ; Type d'entité: société à responsabilité limitée ; Lieu d'enregistrement: Émirats arabes unis ; Date d'enregistrement: 1.4.2008 ; CBLS: 11395424: 5002444"
        schema: Company
        props:
          registrationNumber: [5002444, 11395424]
          legalForm: société à responsabilité limitée
          jurisdiction: ae
          incorporationDate: 2008-04-01
      - match: "Numéro d'enregistrement ; Type d'entité: société par actions ; Lieu d'enregistrement: Sarapul, Fédération de Russie ; Date d'enregistrement: 10.2.1993 ; Numéro d'identification fiscale: 1827001683: 1021800992190"
        schema: Company
        props:
          ogrnCode: 1021800992190
          legalForm: société par actions
          jurisdiction: ru
          incorporationDate: 1993-02-10
          innCode: 1827001683
          address: Sarapul, Fédération de Russie
      - match: "Numéro de licence commerciale:: 211000004009999"
        props:
          registrationNumber: 211000004009999
      - match: "OGRN ; Type d'entité: société par actions ; Lieu d'enregistrement: Fédération de Russie ; Date d'enregistrement: 29.12.2010 ; Numéro d'identification fiscale: 6441019849: 1106441000951"
        schema: Company
        props:
          ogrnCode: 1106441000951
          legalForm: société par actions
          jurisdiction: ru
          incorporationDate: 2010-12-29
          innCode: 6441019849
          address: Fédération de Russie
      - match: "Numéro d'enregistrement ; Type d'entité: société publique par actions ; Lieu d'enregistrement: Fédération de Russie ; Date d'enregistrement: 16.7.2002 ; Numéro d'identification fiscale: 2540047110 ; KPP: 770501001 ; Télécopieur: +7 495 780 6003 ; Site internet: www.fesco.com/en: 1022502256127"
        schema: Company
        props:
          ogrnCode: 1022502256127
          legalForm: société publique par actions
          jurisdiction: ru
          incorporationDate: 2002-07-16
          innCode: 2540047110
          kppCode: 770501001
      - match: "PPC: 770501001"
        props:
          kppCode: 770501001
      - match: "Principal lieu d'activité: Soi-disant “République populaire de Lougansk”"
        props:
          address: "Soi-disant “République populaire de Lougansk”"
      - match: "Date d'enregistrement: 31.8.1995, 7.9.2002"
        props:
          incorporationDate: ["1995-08-31", "2002-09-07"]
      - match: "Numéro OMI ; Type d'entité: société par actions ; Lieu d'enregistrement: Fédération de Russie ; Date d'enregistrement: 1937: 4032815"
        schema: Company
        props:
          imoNumber: 4032815
          legalForm: société par actions
          jurisdiction: ru
          incorporationDate: 1937
      - match: "PPC: 771301001"
        props:
          kppCode: 771301001
      - match: "Fax: +7 (495) 485-43-95; (495) 485-43-95"
        props: []
      - match: "Entités associées: Kalashnikov Concern"
        associates:
          - Kalashnikov Concern
      - match: "Numéro d'enregistrement ; Type d'entité: société par actions ; Date d'enregistrement: 8.11.2011: 1112130014325"
        schema: Company
        props:
          ogrnCode: 1112130014325
          legalForm: société par actions
          incorporationDate: 2011-11-08
      - match: "Lieu d'enregistrement: Izhevsk, Fédération de Russie"
        props:
          address: Izhevsk, Fédération de Russie
      - match: "Numéro d'enregistrement ; Type d'entité: société publique par actions ; Lieu d'enregistrement: Vladivostok, Fédération de Russie ; Date d'enregistrement: 1.8.2002 ; Numéro d'identification fiscale: 253900880: 1022502117505"
        schema: Company
        props:
          ogrnCode: 1022502117505
          legalForm: société publique par actions
          jurisdiction: ru
          incorporationDate: 2002-08-01
          taxNumber: 253900880
          address: Vladivostok, Fédération de Russie
      - match: "Principal lieu d'activité: Soi-disant “République populaire de Donetsk”"
        props:
          address: "Soi-disant “République populaire de Donetsk”"
      - match: "Principal établissement: République populaire de Chine"
        props:
          address: "République populaire de Chine"
      - match: "Lieu d'enregistrement: Royaume-Uni"
        props:
          jurisdiction: gb
      - match: "OGRN ; Type d'entité: société par actions ; Lieu d'enregistrement: Fédération de Russie ; Date d'enregistrement: 1.7.1998 ; Numéro d'identification fiscale: 1827013914: 1021800992124"
        schema: Company
        props:
          ogrnCode: 1021800992124
          legalForm: société par actions
          jurisdiction: ru
          incorporationDate: 1998-07-01
          innCode: 1827013914
          address: Fédération de Russie
      - match: "Entités associées: PSB Bank; VEB.RF"
        associates:
          - PSB Bank
          - VEB.RF
      - match: "Lieu d'enregistrement: Kirghizstan"
        props:
          jurisdiction: kg
      - match: "Numéro d'enregistrement: 311479-3301-ООО"
        props:
          registrationNumber: 311479-3301-ООО
      - match: "Entité associée : PSB Bank"
        associates:
          - PSB Bank
      - match: "Lieu d'enregistrement: Bichkek, Kirghizstan"
        props:
          address: Bichkek, Kirghizstan
      - match: "Numéro d'enregistrement: 311748-3301-OOO"
        props:
          registrationNumber: 311748-3301-OOO
      - match: "Adresses de portefeuille de chaîne de blocs connues: TNZxGWCwvsHr6JxQxzoeDXV597Yf7Zb7nV; TC8axQvzJEVR3NKN6mZnJtGy7537GEmh38; TEcuHDQthTmULe8fFLUccBPpjfXaTmJuuD"
        wallets:
          - currency: null
            publicKey: TNZxGWCwvsHr6JxQxzoeDXV597Yf7Zb7nV
          - currency: null
            publicKey: TC8axQvzJEVR3NKN6mZnJtGy7537GEmh38
          - currency: null
            publicKey: TEcuHDQthTmULe8fFLUccBPpjfXaTmJuuD
      - match: "Lieu d'enregistrement: Antilles néerlandaises; Belize; États-Unis d'Amérique"
        props:
          jurisdiction:
            - an
            - bz
            - us
      - match: "Numéro d'enregistrement ; Type d'entité: société à responsabilité limitée ; Lieu d'enregistrement: Fédération de Russie ; Date d'enregistrement: 19.2.2008: 1089847079630"
        schema: Company
        props:
          registrationNumber: 1089847079630
          legalForm: société à responsabilité limitée
          jurisdiction: ru
          incorporationDate: 2008-02-19
      - match: "Numéro de TVA: GB202537249"
        props:
          taxNumber: GB202537249
      - match: "Lieu d'enregistrement: États-Unis d'Amérique"
        props:
          jurisdiction: us
      - match: "NIF, numéro d'identification fiscale - Lieu d'enregistrement: Bangui (République centrafricaine) - Date d'enregistrement: 24.10.2017 - Principal établissement: République centrafricaine - : succursale de M-Finans: M 354838 D 0001"
        props:
          registrationNumber: M 354838 D 0001
          jurisdiction: Central African Republic
          incorporationDate: 2017-10-24
          address: Bangui (République centrafricaine)
      - match: "personnes  et entités associées: Yevgeny Prigozhin (décédé), groupe  Wagner, Dimitri Sytii, Valery  Zakharov, Perfilev, Svetlana  Troitskaya, Lobaye Invest"
        associates:
          - Yevgeny Prigozhin
          - groupe Wagner
          - Dimitri Sytii
          - Valery Zakharov
          - Perfilev
          - Svetlana Troitskaya
          - Lobaye Invest
      - match: "Lieu d’enregistrement: 106 Guangming Road, Urumqi, région autonome ouïgoure du Xinjiang (XUAR), Chine - Date d’enregistrement: avril 1984b- Principal établissement: Urumqi, région autonome ouïgoure du Xinjiang (XUAR), Chine: Type d’entité: agence gouvernementale"
        schema: Company
        props:
          jurisdiction: cn
          legalForm: agence gouvernementale
          incorporationDate: 1984-04
          address: ["106 Guangming Road, Urumqi, région autonome ouïgoure du Xinjiang (XUAR), Chine", "Urumqi, région autonome ouïgoure du Xinjiang (XUAR), Chine"]
      - match: "Personnes associées: Guangqiu YANG 杨光秋  (2.2017-2.2023)"
        associates:
          - Guangqiu YANG
          - 杨光秋
      - match: "Personne associée : Zhiyong GONG 龚志勇 (depuis  2.2023-); secrétaire du Parti communiste  chinois (PCC)/chef de la  polic publique du XPCC/inspecteur en chef du Bureau  de sécurité"
        associates:
          - Zhiyong GONG
          - 龚志勇
  addresses:
    # Sometimes we can split on ; but sometimes it's just part of the address.
    options:
      - match: "Apt. No 7, 3rd Floor, No 2, 4th Alley, Gandi Ave., Téhéran (Iran); Qaem Magham Farahani St., Téhéran (Iran)"
        addresses:
          - Apt. No 7, 3rd Floor, No 2, 4th Alley, Gandi Ave., Téhéran (Iran)
          - Qaem Magham Farahani St., Téhéran (Iran)
      - match: "Adresse: 125212, Fédération de Russie, Moscou, Leningradskoye Shosse, 58;"
        addresses:
          - "125212, Fédération de Russie, Moscou, Leningradskoye Shosse, 58"
      - match: "Kosmodamianskaya Naberezhnaya 24, Moscou, Russie 115035; bâtiment 1."
        addresses:
          - "Kosmodamianskaya Naberezhnaya 24, Moscou, Russie 115035; bâtiment 1."
      - match: "1K Zavodzkaya St., bureau 36 Bolbasovo 211004 Biélorussie; 40 Nemiga St., bureau 304 Minsk 220004 Biélorussie"
        addresses:
          - "1K Zavodzkaya St., bureau 36 Bolbasovo 211004 Biélorussie"
          - "40 Nemiga St., bureau 304 Minsk 220004 Biélorussie"
      - match: "St. Dobroslobodskaya, 19; 105066, Moscou, Fédération de Russie"
        addresses: "St. Dobroslobodskaya, 19, 105066, Moscou, Fédération de Russie"
      - match: "No.1, Téhéran, Iranshahr Ave.Shadab. St, P.O.Box: 79145/3184; Iran"
        addresses: "No.1, Téhéran, Iranshahr Ave.Shadab. St, P.O.Box: 79145/3184; Iran"
      - match: "Sepah Islam Road, Karaj Special Road Km 10, Iran; Pasdaran Ave., P.O. Box 19585/777, Téhéran (Iran)"
        addresses:
          - "Sepah Islam Road, Karaj Special Road Km 10, Iran"
          - "Pasdaran Ave., P.O. Box 19585/777, Téhéran (Iran)"
      - match: "Adresse: Siège: Depenau 2, D-20095 Hambourg; Kish branch, Sanaee Avenue, PO Box 79415/148, Kish Island 79415"
        addresses:
          - "Siège: Depenau 2, D-20095 Hambourg"
          - "Kish branch, Sanaee Avenue, PO Box 79415/148, Kish Island 79415"
      - match: "Opp 7th Alley, Zarafshan St, Eivanak St, Qods Township; HTTS GmbH, Iran"
        addresses: "Opp 7th Alley, Zarafshan St, Eivanak St, Qods Township; HTTS GmbH, Iran"
      - match: "Unit 17, Fifth Floor, Yas Building, Number 116, Sheikh Fazlollah Highway, Teimuri Blvd, before Sharif University Metro Station, Téhéran, Iran;"
        addresses: "Unit 17, Fifth Floor, Yas Building, Number 116, Sheikh Fazlollah Highway, Teimuri Blvd, before Sharif University Metro Station, Téhéran, Iran"
      - match: "Unit 18, Fifth Floor, Yas Building, Number 116, Sheikh Fazlollah Highway, Teimuri Blvd, before Sharif University Metro Station, Téhéran, Iran;"
        addresses: "Unit 18, Fifth Floor, Yas Building, Number 116, Sheikh Fazlollah Highway, Teimuri Blvd, before Sharif University Metro Station, Téhéran, Iran"
      - match: "Unit 19, Fifth Floor, Yas Building, Number 116, Sheikh Fazlollah Highway, Teimuri Blvd, before Sharif University Metro Station, Téhéran 1459994450, Iran;"
        addresses: "Unit 19, Fifth Floor, Yas Building, Number 116, Sheikh Fazlollah Highway, Teimuri Blvd, before Sharif University Metro Station, Téhéran 1459994450, Iran"
      - match: "No. 47, East 18th Street, Farhang Boulevard, Sa'adat Abad, Téhéran 1997857976, Iran;"
        addresses: "No. 47, East 18th Street, Farhang Boulevard, Sa'adat Abad, Téhéran 1997857976, Iran"
      - match: "Unit 2, First Floor, EX35, Number 2, Exhibition Industrial Town, Kish Island 7941659854, Iran;"
        addresses: "Unit 2, First Floor, EX35, Number 2, Exhibition Industrial Town, Kish Island 7941659854, Iran"
      - match: "Kosmodamianskaya Naberezhnaya 24, Moscou, Russie 115035; bâtiment 1"
        addresses: "Kosmodamianskaya Naberezhnaya 24, Moscou, Russie 115035; bâtiment 1"
      - match: "18 Mehrshad Street, Sadaghat Street, en face du parc Mellat, Vali-e-Asr Ave., Téhéran (Iran); 265, à côté de Mehrshad, Sedaghat St., en face du parc Mellat, Vali-e-Asr Ave., Téhéran 1A001 (Iran)"
        addresses:
          - "18 Mehrshad Street, Sadaghat Street, en face du parc Mellat, Vali-e-Asr Ave., Téhéran (Iran)"
          - "265, à côté de Mehrshad, Sedaghat St., en face du parc Mellat, Vali-e-Asr Ave., Téhéran 1A001 (Iran)"
      - match: "Langare Street; Nobonyad Square, Téhéran"
        addresses: "Langare Street; Nobonyad Square, Téhéran"
