# DISCLAIMER: We go straight to hell for this file. We know. This is about complexity
# reduction to allow computers to handle humans. If you disagree with any of the
# political implications of the decisions made in this, please email us at
# info@opensanctions.org. Let's keep it cool and pragmatic.
country:
  normalize: true
  lowercase: true
  options:
    - match:
        - Council of Europe
        - "U"
        - "YYY"
        - "N/A"
        - "None Identified"
        - terrorist
        - "statelessness"
        - undetermined
        - Unknown
        - United Nations
        - "Kuwaiti citizenship withdrawn in 2002"
        - 2002年にクウェート国籍を剥奪された。
        - "Stateless Palestinian"
        - "особа без громадянства"
        - "-"
        - PO BOX 416
        - "02214513"
        - "220030"
        - "Regional"
        - Shigeharu Ueki
        - Genshin Impact
        - Other
        - World
        - "NULL"
        - "922"
        - "914"
        - "916"
        # All the countries below are nulled out because they do not have modern
        # equivalents. The rule of thumb here is to map countries into modern ones
        # if they are a perfect subset (e.g. Bavaria into Germany), but to drop
        # them if they're parts of non-overlapping empires.
        # This is now three countries, so dropping:
        - "Netherlands Antilles"
        # netherlands antilles:
        - AN
        - "British India"
        - "Weimar Republic"
        - "German Reich"
        - "German Empire"
        - "Grand Duchy of Mecklenburg-Schwerin"
        - "Grand Duchy of Hesse"
        - "Korea under Japanese rule"
        - "United Principalities"
        - "Kingdom of Prussia"
        - Prussia
        - "Kingdom of Italy"
        - "Principality of Montenegro"
        - "Soviet Civil Administration"
        - "Dominion of India"
        - "Austria-Hungary"
        - "Austrian Empire"
        - "Kingdom of Hungary"
        - "Kingdom of Romania"
        - "Ottoman Empire"
        - "Cisleithania"
        - "Union of South Africa"
        - "Tuvan People's Republic"
        - "Dutch East Indies"
        - "Irish Free State"
        - "British Empire"
        - "Kingdom of Hejaz"
        - "Emirate of Transjordan"
        - "Federation of Rhodesia and Nyasaland"
        - "Southern Rhodesia"
        - "Pahlavi Dynasty"
        - "Estado Novo"
        - "title of Virgin Mary"
        - "Kingdom of Iraq"
        - "Iraqi Republic (1958–1968)"
        - Republic of German-Austria
        - Second Polish Republic
        - Kingdom of Serbs, Croats and Slovenes
        - State of Slovenes, Croats and Serbs
        - Protectorate of Bohemia and Moravia
        - First Czechoslovak Republic
        - Kingdom of the Two Sicilies
        - Papal States
        - Free Territory of Trieste
        - Kingdom of Bulgaria
        - Mali Federation
        - Patiala State
        - Kingdom of Sikkim
        - Portuguese Empire
        - Provisional Government of Mexico
        - First Mexican Empire
        - Mandatory Palestine # now very optional Palestine
        - Americas
        - Nazareth
        - Insular Government of the Philippine Islands
        - Korean Empire
        - Congress Poland
        - Romanov Empire
        - Joseon
        - Song dynasty
        - Northern Song dynasty
        - Qing dynasty
        - Ming dynasty
        - Tang dynasty
        - Yuan dynasty
        - Tapia
        - Savoy
        - politician
        - Alkatraz
        - Tilted Towers
        - Fortnite
        - Korean Peninsula
        - British Pakistanis
        - United Arab Republic
        - Kedah Sultanate
        - Republic of Mahabad
        - Taiwan under Japanese rule
        - Abbasid Caliphate
        - Rashidun Caliphate
        - Caucasus Emirate
        - Egypt Eyalet
        - Spanish State
        - Qajar Iran
        - Cao Wei
        - Eastern Han
        - Assyrian Empire
        - Mutawakkilite Kingdom of Yemen
        - Great Socialist People's Libyan Arab Jamahiriya
        - Seljuk Empire
        - Libyan Arab Republic
        - Kingdom of Libya
        - Safavid Empire
        - French mandate of Lebanon
        - French Mandate for Syria and the Lebanon
        - Lebanese Republic under French mandate
        - Khedivate of Egypt
        - Marinid Dynasty
        - Ancient Rome
        - Western Han
        - al-Andalus
        - Emirate of Cyrenaica
        - Umayyad Caliphate
        - French Indochina
        - Caliphate of Córdoba
        - Buyid dynasty
        - State of Cambodia
        - Liang dynasty
        - First Saudi State
        - People's Republic of Kampuchea
        - Bengal
        - State of Greater Lebanon
        - Đại Việt
        - Chen dynasty
        - Jordanian annexation of the West Bank
        - Holy Roman Empire
        - mandatory Lebanese Republic
        - Almoravid dynasty
        - Babylon
        - Idrisid dynasty
        - Samanid Empire
        - Democratic Kampuchea
        - Russian state 1918-1920
        - Sui dynasty
        - Mahdist Sudan
        - Sultanate of Darfur
        - Polish–Lithuanian Commonwealth
        - Khwarezmian Empire
        - Sultanate of Bengal
        - Delhi Sultanate
        - Khmer Republic
        - Shu Han
        - emirate of Córdoba
        - Mali Empire
        - Arabs
        - Second East Turkestan Republic
        - Republic of Venice
        - Lithuanian–Belorussian Soviet Socialist Republic
        - British Burma
        - Republic of the Congo (Léopoldville)
        - Emirate of Granada
        - Kingdom of Hanover
        - Kingdom of Poland (1025-1385)
        - Northern Qi
        - Ziyarid dynasty
        - Taifa of Dénia
        - Safavid dynasty
        - Republic of Upper Volta
        # TODO:
        - Kurdistan
        - Tibetan Plateau
        - Kingdom of Tlemcen
        - Mughal Empire
        - East Pakistan
        - Timurid Empire
        - Portuguese Macau
        - Jin dynasty
        - Western Wei
        - Qajar dynasty
        - Portuguese Guinea
        - Grand Duchy of Moscow
        - Principality of Polotsk
        - Duchy of Zaslawye
        - Parthian Empire
        - Kingdom of Castile
        - Udaipur State
        - Arab Kingdom of Syria
        - Palestinian National Authority
        - Portuguese Cape Verde
        - Johor Sultanate
        - Sultanate of Egypt
        - German Confederation
        - Far Eastern Republic
        - Northern Zhou
        - Hatay State
        - People's Republic of the Congo
        - Central African Empire
        - Southern Tang
        - Ghaznavid Empire
        - Southern Qi
        - Crown of Aragon
        - Spanish Empire
        - Zand dynasty
        - Wuyue
        - Barotseland
        - Margraviate of Moravia
        - Sheikhdom of Kuwait
        - CHANNEL ISLANDS
        - Wu guo
        - Hyderabad State
        - Denmark-Norway
        - West Ukrainian People's Republic
        - Pueblo of Laguna
        - Gran Colombia
        - Saudi Arabia national football team
        - Transcaucasian Commissariat
        - Transcaucasian Democratic Federative Republic
        - Beiyang Government
        - British Raj
        - presidencies and provinces of British India
        # Ukraine SFMS:
        - 27 May 1973
        - 1 Jan. 1975
        - "region: commonwealth of independent states"
        - Restored Hanthawaddy Kingdom
        - "Newcastle United F.C."
        - "Dominion of Ghana"
        - "Sweden-Finland"
        - Habsburg Netherlands
        - Dutch Republic
        - Afsharid Empire
        - Eldiguzids
        - Al Ain
        - Grand Duchy of Lithuania
        - Gorkha Kingdom
        - Marocaine
        - Kingdom of Funan
        - Kingdom of Chenla
        - Khmer Empire
        - Tahiti
        - Principality of Sperlinga
        - Classical Athens
        - Imperial China
        - Oudh State
        - Virgin Islands
        - United States occupation of the Ryukyu Islands
        - Republic of Geneva
        - County of Mark
        - Principality of Transylvania
        - Kingdom of Navarre
        - Kingdom of Naples
        - Former Liang
        - Portuguese India
        - Grand Duchy of Oldenburg
        - Julian March
        - Najaf
        - Northern Wei
        - Eastern Wei
        - Mangkunegaran
        - Bhavnagar State
        - Kingdom of Bohemia
        - Cossack Hetmanate
        - Goryeo
        - Arabian Peninsula
        - Kingdom of Lithuania
        - British Malaya
        - English people
        - Reichskommissariat Ostland
        - Gambia Colony and Protectorate
        - Antilles britanniques
        - Iles Vierges
        - Terengganu
        - Tokugawa shogunate
        - XUN
        - Kievan Rus'
        - British Mauritius # Tromelin is disputed by mauritius
        - First Republic of Armenia
        - Don Republic
        - Archduchy of Austria
        - Kingdom of Gwent
        - Vannetais
        - Kingdom of Gwynedd
        - La La Land
        - Kingdom of Ireland
        - County of Tyrol
      contains:
        - (JVCFOR)
        - with effect from
        - as a result of being in the service of declared terrorist organisation
      value: null
    - match:
        - Australian continent
      value: AU
    - match:
        - Bhopal State
      value: IN
    - match:
        - Chinese Soviet Republic
        - Beijing
        - Китайська Народна Республіка
        - china (prc)
      value: China
    - match:
        - Danish Realm
      value: DK
    - match:
        - Kingdom of Nepal
      value: NP
    - match: Santo Domingo
      values:
        - Dominican Republic
    - match:
        - Nazi Germany
        - Allied-occupied Germany
        - Kingdom of Bavaria
        - Bavaria
      value: DE
    - match:
        - Socialist Republic of Romania
        - Hunedoara County
      value: RO
    - match:
        - Commonwealth of the Philippines
        - Second Philippine Republic
        - Third Republic of the Philippines
      value: Philippines
    - match:
        - "Jalisco"
        - "Guadalajara, Jalisco"
        - "Sinaloa"
        - "Culiacan, Sinaloa"
        - "Monterrey, Nuevo Leon"
        - "Tepic, Nayarit"
        - Oaxaca State
      value: MX
    - match:
        - Maracaibo, Zulia
      value: VE
    - match: Paraguay / Brasil
      values:
        - Paraguay
        - Brazil
    - match:
        - PRONTUARIO PARAGUAYO
      values:
        - Paraguay
    - match:
        - BRASILEÑA
      value: Brazil
    - match:
        - Italian Social Republic
        - Republic of Florence
      value: Italy
    - match: SPA
      value: Spain
    - match:
        - British rule in Myanmar
      value: Myanmar
    - match:
        - Ecuatorial Guinaea-
      value: Equatorial Guinea
    - match:
        - Guinaea-
        - Guinée Conakry
      value: Guinea
    - match:
        - People's Republic of Bulgaria
        - Principality of Bulgaria
      value: Bulgaria
    - match:
        - Principality of Serbia
        - Kingdom of Serbia
      value: Serbia
    - match:
        - Северная Македония
      value: North Macedonia
    - match: SCG
      value: CSXX
    - match:
        - Southern Netherlands
      value: Netherlands
    - match:
        - Federation of Malaya
        - Malaya
      value: Malaysia
    - match:
        - "Jordanian of Palestinian origin"
        - Zarqa
      value: JO
    - match:
        - "Chong An District, Wuxi Jiangsu, Jiangsu Province"
      value: CN
    - match:
        - China Hong Kong City
        - Chine (Hong-Kong SAR)
      values:
        - HK
        - CN
    - match:
        - Kingdom of Egypt
        - Republic of Egypt (1953–1958)
        - Republic of Egypt
        - مصر - مسجون
      value: Egypt
    - match:
        - "Sanaa, Yemen"
        - Yemen Arab Republic
        - South Yemen
        - alt Citizenship Yemeni)
      value: YE
    - match:
        - "Somali Location"
        - "Somalia Alt."
        - "Somali citizen"
      value: Somalia
    - match: Saar
      value: DE
    - match:
        - Assembly of Kosovo*
        - XKS
      value: XK
    - match:
        - Albanian Kingdom
        - Albanian Republic
        - Principality of Albania
        - Independent Albania
        - People's Socialist Republic of Albania
      value: Albania
    - match:
        - Georgian Soviet Socialist Republic
      values:
        - GE
        - SU
    - match:
        - Palestinian National Council
        - "Region: Gaza"
      value: Palestine
    - match:
        - Cyprus* [Resolution 1376 (2004)]
        - British Cyprus
      value: CY
    - match: Salvadoran
      value: El Salvador
    - match: Laotian
      value: Laos
    - match: Dual American and Russian
      values:
        - US
        - RU
    - match: Palestinian and possibly Lebanese
      values:
        - PS
        - Lebanon
    - match: Palestinian and possibly Iraqi
      values:
        - PS
        - IQ
    - match: NM # New Mexico?
      value: US
    - match: Trucial States
      value: AE
    - match: "Region: Northern Mali"
      value: Mali
    - match:
        - "Provisional People's Committee for North Korea"
        - north korea (dprk)
      value: North Korea
    - match:
        - First Republic of South Korea
        - Second Republic of South Korea
        - Third Republic of South Korea
        - Fourth Republic of South Korea
        - Fifth Republic of South Korea
      value: KR
    - match:
        - Corée du Sud ( Rép. de )
      value: South Korea
    - match: sh-hl
      value: Saint Helena
    - match:
        - Brithish
        - British National (Overseas)
        - British Overseas citizen
        - United Kingdom of Great Britain and Northern Irela
        - Marea Britanie
      value: GB
    - match:
        - Scotland Uk
      value: GB-SCT
    - match: British,Irish
      values:
        - GB
        - IE
    - match:
        - IRLANDE, ou EIRE
        - Irlande /Eire/
      values:
        - IE
    - match: British Pakistani
      values:
        - GB
        - PK
    - match: German,British
      values:
        - DE
        - GB
    - match:
        - Saxe-Eisenach
      value:
        - DE
    - match:
        - Sudan/South Sudan
        - Sudan/or South Sudan
      values:
        - Sudan
        - South Sudan
    - match:
        - "Sudanese by birth"
        - スーダン人（生まれ）
      value: Sudan
    - match:
        - "South Sudan number"
        - Juba
        - "region: kafia kingi"
      value: South Sudan
    - contains:
        - Uk/British
      value: GB
    - match:
        - United States. Also believed to hold Syrian nationality
        - 米国。また、シリア国籍も所持していると見られる。
      values:
        - US
        - SY
    - match:
        - U.S. state
        - Northern Cheyenne Indian Reservation
        - Choctaw Nation of Oklahoma
        - Sisseton Wahpeton Oyate
        - Navajo Nation
        - Dakota Estates Park
        - Seminole Nation of Oklahoma
        - Ho-Chunk Nation of Wisconsin
        - British America
        - British North America
        - United States of North America
        - Massachusetts Bay Colony
        - SUA
      value:
        - US
    - match:
        - Gujarat
      value: India
    - match:
        - Republic of Upper Volta (current Burkina Faso)
      value:
        - Burkina Faso
    - match:
        - Iran / unknown
        - "Branch Office 11: Iran"
        - Pahlavi Iran
      value: IR
    - match:
        - Libyan Arab Jamahiriya
        - Libya (in custody)
        - South Libya
        - LIBANÉS
        - BENGHAZI
        - בנגאזי
        - DERNA
        - דרנה
      value: Libya
    - match:
        - Tunisian passport
        - תוניס
      value: Tunisia
    - match:
        - Captaincy General of Cuba
      value: Cuba
    - match:
        - Possibly Ethiopian
        - エチオピアと思われる
      value: Ethiopia
    - match:
        - Indonesia (as at Dec. 2003)
        - Indonesian (as at Dec. 2003)
        - Indonesian passport
        - インドネシア（2003年12月時点）
        - Aceh
      value: Indonesia
    - match: Afghan  Pakistani
      values:
        - Afghanistan
        - Pakistan
    - match: Australia and Egypt
      values:
        - Australia
        - Egypt
    - match: German, Moroccan
      values:
        - German
        - Morocco
    - match: United States and Iranian
      values:
        - United States
        - Iran
    - match:
        - Cherokee Nation
        - Chickasaw Nation
        - Americans
        - Colony of Rhode Island and Plantations
        - Kingdom of Hawaiʻi
      value: US
    - match:
        - QUEBEC H2Y 1L6
      value: CA
    - match:
        - Repubic of Moldova
        - Gagauzia
        - mun. Chișinău
      value: MD
    - match:
        - Pridnestrovian Moldavian Soviet Socialist Republic
        - Оккупированная Россией территория Молдовы
      value: MD-PMR
    - match: Malian / Mauritanian
      values:
        - Mauritania
        - Mali
    - match:
        - Australiana
        - Gold Coast
      value: Australia
    - match:
        - תורכיה ירדן ערב הסעודית
      values:
        - Turkey
        - Jordan
        - Saudi Arabia
    - match:
        - French Cameroons
      value: Cameroon
    - match:
        - ירדן, כווית
      values:
        - Jordan
        - Kuweit
    - match: السعودية / الكويت
      values:
        - Saudi Arabia
        - Kuweit
    - contains: Fiji (Prakash’s Australian
      value: Fiji
    - match:
        - Baabda
        - Beirut
      contains:
        - Lebanon (Succarieh’s Australia
        - EL LIBANO
        - EL LÍBANO
      value: Lebanon
    - match:
        - ANT
      value: ANtigua and Barbuda
    - match: BUJUMBURA
      value: Burundi
    - match: אלג'יר או רש"פ
      values:
        - Algeria
        - PS
    - match: פיליפים / סעודיה
      values:
        - Saudi Arabia
        - Philippines
    - match:
        - אוזבקיסטן / אפגניסטן
        - Uzbek; Afghan
      values:
        - Uzbekistan
        - Afghanistan
    - match:
        - "France (alt. citizen: Syri"
        - Французька Республіка
        - French Third Republic
        - French Fourth Republic
        - Vichy France
        - Kingdom of France
        - French First Republic
        - First French Empire
      value: France
    - match: Saudi Arabian (this aka only, alt Citizenship Yemeni)
      values:
        - Saudi Arabia
        - Yemen
    - match: Саудитско гражданство /  афганско гражданство
      values:
        - Saudi Arabia
        - Afghanistan
    - match:
        - Bahrain (citizenship revoked in Jan. 2015)
        - バーレーン（2015年1月市民権剥奪）
      value: Bahrain
    - match:
        - Ethnic Russian
        - Southern Russia
        - Vedenskiy District, the Republic of Chechnya
        - Chechnya
        - Tsardom of Russia
        - Tatarstan
      value: RU
    - match:
        - Former Ukrainian
      value: UA
    - match: スウェーデン（リンケビー、ストックホルム）、ソマリア（モガディシュ）
      values:
        - SE
        - SO
    - match:
        - Australian citizen
        - "New South Wales"
      value: Australia
    - match:
        - Believed location - Egypt
        - Alexandria, Egypt
      value: Egypt
    - match:
        - Azerbaijan Democratic Republic
        - Азербайджанська Республіка
        - Baku
      value: AZ
    - match:
        - former USSR, now Azerbaijan
        - Azerbaijan Soviet Socialist Republic
      values:
        - "SUHH"
        - "AZ"
    - match:
        - Armenian Soviet Socialist Republic
      values:
        - "SUHH"
        - "AM"
    - match: former USSR, now Kyrgyzstan
      values:
        - "SUHH"
        - "KG"
    - match:
        - Uzbek SSR
        - Uzbek Soviet Socialist Republic
      values:
        - SUHH
        - UZ
    - match:
        - State of Vietnam
        - South Vietnam
        - Republic of Vietnam
        - North Vietnam
      value: Vietnam
    - match: Iraq,Iran
      values:
        - "Iraq"
        - "Iran"
    - match: עירק/סוריה
      values:
        - Iraq
        - Syria
    - contains:
        - Iraq, possible alternative
        - Ba'athist Iraq
      value: "Iraq"
    - match:
        - Ukrainian SSR (now Ukraine)
        - former USSR, now Ukraine
        - Ukrainian Soviet Socialist Republic
        - Ukrainian People's Republic
      values:
        - SUHH
        - UA
    - match:
        # uargh be more specific dammit
        - Territories occupied by Russia
      values:
        - UA
    - match:
        - Latvian Soviet Socialist Republic
      values:
        - SUHH
        - Latvia
    - match:
        - Federația Rusă
      values:
        - RU
    - match:
        - Ukrainian,Russian
        - Russian Federation,Ukraine
      values:
        - UA
        - RU
    - match:
        - Ukranian
        - Оккупированная Россией территория Украины
      value: UA
    - match:
        - Russian SFSR (now Russian Federation)
        - Russian SFSR
        - RSFSR
        - former USSR Currently Russia
        - Former USSR, now Russian Federation
        - Russian Soviet Federative Socialist Republic
        - Russian Socialist Federative Soviet Republic
      values:
        - SUHH
        - RU
    - match:
        - Former USSR Currently Belarus
        - Former USSR Now Belarus
        - Byelorussian Soviet Socialist Republic
        - Socialist Soviet Republic of Byelorussia
        - Belarusian People's Republic
      values:
        - SUHH
        - BY
    - match:
        - Республика Беларусь
      value: BY
    - match:
        - Estonian Soviet Socialist Republic
      values:
        - SUHH
        - EE
    - match: Estonia, Russia
      values:
        - EE
        - RU
    - match:
        - Former USSR
        - Uzbekistan SSR
        - Moldovan SSR
        - Komi ASSR,
        - Yakut Autonomous SSR
        - Belarusian SSR,
        - Union d.Rép.Soc.Soviét.
        - Kyrgyz SSR
        - USSR (until 1991)
        - ソビエト社会主義共和国連邦（1991年まで）
        - Transcaucasian Socialist Federative Soviet Republic
        - CCCP
      value: SUHH
    - match:
        - Kyrgzstan
      value: KG
    - match:
        - Kazakhstan   Soviet Union
        - Kazakh Soviet Socialist Republic
      values:
        - SUHH
        - KZ
    - match: Turkmen Soviet Socialist Republic
      values:
        - SUHH
        - TM
    - match: DRC,Belgium
      values:
        - DR Congo
        - Belgium
    - match: United States of America. Also believed to hold Syrian nationality
      values:
        - USA
        - Syria
    - match: United Kingdom, previous address
      value: United Kingdom
    - match: Kingdom of Portugal
      value: Portugal
    - contains:
        - Syrian Arab Republic
        - First Syrian Republic
        - State of Syria
        - Damascus
      value: Syria
    - match:
        - possibly United Arab Emirates
        - Объединённые Арабские Эмираты
      value: AE
    - match:
        - former Yugoslavia
        - Kingdom of Yugoslavia
      value: YUCS
    - match:
        - Independent State of Croatia
        - Republic of Serbian Krajina
      value: HR
    - match:
        - Polish People's Republic
        - Crown of the Kingdom of Poland
        - Kingdom of Poland
      value: Poland
    - match:
        - Slovak State (1939-1945)
      value: Slovakia
    - match:
        - Afghanistan   Afghanistan
        - Islamic Emirate of Afghanistan
        - Republic of Afghanistan
        - Islamic State of Afghanistan
        - Democratic Republic of Afghanistan
        - Transitional Islamic State of Afghanistan
        - Kingdom of Afghanistan
        - Emirate of Afghanistan
      value: AF
    - match: to   Morocco
      value: Morocco
    - match:
        - Ramallah
        - Occupied Palestinian Territories
      value: PS
    - match: Trinidad,
      value: TT
    - match:
        - First Republic of Austria
        - Federal State of Austria
      value: AT
    - match:
        - Saudi Arabian Citizen
        - Saudi Arabian (this aka only
        - al-Khafji
        - Kingdom of Nejd and Hejaz
        - Saud
        - Riyadh
      value: Saudi Arabia
    - match:
        - פקיסטן ואפגניסטן
        - PAKISTAN AND AFGHNISTAN
      contains: Afghanistan/Pakistan
      values:
        - AF
        - PK
    - match: Kenya/Somalia border
      values:
        - KE
        - SO
    - match: ソマリア（モガディシュ）
      value: SO
    - match:
        - ケニア・ナイロビ
        - Nairobi
        - Kenya Colony
      value: KE
    - match:
        - Bogota
        - Maico, Guajira
      value: CO
    - match:
        - Faisalabad, Punjab, Pakistan
        - Azad Kashmir
        - "&#x0D; Pakistan"
        - Pakis
        - پاڪستاني
      value: PK
    - match:
        - Romanian People's Republic
      value: RO
    - match:
        - Cenral African Republic
      value: CF
    - match: a) Chad b) Central African Republic c) Congo
      values:
        - Chad
        - Central African Republic
        - DR Congo
    - match: Guinea-Bissua
      value: Guinea-Bissau
    - match: Slovene
      value: Slovenia
    - match: crimea (occupied)
      value: ua-cri
    - match: Piribebuy
      value: Paraguay
    - match: British Honduras
      value: BZ
    - match: Oaxaca
      value: MX
    - match: Zulu Kingdom
      value: ZA

date:
  options:
    - match:
        - 0001-01-03
        - 0222-05-18
        - 0002-02-20
        - 0002-10-20
        - 8034-06-14
        - 0009-10-20
        - 0011-09-20
        - 0011-01-20
        - 0010-10-20
        - 0011-01-19
        - 0004-08-19
        - 0005-03-20
        - 0002-01-20
        - "0001-01-20"
        - "3030-03-09"
        - "3033-09-30"
        - "00/00/0"
        - "Approximately (30-35 years old)"
        - "Not yet reviewed"
        - "הכרזה בוטלה ביום 29.8.21"
        - "おおむね30~35歳"
        - "おおむね30～35歳"
        - "59"
        - "2"
        - "0"
        - "31801"
        - "31948"
        - "10/10"
        - "28/09"
        - "６月14"
        - "10月10"
        - "９月28"
        - "３月13"
        - "6月14"
        - "7月10"
        - "10月22"
        - "12.05."
        - "16.12."
        - "05.11."
        - "13.10."
        - "20.03."
        - "23.05.197"
        - 19.10.yyyy
        - 09.07.yyyy
        - 29.07.yyyy
        - 15.01.196
        - "1821-02-29"
        - "8 сентября"
        - "12.09."
      value: null
    - match: 1972-08-10 or 1972-08-11
      values:
        - 1972-08-10
        - 1972-08-11
    - match: 27.11.1961/1965
      values:
        - "1965-11-27"
        - "1961-11-27"
    - match: "25.04.1960(1959)"
      values:
        - "1960-04-25"
        - "1959-04-25"
    - match: c 1957 or 14 March 1942
      values:
        - "1957"
        - 1942-03-14
    - match: 19 December 1980, or 19 January 1980
      values:
        - 1980-12-19
        - 1980-01-19
    - match: 11 November 1960, 11 November 1967, 11 November 1969, 1 January 1969
      values:
        - 1960-11-11
        - 1967-11-11
        - 1969-11-11
        - 1969-01-01
    - match: 27 May 1973, 1 Jan 1975
      values:
        - 1973-05-27
        - 1975-01-01
    - match: 17.01.2018, 29.05.2018
      values:
        - 2018-01-17
        - 2018-05-29
    - match: 20.10.2016 01.08.2018
      values:
        - 2016-10-20
        - 2018-08-01
    - match: 06.09.2017, 11.06.2018
      values:
        - 2017-09-06
        - 2018-06-11
    - match: 27.12.1979, 26.12.1979
      values:
        - 1979-12-26
        - 1979-12-27
    - match: 3017-08-22
      value: 2017-08-22
    - match: 0097-06-30
      value: 1997-06-30
    - match: 0017-05-26
      value: 2017-05-26
    - match: 3018-12-12
      value: 2018-12-12
    - match: 01 Jan 2015 to 31 Dec 2015
      value: "2015"
    - match: "01/10/1983,15/10/1983, 01/01/1980"
      values:
        - 1983-10-01
        - 1983-10-15
        - 1980-01-01
    - match:
        - 5 Feb. 1970 (this aka only, alt born 5 Feb. 1969
        - 5 Feb. 1970 (this aka only, born 5 Feb. 1969
      values:
        - 1969-02-05
        - 1970-02-05
    - match:
        - "1983年2(3)月10"
        - 1983年2(3)月10
      values:
        - 1983-02-10
        - 1983-03-10
    - match: 1977年8月から9月の間
      values:
        - 1977-08
        - 1977-09
    - match: 1/1/67; 16/6/67
      values:
        - 1967-01-01
        - 1967-06-16
    - match: 20.08.1955 (20.09.1955)
      values:
        - 1955-08-20
        - 1955-09-20
    - match: 03.09.1981 (03.08.1981)
      values:
        - 1981-09-03
        - 1981-08-03
    - match: 19.09.1987/19.10.1987
      values:
        - 1987-09-19
        - 1987-10-19
    - match: 20.01.1970/28.01.1970
      values:
        - 1970-01-20
        - 1970-01-28
    - match: 01.01.1954/21.07.1954
      value: 1954-07-21
    - match: 20.02.2000/29.02.2000
      value: 2000-02
    - match: 25.09.1950/25.10.1950
      values:
        - 1950-09-25
        - 1950-10-25
    - match: 01.07.1967 07.01.1967
      values:
        - 1967-07-01
        - 1967-01-07
    - match: 17.06.1973 - 24/25.03.2022
      value: 1973-06-17
    - match: "0968-06-19"
      value: 1968-06-19
    - match: 24 10. 1974
      value: 1974-10-24
    - match: "5/06/1953   15/06/1953"
      values:
        - 1953-06-05
        - 1953-06-15
    - match: "10/061962"
      values:
        - 1962-06-10
    - match: "11/10/1953  10/11/1953"
      values:
        - 1953-10-11
        - 1953-11-10
    - match: "23.10.1951/1953"
      values:
        - 1951-10-23
        - 1953-10-23
    - match: "16.12.1957 30.01.1986"
      values:
        - 1957-12-16
    - match: "24.08.1958 28.08.1958"
      values:
        - 1958-08-24
        - 1958-08-28
    - match: "15.05.1960 (07.07.1977)"
      values:
        - 1960-05-15
        - 1966-07-07
    - match: "29.02.1963 24.02.1963"
      values:
        - 1963-02-24
        # - 1963-02-29 - not a thing
    - match: "01.02.1979/01.02.1980"
      values:
        - 1979-02-01
        - 1980-02-01
    - match: 06.01.1996/07.01.1996
      values:
        - 1996-01-07
        - 1996-01-06
    - match: 07.05.1981/07.05.1979
      values:
        - 1981-05-07
        - 1979-05-07
    - match: 1.2.1994/6.3.2000
      values:
        - 1994-02-01
        - 2000-03-06
    - match: 26.12.2016/3.4.2017
      values:
        - 2016-12-26
        - 2017-04-03
    - match: Founded in 1997 as a State owned company, registered as a private company on 9 January 2019
      value: 2019-01-09
    - match: "03.1968-03.1969"
      values:
        - 1968
        - 1969
    - match: "01.02.1958-28.02.1958"
      value: 1958-02
    - match: "21.03.1965to20.03.1966"
      values:
        - 1965-03-21
        - 1966-03-20
    - match: "07.01.1967or01.07.1967"
      values:
        - "1967-01-07"
        - "1967-07-01"
    - match: "05.09.1962(1952)"
      value: "1962-09-05"
    - match: "23.08.1968(24.05.1972)"
      values:
        - "1968-08-23"
        - "1972-05-24"
    - match: "17.09.1961 г."
      value: "1961-09-17"
  map:
    "0202-11-22": "2020-11-22"
    "1951-06-31": "1951-06"
    "1985-02-29": "1985-02"
    "1946-02-29": "1946-02"
    "3012-01-01": "2012-01-01"
    "3005-03-24": "2005-03-24"
    "3006-02-13": "2006-02-13"
    "3003-02-20": "2003-02-20"
    "22-Fev-2022": "2022-02-22"
    "29.02.1987": "1987-02"
    "22-Fev-2023": "2023-02-22"
    "22-Fev-2025": "2025-02-22"
    "22-Fev-2027": "2027-02-22"
    "05.09.1990": "1990-09-05"
    "03.10.52": "1952-10-03"
    "16.11.1956 (?)": "1956-11-16"
    "1966-02-02-05:00": 1966-02-02T05:00
    "1960-01-01-05:00": 1960-01-01T05:00
    "1962-11-09-05:00": 1962-11-09T05:00
    "2015-04-07-04:00": 2015-04-07T04:00
    "2015-04-14-04:00": 2015-04-14T04:00
    "2015-07-01-04:00": 2015-07-01T04:00
    "2015-03-27-04:00": 2015-03-27T04:00
    "April 15, 1982": "1982-04-15"
    "March 25, 1957": "1957-03-25"
    "March 16, 1972": "1972-03-16"
    "April 1, 1978": "1987-04-01"
    "25 Sep1984": "1984-09-25"
    "26 Feb1993": "1993-02-26"
    "21 Mar1987": "1987-03-21"
    "29 Apr1994": "1994-04-29"
    "17 Nov1968": "1968-11-17"
    "26 Jun1959": "1959-06-26"
    "4 Apr1976": "1976-04-04"
    "22 Sept 1978": "1978-09-22"
    "February 8,1965": "1965-02-08"
    "06.02.1974": "1974-02-06"
    "24-Apr-68": "1968-04-24"
    "3 March 1979 (from false passport)": "1979-03-03"
    "Born at Belgrade, Republic of Serbia, on 19 December 1942": "1942-12-19"
    "Born on 2 July 1974": "1074-07-02"
    "Born on 10 July 1942": "1942-07-10"
    "Born at Pozarevac, Republic of Serbia, on 20 August 1941": "1941-08-20"
    "Born at Ravni, Republic of Serbia, on 1 June 1941": "1941-06-01"
    "Born at Bor, Republic of Serbia, on 7 December 1948": "1948-12-07"
    "07/04/62": "1962-04-07"
    "200812.19": "2008-12-19"
    "2007.713": "2007-07-13"
    "©1979年3月3": "1979-03-03"
    "60年": "1960"
    "20//4/2016": "2016-04-20"
    "1/1/67": "1967-01-01"
    "16/6/67": "1967-06-16"
    "13.111969": "1969-11-13"
    "10.022.1952": "1952-02-10"
    "122.04.1958": "1958-04-12"
    "29.02.1963": "1963-02"
    "3006-03-22": "2006-03-22"
    "3013-06-14": "2013-06-14"
    "3013-12-25": "2013-12-25"
    "12-01-1972": "1972-01-12"
    "5.1959": "1959"
    "24 .08.1973": "1973-08-24"
    "28.07.1953 - 29.03.2020": "1953-07-28"
    "11.27.1963": "1963-11-27"
    "24.04/1985": "1985-04-24"
    "16.11.1956??": "1956"
    "8 марта 1959": "1959-03-08"
    "9 августа 1976": "1976-08-09"
    "07.16.1962": "1962-07-16"
    "1982-25-09": "1982-09-25"
    "09/11/ 1954": "1954-11-09"
    "-07.07.1974": "1974-07-07"
    "1973-09-31": "1973-09"
    "05.25.1969": "1969-05-25"
    "16/092022": "2022-09-16"
    "0020-08-20": "2020-08-20"
    "0019-05-21": "2019-05-21"
    "3013-05-23": "2013-05-23"
    "05/04.08.1980": "1980-08-04"
    "0007-01-19": "2007-01-19"
    "1949-02-29": "1949-02"
    "1935-06-31": "1935-06"
    "29-Aprl-1967": "1967-04-29"
    "16/05/2011": "2011-05-16"
    "26/03/2012": "2012-03-26"
    "01 Sep 1990 to 30 Sep 1990": "1990-09"
    "19серпня1977": "1977-08-19"
    "1березня1967": "1967-03-01"
    "19квітня1967": "1967-04-19"
    "3серпня1950": "1950-08-03"
    "8серпня1948": "1948-08-08"
    "24.11.1988р": "1988-11-24"
    ".05.1959": "1959-05"
    "05021981": "1981-02-05"
    "01011964": "1964-01-01"
    "0803/2023": "2023-03-08"
    "23.11.1961р.н": "1961-11-23"
    "23.02.1969/": "1969-02-23"
    "01.01.1971to31.01.1971": "1971-01"
    "0203-05-10": "2023-05-10"
    "01.08.1980.": "1980-08-01"
    "11.02.1961 года": "1961-02-11"

email:
  options:
    - match:
        - www.surena gc.com
        - 43294
        - janak.ram@sansad
        - www.140zavod.by
        - com
        - vk.com
        - "https:"
        - "http:"
        - club68692201
        - luguard
        - luguardnews
        - "-"
        - j
        - No tiene
        - ministersecrcasapng.gov.pg
      contains:
        - https://vk.com/
        - http://vk.com/
        - "101193998017268"
      value: null
    # https://subchik.ru/organisations/7005
    - match: PRIYEMNAYA@YGDU
      value: PRIYEMNAYA@ygdu_gazprom.ru
    - match: "Email: info@gpc-sy.com"
      value: info@gpc-sy.com
    - match: and millim@silibank.com
      value: millim@silibank.com
    - match: "Email: scot50@scn-net.org"
      value: scot50@scn-net.org
    - match: request@mehr fci.ir
      value: request@mehr-fci.ir
    - match: info@etemad mobin.com
      value: info@etemad-mobin.com
    - match: aliyoum@assnatcm
      value: aliyoum@assnat.cm
    - match: barnabeloundou@assnatcm
      value: barnabeloundou@assnat.cm
    - match: marycamachotorres@gmail.commarycamachotorres@gmail.com
      value: marycamachotorres@gmail.com
    - match: giovani.bushishi@parliament@gov.rw
      value: giovani.bushishi@parliament.gov.rw
    - match: Victoria.Oliver@deputies.gov.ggvictoria1.oliver@icloud.com
      values:
        - Victoria.Oliver@deputies.gov.gg
        - victoria1.oliver@icloud.com
    - contains:
        - hotelminsk@udp.gov.by
      values:
        - hotelminsk@udp.gov.by
        - marketing@hotelminsk.by
    - match: la.khan7860@yahoo
      value: la.khan7860@yahoo.com
    - match: admin@europalforum org.uk
      value: admin@europalforum.org.uk
    - match: sogaz@sogaz.ru ;  cf@sogaz.ru
      values:
        - sogaz@sogaz.ru
        - cf@sogaz.ru
    - match: (1) bk@smpbank.ru (2) Money@smpbank.ru (3) smpbank@smpbank.ru
      values:
        - bk@smpbank.ru
        - Money@smpbank.ru
        - smpbank@smpbank.ru
    - match: (1) dalzavod@dcss.ru (2) ok@csdalzavod.ru
      values:
        - dalzavod@dcss.ru
        - ok@csdalzavod.ru
    - match: (1) info@scf-group.ru (2) pr@scf-group.ru (3) ir@scf-group.ru
      values:
        - info@scf-group.ru
        - pr@scf-group.ru
        - ir@scf-group.ru
    - match: office@grodno-khim.by; market@grodno-khim.by; ppm@grodno-khim.by; tnp@grodno-khim.by
      values:
        - office@grodno-khim.by
        - market@grodno-khim.by
        - ppm@grodno-khim.by
        - tnp@grodno-khim.by
    - match: (1) mobilisation@novorossia.co (2) novoross24@mail.ru (3) voenkom.dnr@mail.ru
      values:
        - mobilisation@novorossia.co
        - novoross24@mail.ru
        - voenkom.dnr@mail.ru
    - match: (1) press@zalivkerch.com (2) sess@zalivkerch.com (3) uzis@zalivkerch.com
      values:
        - press@zalivkerch.com
        - sess@zalivkerch.com
        - uzis@zalivkerch.com
    - match: (1) info@zala.aero (2) 20shrhrabota@gmail.com
      values:
        - info@zala.aero
        - 20shrhrabota@gmail.com
    - match: uav@kronshtadt.ru; office@kronshtadt.ru
      values:
        - uav@kronshtadt.ru
        - office@kronshtadt.ru
    - match: (1) info@radioautomatic.ru (2) sale@radioautomatic.ru
      values:
        - info@radioautomatic.ru
        - sale@radioautomatic.ru
    - match: info@metallic-sy.com / shaamco@mail.sy
      values:
        - info@metallic-sy.com
        - shaamco@mail.sy
    - match: office@bremino.by; marketing@bremino.by
      values:
        - office@bremino.by
        - marketing@bremino.by
    - match: knaru@morobe.gov.pg or knarumpg@gmail.com
      values:
        - knaru@morobe.gov.pg
        - knarumpg@gmail.com
    - match:
        - pac@silibank. com and kndic@co.chesin.com
        - pac@silibank.com and kndic@co.chesin.com
        - kndic@co.chesin.com.
      values:
        - pac@silibank.com
        - kndic@co.chesin.com
    - match:
        - "info@hamshointl.com and hamshogrou\u00adp@yahoo.com"
      values:
        - info@hamshointl.com
        - hamshogroup@yahoo.com
    - match: ryonha@ silibank.com
      value: ryonha@silibank.com
    - match: sjc117@ hotmail.com
      value: sjc117@hotmail.com
    - match: and millim@ silibank.com
      value: millim@silibank.com
    - match:
        - (1) magnolia.byx@yandex.ua (2) sicomplit@i.ua (3) t_c82@inbox.ru (4) zakupkj@chbrr.crimea.com
      values:
        - magnolia.byx@yandex.ua
        - sicomplit@i.ua
        - t_c82@inbox.ru
        - zakupkj@chbrr.crimea.com
    - match:
        - s.bank@scs‐net.org, post‐gm@net.sy
      values:
        - s.bank@scs‐net.org
        - post‐gm@net.sy
    - match: (1) dashtabadi@partosanat.com (2) Info@partosanat.com
      values:
        - dashtabadi@partosanat.com
        - Info@partosanat.com
    - match: "(1) www.farhang gostar.net/gtb (2) www.gtbir.com (3) www.taghtiran.ir (Email address): (1) gtb@farhanggostar.net (2) hnourib@yahoo.com (3) office@taghtiran.ir (4) taghtiran@gtbir.com"
      values:
        - gtb@farhanggostar.net
        - hnourib@yahoo.com
        - office@taghtiran.ir
        - taghtiran@gtbir.com
    - match: (1) info@stepfasteners.com (2) miladjafari@ekolay.net (3) purchase@stepfasteners.com (4) sales@stepfasteners.com
      values:
        - info@stepfasteners.com
        - miladjafari@ekolay.net
        - purchase@stepfasteners.com
        - sales@stepfasteners.com
    - match: (1) H.S@nvco.com (2) H.Sharifi@nvco.com (3) info@nvco.com (4) Marketing@nvco.com (5) Mostafavi@nvco.com
      values:
        - H.S@nvco.com
        - H.Sharifi@nvco.com
        - info@nvco.com
        - Marketing@nvco.com
        - Mostafavi@nvco.com
    - match: (1) mohammadreza.alizadeh@schillernovin.ir (2) schniller@dpimail.net
      values:
        - mohammadreza.alizadeh@schillernovin.ir
        - schniller@dpimail.net
    - match:
        - spccom2@scs‐net.org or spccom1@scsnet.org
        - (1) spccom1@scs-net.org (2) spccom2@scs-net.org
      values:
        - spccom2@scs‐net.org
        - spccom1@scsnet.org
    - match: (1) ermakova@intds.ru (2) lantsova@intgs.ru
      values:
        - ermakova@intds.ru
        - lantsova@intgs.ru
    - match: helmand_exchange_msp@ yahoo.com
      value: helmand_exchange_msp@yahoo.com
    - match: info@dsgd.ru; gmn@dsgd.ru
      values:
        - info@dsgd.ru
        - gmn@dsgd.ru
    - match: INFO@xn-----6kcbabo7acls0bmjmq4a8j.xn--p1ai
      value: info@закон-защита-право.рф
    - match: 1@xn----jtbuhicc1a.xn--p1ai
      value: 1@р-формер.рф

phone:
  options:
    - match:
        - "-4874878"
        - Indonesia
        - "43294"
      value: null

url:
  options:
    - contains: /het-politiek-college/
      value: null
    - contains: Samidoun.net
      values:
        - http://samidoun.net
        - http://palestinevaincra.com
    - match: ttp://www.koutsoukosgiannis.gr
      value: http://www.koutsoukosgiannis.gr
    - match: "טוויטר: Addameer"
      value: https://twitter.com/Addameer
    - match: "טוויטר: @PalesAbroadE"
      value: https://twitter.com/PalesAbroadE
    - match: "טוויטר: @EuroPalForum"
      value: https://twitter.com/EuroPalForum
    - match: Olimpia Teligioridou (facebook)
      value: null

gender:
  # Welcome to the wonderful world of police databases:
  lowercase: true
  normalize: true
  options:
    - match:
        - Female
        - Féminin
        - F
        - female
        - femail
        - transgender female
        - trans woman
        - cisgender female
      value: female
    - match:
        - MALE
        - Male
        - Masculin
        - male
        - M
        - transgender male
        - cisgender male
        - trans man
        - assigned male at birth
      contains:
        - мужской
      value: male
    - match:
        - U
        - Unknown
        - undisclosed gender
        - transgender person
        - transgender
        - ""
      value: null
    - match:
        - non-binary
        - intersex
        - travesti
        - pangender
        - genderqueer
        - genderfluid
        - neutrois
        - kathoey
        - two-spirit
        - agender
        - eunuch
      value: other

fulladdress:
  # SELECT value, COUNT(entity_id) FROM statement WHERE prop = 'full' GROUP BY value ORDER BY COUNT(*) DESC;
  lowercase: true
  options:
    - match:
        - Unknown
        - Address Unknown
        - UNKNOWN ADDRESS
        - "Address:"
        - "-"
        - "na"
        - "n/a"
        - "ISLE OF MAN"
        - Qatar
        - Lebanon
        - Russia
        - Philippines
        - Peru
        - Panama
        - Somalia
        - Turkey
      value: null
